ticker,class,figi,isin,und_bench_isin,security,name,type,coupon,cpn_type,dcc,cpn_freq,days_settle,start_date,cpn_first,acc_first,maturity,mty_typ,rank,amt_out,country,currency,status,term,TTM,date,bidPrice,askPrice,bidYield,askYield,midPrice,midYield,calc_yield,calc_zspread,calc_dv01,calc_duration,calc_convexity
AAPL,Corp,BBG004HST0K7,US037833AL42,US912810TZ12,AAPL 3.85 05/04/43,APPLE INC,GLOBAL,3.85,FIXED,30/360,2,2,2013-05-03,2013-11-04,2013-05-03,2043-05-04,AT MATURITY,Sr Unsecured,3000.0,US,USD,ACTV,30.001368925393567,19.069130732375086,2024-04-08,84.578,85.153,5.127,5.074,84.8655,5.1005,5.1004189178347605,18.533830712890513,11.622847722404247,12.721344410706408,214.21372129245904
AAPL,Corp,BBG006F8VWJ7,US037833AT77,US912810TZ12,AAPL 4.45 05/06/44,APPLE INC,GLOBAL,4.45,FIXED,30/360,2,2,2014-05-06,2014-11-06,2014-05-06,2044-05-06,AT MATURITY,Sr Unsecured,1000.0,US,USD,ACTV,30.001368925393567,20.076659822039698,2024-04-08,92.578,93.293,5.042,4.982,92.9355,5.0120000000000005,5.0119549706578255,9.782833274015392,12.599340573036327,12.715945158945386,219.88199659259314
AAPL,Corp,BBG0081TNL50,US037833BA77,US912810TZ12,AAPL 3.45 02/09/45,APPLE INC,GLOBAL,3.45,FIXED,30/360,2,2,2015-02-09,2015-08-09,2015-02-09,2045-02-09,AT MATURITY,Sr Unsecured,2000.0,US,USD,ACTV,30.001368925393567,20.840520191649556,2024-04-08,78.406,78.952,5.152,5.102,78.679,5.127000000000001,5.127133511006832,21.006330063853408,11.724114026726646,13.889087869567204,254.0139418829879
AAPL,Corp,BBG008N1BQC1,US037833BH21,US912810TZ12,AAPL 4 3/8 05/13/45,APPLE INC,GLOBAL,4.375,FIXED,30/360,2,2,2015-05-13,2015-11-13,2015-05-13,2045-05-13,AT MATURITY,Sr Unsecured,2000.0,US,USD,ACTV,30.001368925393567,21.09514031485284,2024-04-08,90.009,90.602,5.157,5.108,90.3055,5.1325,5.132465250790121,21.675823444823674,12.876345584560138,13.14023087803901,236.68778859000855
AAPL,Corp,BBG00C7QBCQ1,US037833BW97,US91282CJZ59,AAPL 4 1/2 02/23/36,APPLE INC,GLOBAL,4.5,FIXED,30/360,2,2,2016-02-23,2016-08-23,2016-02-23,2036-02-23,CALLABLE,Sr Unsecured,1250.0,US,USD,ACTV,20.0,11.876796714579056,2024-04-08,97.413,97.894,4.788,4.733,97.65350000000001,4.7605,4.7604929730296135,-15.0915899686919,9.12404734298485,9.077989465436586,101.38020580470959
AAPL,Corp,BBG00C7QBG91,US037833BX70,US912810TZ12,AAPL 4.65 02/23/46,APPLE INC,GLOBAL,4.65,FIXED,30/360,2,2,2016-02-23,2016-08-23,2016-02-23,2046-02-23,CALLABLE,Sr Unsecured,4000.0,US,USD,ACTV,30.001368925393567,21.87816563997262,2024-04-08,93.47,94.151,5.151,5.096,93.81049999999999,5.1235,5.1234105452895164,20.675403491231272,13.455707949767415,13.41301207296035,246.8528100100902
AAPL,Corp,BBG00C7QB7Q2,US037833BY53,US91282CKH33,AAPL 3 1/4 02/23/26,APPLE INC,GLOBAL,3.25,FIXED,30/360,2,2,2016-02-23,2016-08-23,2016-02-23,2026-02-23,CALLABLE,Sr Unsecured,3250.0,US,USD,ACTV,10.001368925393566,1.8781656399726214,2024-04-08,96.954,97.144,4.974,4.865,97.049,4.9195,4.9194103851914415,-0.20160753510922527,1.761183791087457,1.8046906572359567,4.190391525468004
AAPL,Corp,BBG00DHQX240,US037833BZ29,US91282CKH33,AAPL 2.45 08/04/26,APPLE INC,GLOBAL,2.45,FIXED,30/360,2,2,2016-08-04,2017-02-04,2016-08-04,2026-08-04,CALLABLE,Sr Unsecured,2250.0,US,USD,ACTV,9.998631074606434,2.321697467488022,2024-04-08,94.648,94.84,4.921,4.829,94.744,4.875,4.875241779303929,-3.641648399712365,2.130008158450082,2.2302329466732758,6.149241832926796
AAPL,Corp,BBG00DHQX9M5,US037833CD08,US912810TZ12,AAPL 3.85 08/04/46,APPLE INC,GLOBAL,3.85,FIXED,30/360,2,2,2016-08-04,2017-02-04,2016-08-04,2046-08-04,CALLABLE,Sr Unsecured,2000.0,US,USD,ACTV,29.998631074606433,22.321697467488022,2024-04-08,82.485,83.073,5.183,5.132,82.779,5.1575,5.1575915592139,24.078222271774603,12.612355243576912,14.090592034654204,269.0136872843194
AAPL,Corp,BBG00FXTSMV3,US037833CH12,US912810TZ12,AAPL 4 1/4 02/09/47,APPLE INC,GLOBAL,4.25,FIXED,30/360,2,2,2017-02-09,2017-08-09,2017-02-09,2047-02-09,CALLABLE,Sr Unsecured,1000.0,US,USD,ACTV,29.998631074606433,22.83915126625599,2024-04-08,88.569,89.316,5.103,5.043,88.9425,5.073,5.072795026004314,15.680560713808207,13.289326370352935,13.969875882429788,268.49525609317567
AAPL,Corp,BBG00FXTS8Z0,US037833CJ77,US91282CKE02,AAPL 3.35 02/09/27,APPLE INC,GLOBAL,3.35,FIXED,30/360,2,2,2017-02-09,2017-08-09,2017-02-09,2027-02-09,CALLABLE,Sr Unsecured,2250.0,US,USD,ACTV,9.998631074606434,2.839151266255989,2024-04-08,96.069,96.277,4.851,4.77,96.173,4.810499999999999,4.810640715062618,-10.603929985212666,2.6044212498235053,2.68005226783952,8.700563454150434
AAPL,Corp,BBG00GNBL206,US037833CR93,US91282CKE02,AAPL 3.2 05/11/27,APPLE INC,GLOBAL,3.2,FIXED,30/360,2,2,2017-05-11,2017-11-11,2017-05-11,2027-05-11,CALLABLE,Sr Unsecured,2000.0,US,USD,ACTV,9.998631074606434,3.0882956878850103,2024-04-08,95.278,95.526,4.865,4.775,95.402,4.82,4.8203582144012005,-8.622272613366501,2.8079774130968023,2.8845930673183666,10.058707793858268
AAPL,Corp,BBG00GXJ4BZ9,US037833CX61,US91282CKE02,AAPL 3 06/20/27,APPLE INC,GLOBAL,3.0,FIXED,30/360,2,2,2017-06-20,2017-12-20,2017-06-20,2027-06-20,CALLABLE,Sr Unsecured,1000.0,US,USD,ACTV,9.998631074606434,3.1978097193702943,2024-04-08,94.719,94.98,4.801,4.71,94.8495,4.7555,4.755523909170821,-15.199188237495665,2.892811798985152,3.0020991064633042,10.790904515867902
AAPL,Corp,BBG00HMQPZ05,US037833DB33,US91282CKE02,AAPL 2.9 09/12/27,APPLE INC,GLOBAL,2.89999999999999,FIXED,30/360,2,2,2017-09-12,2018-03-12,2017-09-12,2027-09-12,CALLABLE,Sr Unsecured,2000.0,US,USD,ACTV,9.998631074606434,3.4277891854893907,2024-04-08,94.099,94.329,4.789,4.713,94.214,4.7509999999999994,4.7511339856195445,-15.938508704675622,3.074262666187822,3.23407815971313,12.342587704389054
AAPL,Corp,BBG00HMQQ207,US037833DD98,US912810TZ12,AAPL 3 3/4 09/12/47,APPLE INC,GLOBAL,3.75,FIXED,30/360,2,2,2017-09-12,2018-03-12,2017-09-12,2047-09-12,CALLABLE,Sr Unsecured,1000.0,US,USD,ACTV,29.998631074606433,23.42778918548939,2024-04-08,80.108,80.728,5.233,5.18,80.418,5.2065,5.206276811659337,28.92352110172626,12.80185995603464,14.610848092112578,290.4773733618874
AAPL,Corp,BBG00J59Z1H4,US037833DG20,US912810TZ12,AAPL 3 3/4 11/13/47,APPLE INC,GLOBAL,3.75,FIXED,30/360,2,2,2017-11-13,2018-05-13,2017-11-13,2047-11-13,CALLABLE,Sr Unsecured,1250.0,US,USD,ACTV,29.998631074606433,23.59753593429158,2024-04-08,80.147,80.862,5.223,5.162,80.50450000000001,5.1925,5.192564733326435,27.562866953627342,12.834425185419805,14.445415642636931,288.7899314801371
AAPL,Corp,BBG00J59YWR6,US037833DK32,US91282CKE02,AAPL 3 11/13/27,APPLE INC,GLOBAL,3.0,FIXED,30/360,2,2,2017-11-13,2018-05-13,2017-11-13,2027-11-13,CALLABLE,Sr Unsecured,1500.0,US,USD,ACTV,9.998631074606434,3.597535934291581,2024-04-08,94.433,94.697,4.702,4.618,94.565,4.66,4.660124069050429,-24.943219083199235,3.2188835841481,3.3448707028794544,13.300000258912352
AAPL,Corp,BBG00Q5L6G35,US037833DN70,US91282CKH33,AAPL 2.05 09/11/26,APPLE INC,GLOBAL,2.04999999999999,FIXED,30/360,2,2,2019-09-11,2020-03-11,2019-09-11,2026-09-11,CALLABLE,Sr Unsecured,2000.0,US,USD,ACTV,7.000684462696783,2.425735797399042,2024-04-08,93.586,93.795,4.893,4.796,93.6905,4.8445,4.844330333173275,-6.909302135294366,2.207092426350143,2.3424899207506935,6.7044937310624775
AAPL,Corp,BBG00Q5L6G53,US037833DP29,US91282CKG59,AAPL 2.2 09/11/29,APPLE INC,GLOBAL,2.2,FIXED,30/360,2,2,2019-09-11,2020-03-11,2019-09-11,2029-09-11,CALLABLE,Sr Unsecured,1750.0,US,USD,ACTV,10.001368925393566,5.426420260095825,2024-04-08,87.902,88.218,4.758,4.687,88.06,4.7225,4.722531370818615,-18.87076647158739,4.529551192844161,5.047870891741656,28.95858188564763
AAPL,Corp,BBG00Q5L6G62,US037833DQ02,US912810TV08,AAPL 2.95 09/11/49,APPLE INC,GLOBAL,2.95,FIXED,30/360,2,2,2019-09-11,2020-03-11,2019-09-11,2049-09-11,CALLABLE,Sr Unsecured,1500.0,US,USD,ACTV,30.001368925393567,25.426420260095824,2024-04-08,68.718,69.247,5.177,5.128,68.9825,5.1525,5.15236461626644,23.590735168328177,12.120517339385621,16.064513258609992,349.430195520109
AAPL,Corp,BBG00TN2PMV6,US037833DU14,US91282CKG59,AAPL 1.65 05/11/30,APPLE INC,GLOBAL,1.64999999999999,FIXED,30/360,2,2,2020-05-11,2020-11-11,2020-05-11,2030-05-11,CALLABLE,Sr Unsecured,1750.0,US,USD,ACTV,9.998631074606434,6.0889801505817935,2024-04-08,83.431,83.737,4.824,4.759,83.584,4.7915,4.791338466107846,-11.777749026225916,4.885281721309676,5.668164298952865,36.25048535782451
AAPL,Corp,BBG00TN2PN26,US037833DW79,US912810TV08,AAPL 2.65 05/11/50,APPLE INC,GLOBAL,2.64999999999999,FIXED,30/360,2,2,2020-05-11,2020-11-11,2020-05-11,2050-05-11,CALLABLE,Sr Unsecured,2500.0,US,USD,ACTV,29.998631074606433,26.088980150581794,2024-04-08,64.305,64.774,5.153,5.109,64.5395,5.131,5.1311099752783775,21.542113871296795,11.769473781213554,16.441913331610706,369.13890822657504
AAPL,Corp,BBG00WNPK2K9,US037833DY36,US91282CKG59,AAPL 1 1/4 08/20/30,APPLE INC,GLOBAL,1.25,FIXED,30/360,2,2,2020-08-20,2021-02-20,2020-08-20,2030-08-20,CALLABLE,Sr Unsecured,1250.0,US,USD,ACTV,9.998631074606434,6.365503080082136,2024-04-08,80.694,81.05,4.809,4.735,80.872,4.772,4.771618686616421,-13.847532738489907,4.99510829393691,6.019349833095793,40.246593468645806
AAPL,Corp,BBG00WNPK2R2,US037833DZ01,US912810TV08,AAPL 2.4 08/20/50,APPLE INC,GLOBAL,2.39999999999999,FIXED,30/360,2,2,2020-08-20,2021-02-20,2020-08-20,2050-08-20,CALLABLE,Sr Unsecured,1250.0,US,USD,ACTV,29.998631074606433,26.365503080082135,2024-04-08,60.931,61.572,5.115,5.054,61.2515,5.0845,5.084647960960864,16.919631281467243,11.423388698394938,17.094280509064024,391.0659014410083
AAPL,Corp,BBG00WNPK2W6,US037833EA41,US912810TV08,AAPL 2.55 08/20/60,APPLE INC,GLOBAL,2.54999999999999,FIXED,30/360,2,2,2020-08-20,2021-02-20,2020-08-20,2060-08-20,CALLABLE,Sr Unsecured,1750.0,US,USD,ACTV,40.0,36.3668720054757,2024-04-08,60.371,61.149,4.893,4.827,60.760000000000005,4.859999999999999,4.85988437384367,-5.24230333817773,12.649794781078036,19.124596346358413,547.8036175801562
AAPL,Corp,BBG00Z3VQ5F4,US037833EB24,US91282CKH33,AAPL 0.7 02/08/26,APPLE INC,GLOBAL,0.699999999999999,FIXED,30/360,2,2,2021-02-08,2021-08-08,2021-02-08,2026-02-08,CALLABLE,Sr Unsecured,2500.0,US,USD,ACTV,4.999315537303217,1.83709787816564,2024-04-08,92.554,92.717,5.014,4.914,92.63550000000001,4.964,4.963962696492671,3.9950812489612804,1.677137655324351,1.8012309155997015,4.135200900085622
AAPL,Corp,BBG00Z3VQ5H2,US037833EC07,US91282CKG59,AAPL 1.2 02/08/28,APPLE INC,GLOBAL,1.2,FIXED,30/360,2,2,2021-02-08,2021-08-08,2021-02-08,2028-02-08,CALLABLE,Sr Unsecured,2500.0,US,USD,ACTV,6.997946611909651,3.8357289527720737,2024-04-08,87.693,87.92,4.754,4.683,87.8065,4.7185,4.7187537572152864,-19.431754883529827,3.282206218542687,3.699635952873596,15.70864122245969
AAPL,Corp,BBG00Z3VQ5K8,US037833ED89,US91282CJZ59,AAPL 1.65 02/08/31,APPLE INC,GLOBAL,1.64999999999999,FIXED,30/360,2,2,2021-02-08,2021-08-08,2021-02-08,2031-02-08,CALLABLE,Sr Unsecured,2750.0,US,USD,ACTV,9.998631074606434,6.836413415468857,2024-04-08,81.969,82.27,4.775,4.717,82.11949999999999,4.746,4.7463061437010765,-16.631546210999765,5.34092605732667,6.345670119162708,45.07927594964541
AAPL,Corp,BBG00Z3VQ5X4,US037833EE62,US912810TZ12,AAPL 2 3/8 02/08/41,APPLE INC,GLOBAL,2.375,FIXED,30/360,2,2,2021-02-08,2021-08-08,2021-02-08,2041-02-08,CALLABLE,Sr Unsecured,1500.0,US,USD,ACTV,20.0,16.83778234086242,2024-04-08,69.527,69.969,5.093,5.044,69.74799999999999,5.0685,5.0680801942944536,15.16146744303327,9.635100010320736,13.015284302799966,205.39528215988705
AAPL,Corp,BBG00Z3VQ626,US037833EF38,US912810TV08,AAPL 2.65 02/08/51,APPLE INC,GLOBAL,2.64999999999999,FIXED,30/360,2,2,2021-02-08,2021-08-08,2021-02-08,2051-02-08,CALLABLE,Sr Unsecured,3000.0,US,USD,ACTV,29.998631074606433,26.836413415468858,2024-04-08,63.832,64.302,5.153,5.109,64.06700000000001,5.131,5.13069274276495,21.394231848868824,11.894453473136668,16.835582947356503,386.27275776568973
AAPL,Corp,BBG00Z3VQ653,US037833EG11,US912810TV08,AAPL 2.8 02/08/61,APPLE INC,GLOBAL,2.79999999999999,FIXED,30/360,2,2,2021-02-08,2021-08-08,2021-02-08,2061-02-08,CALLABLE,Sr Unsecured,1750.0,US,USD,ACTV,40.0,36.837782340862425,2024-04-08,61.786,62.491,5.115,5.054,62.1385,5.0845,5.084327019751073,16.830667752673442,13.24806501280402,18.747488601066536,534.3955878660398
AAPL,Corp,BBG011ZS1T38,US037833EH93,US91282CKG59,AAPL 1.4 08/05/28,APPLE INC,GLOBAL,1.39999999999999,FIXED,30/360,2,2,2021-08-05,2022-02-05,2021-08-05,2028-08-05,CALLABLE,Sr Unsecured,2300.0,US,USD,ACTV,7.000684462696783,4.32580424366872,2024-04-08,87.176,87.43,4.716,4.645,87.303,4.6805,4.680296041071415,-23.019096778539183,3.6582735194435507,4.139565817433165,19.52033851203988
AAPL,Corp,BBG011ZS1WL1,US037833EJ59,US91282CJZ59,AAPL 1.7 08/05/31,APPLE INC,GLOBAL,1.7,FIXED,30/360,2,2,2021-08-05,2022-02-05,2021-08-05,2031-08-05,CALLABLE,Sr Unsecured,1000.0,US,USD,ACTV,9.998631074606434,7.323750855578371,2024-04-08,81.093,81.427,4.793,4.731,81.26,4.7620000000000005,4.762060232460498,-14.803725676719006,5.6322420374343825,6.748987308522085,51.01653405167275
AAPL,Corp,BBG011ZS1X57,US037833EK23,US912810TV08,AAPL 2.7 08/05/51,APPLE INC,GLOBAL,2.7,FIXED,30/360,2,2,2021-08-05,2022-02-05,2021-08-05,2051-08-05,CALLABLE,Sr Unsecured,1800.0,US,USD,ACTV,29.998631074606433,27.32375085557837,2024-04-08,64.21,64.741,5.157,5.108,64.4755,5.1325,5.132179309473017,21.589677299255584,12.04422449495799,16.900823148620955,392.3027784681656
AAPL,Corp,BBG011ZS1XQ4,US037833EL06,US912810TV08,AAPL 2.85 08/05/61,APPLE INC,GLOBAL,2.85,FIXED,30/360,2,2,2021-08-05,2022-02-05,2021-08-05,2061-08-05,CALLABLE,Sr Unsecured,1400.0,US,USD,ACTV,40.0,37.32511978097194,2024-04-08,62.412,63.072,5.117,5.061,62.742000000000004,5.089,5.089108634108864,17.327984984446392,13.389036959659741,18.732594166806567,537.0999925442183
AAPL,Corp,BBG0191F26Z0,US037833EN61,US91282CKG59,AAPL 3 1/4 08/08/29,APPLE INC,GLOBAL,3.25,FIXED,30/360,2,3,2022-08-08,2023-02-08,2022-08-08,2029-08-08,CALLABLE,Sr Unsecured,1000.0,US,USD,ACTV,7.000684462696783,5.333333333333333,2024-04-08,92.963,93.266,4.76,4.692,93.11449999999999,4.726,4.7268195524811745,-18.368325470617286,4.5952748507601004,4.8286832052982165,27.032056909029862
AAPL,Corp,BBG0191F2797,US037833EP10,US91282CJZ59,AAPL 3.35 08/08/32,APPLE INC,GLOBAL,3.35,FIXED,30/360,2,3,2022-08-08,2023-02-08,2022-08-08,2032-08-08,CALLABLE,Sr Unsecured,1500.0,US,USD,ACTV,10.001368925393566,8.334017796030116,2024-04-08,90.162,90.578,4.796,4.731,90.37,4.7635000000000005,4.764164037306271,-14.718341721498271,6.642941870264343,7.128229765316106,59.29486821706846
AAPL,Corp,BBG0191F27S6,US037833EQ92,US912810TV08,AAPL 3.95 08/08/52,APPLE INC,GLOBAL,3.95,FIXED,30/360,2,3,2022-08-08,2023-02-08,2022-08-08,2052-08-08,CALLABLE,Sr Unsecured,1750.0,US,USD,ACTV,30.001368925393567,28.334017796030118,2024-04-08,81.821,82.501,5.18,5.128,82.161,5.154,5.153994403779507,23.711816617699622,14.317619986127118,15.755376840984924,358.6042162639229
AAPL,Corp,BBG0191F2877,US037833ER75,US912810TV08,AAPL 4.1 08/08/62,APPLE INC,GLOBAL,4.09999999999999,FIXED,30/360,2,3,2022-08-08,2023-02-08,2022-08-08,2062-08-08,CALLABLE,Sr Unsecured,1250.0,US,USD,ACTV,40.0,38.332648870636554,2024-04-08,82.107,82.823,5.178,5.128,82.465,5.1530000000000005,5.153144441545009,23.636268266050944,16.420878498046072,17.44812466724364,482.44835020170905
AAPL,Corp,BBG01GKRFG18,US037833ES58,US91282CKH33,AAPL 4.421 05/08/26,APPLE INC,GLOBAL,4.421,FIXED,30/360,2,2,2023-05-10,2023-11-08,2023-05-10,2026-05-08,CALLABLE,Sr Unsecured,1000.0,US,USD,ACTV,2.9952087611225187,2.080766598220397,2024-04-08,99.283,99.534,4.786,4.657,99.4085,4.7215,4.721480302512646,-18.32079711080201,1.9722403640006332,1.947669487671842,4.889639909511829
AAPL,Corp,BBG01GKRFG36,US037833ET32,US91282CKG59,AAPL 4 05/10/28,APPLE INC,GLOBAL,4.0,FIXED,30/360,2,2,2023-05-10,2023-11-10,2023-05-10,2028-05-10,CALLABLE,Sr Unsecured,1500.0,US,USD,ACTV,5.002053388090349,4.087611225188227,2024-04-08,97.614,97.911,4.647,4.566,97.7625,4.6065000000000005,4.6065168008208275,-30.05323526616568,3.692250048686998,3.6952968439475726,16.317860884558133
AAPL,Corp,BBG01GKRFG72,US037833EU05,US91282CKG59,AAPL 4.15 05/10/30,APPLE INC,GLOBAL,4.15,FIXED,30/360,2,2,2023-05-10,2023-11-10,2023-05-10,2030-05-10,CALLABLE,Sr Unsecured,500.0,US,USD,ACTV,7.000684462696783,6.0862422997946615,2024-04-08,97.534,97.859,4.619,4.556,97.6965,4.5875,4.587625466287134,-31.87194889002357,5.283070833736568,5.26177229772384,32.87062811179292
AAPL,Corp,BBG01GKRFGH1,US037833EV87,US91282CJZ59,AAPL 4.3 05/10/33,APPLE INC,GLOBAL,4.29999999999999,FIXED,30/360,2,2,2023-05-10,2023-11-10,2023-05-10,2033-05-10,CALLABLE,Sr Unsecured,1000.0,US,USD,ACTV,10.001368925393566,9.086926762491444,2024-04-08,97.964,98.447,4.576,4.51,98.2055,4.542999999999999,4.542864225804806,-36.37399283324464,7.399754917745722,7.334902484122827,65.09991201002948
AAPL,Corp,BBG01GKRFGQ1,US037833EW60,US912810TV08,AAPL 4.85 05/10/53,APPLE INC,GLOBAL,4.84999999999999,FIXED,30/360,2,2,2023-05-10,2023-11-10,2023-05-10,2053-05-10,CALLABLE,Sr Unsecured,1250.0,US,USD,ACTV,30.001368925393567,29.086926762491444,2024-04-08,96.675,97.407,5.07,5.02,97.041,5.045,5.0448047444224375,13.022238544221857,16.057417558856667,15.058507119560677,339.96856187276444
DIS,Corp,BBG00QNKGJP6,US254687DK97,US91282CKH33,DIS 3 3/8 11/15/26,WALT DISNEY COMPANY/THE,GLOBAL,3.375,FIXED,30/360,2,2,2019-11-22,2020-05-15,2019-11-15,2026-11-15,CALLABLE,Sr Unsecured,436.285,US,USD,ACTV,6.981519507186858,2.6036960985626285,2024-04-08,95.894,96.146,5.081,4.974,96.02000000000001,5.0275,5.027415297925472,11.107521259784741,2.404633047392542,2.446272073305729,7.389465783936947
DIS,Corp,BBG00QNKP8R8,US254687DV52,US91282CJZ59,DIS 6.55 03/15/33,WALT DISNEY COMPANY/THE,GLOBAL,6.54999999999999,FIXED,30/360,2,2,2019-11-22,2020-03-15,2019-09-15,2033-03-15,AT MATURITY,Sr Unsecured,342.347,US,USD,ACTV,13.311430527036277,8.933607118412047,2024-04-08,111.169,111.818,4.984,4.9,111.4935,4.942,4.941939406096934,2.9865036134719007,8.012194238884195,6.903108636304641,58.82875210209212
DIS,Corp,BBG00QNKR4J4,US254687DZ66,US91282CJZ59,DIS 6.2 12/15/34,WALT DISNEY COMPANY/THE,GLOBAL,6.2,FIXED,30/360,2,2,2019-11-22,2019-12-15,2019-06-15,2034-12-15,AT MATURITY,Sr Unsecured,982.472,US,USD,ACTV,15.063655030800822,10.685831622176591,2024-04-08,108.949,109.496,5.102,5.038,109.2225,5.07,5.069990910589696,15.49575422038869,9.182230356959737,7.8609152987576625,78.33073862855822
DIS,Corp,BBG00QNKRV04,US254687EB89,US91282CJZ59,DIS 6.4 12/15/35,WALT DISNEY COMPANY/THE,GLOBAL,6.4,FIXED,30/360,2,2,2019-11-22,2019-12-15,2019-06-15,2035-12-15,AT MATURITY,Sr Unsecured,971.816,US,USD,ACTV,16.06297056810404,11.685147159479808,2024-04-08,109.944,110.61,5.249,5.177,110.277,5.212999999999999,5.213094897568227,29.61790769292657,9.963041269751384,8.338972959218049,89.37403204977264
DIS,Corp,BBG00QNKSCY8,US254687EF93,US91282CJZ59,DIS 6.15 03/01/37,WALT DISNEY COMPANY/THE,GLOBAL,6.15,FIXED,30/360,2,2,2019-11-22,2020-03-01,2019-09-01,2037-03-01,AT MATURITY,Sr Unsecured,320.934,US,USD,ACTV,17.27310061601643,12.895277207392198,2024-04-08,107.31,108.08,5.357,5.277,107.695,5.317,5.317001588642597,39.876288912566466,10.607293261720379,9.113113906654743,106.4282192665196
DIS,Corp,BBG00QNKSBB5,US254687EH59,US91282CJZ59,DIS 6.65 11/15/37,WALT DISNEY COMPANY/THE,GLOBAL,6.65,FIXED,30/360,2,2,2019-11-22,2020-05-15,2019-11-15,2037-11-15,AT MATURITY,Sr Unsecured,1223.938,US,USD,ACTV,17.982203969883642,13.604380561259411,2024-04-08,113.057,113.653,5.29,5.233,113.355,5.2615,5.26186755328968,34.360281878236464,11.361026428358025,9.156718078576606,110.98571562918536
DIS,Corp,BBG00QNKVGW7,US254687ER32,US912810TZ12,DIS 6.15 02/15/41,WALT DISNEY COMPANY/THE,GLOBAL,6.15,FIXED,30/360,2,2,2019-11-22,2020-02-15,2019-08-15,2041-02-15,AT MATURITY,Sr Unsecured,631.871,US,USD,ACTV,21.234770704996578,16.856947296372347,2024-04-08,107.933,108.671,5.425,5.361,108.302,5.393,5.392943681443514,47.17865904874785,12.889232561173205,10.847662754628592,157.69972429148257
DIS,Corp,BBG00QNKVNZ9,US254687ET97,US912810TZ12,DIS 5.4 10/01/43,WALT DISNEY COMPANY/THE,GLOBAL,5.4,FIXED,30/360,2,2,2019-11-22,2020-04-01,2019-10-01,2043-10-01,AT MATURITY,Sr Unsecured,679.686,US,USD,ACTV,23.857631759069132,19.479808350444902,2024-04-08,99.938,100.657,5.405,5.345,100.2975,5.375,5.375030305893534,45.54965646665949,13.398435588588306,12.23746351230105,202.35120771766225
DIS,Corp,BBG00QNKKN90,US254687EV44,US912810TZ12,DIS 4 3/4 09/15/44,WALT DISNEY COMPANY/THE,GLOBAL,4.75,FIXED,30/360,2,2,2019-11-22,2020-03-15,2019-09-15,2044-09-15,CALLABLE,Sr Unsecured,588.724,US,USD,ACTV,24.815879534565365,20.438056125941138,2024-04-08,91.406,92.21,5.452,5.383,91.80799999999999,5.4175,5.417580209672451,49.71817081698539,13.092688727928103,12.892246093543655,224.49521256568067
DIS,Corp,BBG00QNKKP22,US254687EX00,US912810TZ12,DIS 4.95 10/15/45,WALT DISNEY COMPANY/THE,GLOBAL,4.95,FIXED,30/360,2,2,2019-11-22,2020-04-15,2019-10-15,2045-10-15,CALLABLE,Sr Unsecured,398.301,US,USD,ACTV,25.897330595482547,21.519507186858316,2024-04-08,93.156,93.958,5.496,5.429,93.557,5.4625,5.462732054293157,54.19264846966771,13.712015717090274,12.881614952153084,232.42408281662478
DIS,Corp,BBG00QNKKP86,US254687EZ57,US912810TZ12,DIS 7 3/4 12/01/45,WALT DISNEY COMPANY/THE,GLOBAL,7.75,FIXED,30/360,2,2,2019-11-22,2019-12-01,2019-06-01,2045-12-01,AT MATURITY,Sr Unsecured,324.485,US,USD,ACTV,26.026009582477755,21.648186173853524,2024-04-08,127.591,128.731,5.544,5.468,128.161,5.506,5.506254652887583,58.44358835356251,17.162649624320565,11.85266132842181,203.70272325397735
DIS,Corp,BBG00QNKKP68,US254687FB70,US912810TZ12,DIS 4 3/4 11/15/46,WALT DISNEY COMPANY/THE,GLOBAL,4.75,FIXED,30/360,2,2,2019-11-22,2020-05-15,2019-11-15,2046-11-15,CALLABLE,Sr Unsecured,399.892,US,USD,ACTV,26.981519507186857,22.60369609856263,2024-04-08,90.146,90.85,5.518,5.459,90.49799999999999,5.4885,5.488497041165828,56.71567407316735,13.859055999434737,13.404936093811001,252.3444563660468
DIS,Corp,BBG00Q5D3237,US254687FL52,US91282CKG59,DIS 2 09/01/29,WALT DISNEY COMPANY/THE,GLOBAL,2.0,FIXED,30/360,2,2,2019-09-06,2020-03-01,2019-09-06,2029-09-01,CALLABLE,Sr Unsecured,2000.0,US,USD,ACTV,9.987679671457906,5.3990417522245036,2024-04-08,86.177,86.487,4.952,4.88,86.332,4.916,4.916237406432629,0.16987575073902017,4.479263575530867,5.046258750603753,28.866803664138097
DIS,Corp,BBG00Q5D3246,US254687FM36,US912810TV08,DIS 2 3/4 09/01/49,WALT DISNEY COMPANY/THE,GLOBAL,2.75,FIXED,30/360,2,2,2019-09-06,2020-03-01,2019-09-06,2049-09-01,CALLABLE,Sr Unsecured,2000.0,US,USD,ACTV,29.987679671457904,25.399041752224505,2024-04-08,64.217,64.929,5.34,5.271,64.57300000000001,5.3055,5.305613569915295,38.67587030133645,11.803547927075428,16.291521367944448,356.7940733382822
DIS,Corp,BBG00SMMG3C8,US254687FP66,US91282CKE02,DIS 3.7 03/23/27,WALT DISNEY COMPANY/THE,GLOBAL,3.7,FIXED,30/360,2,2,2020-03-23,2020-09-23,2020-03-23,2027-03-23,AT MATURITY,Sr Unsecured,500.0,US,USD,ACTV,6.997946611909651,2.954140999315537,2024-04-08,96.831,97.116,4.864,4.758,96.9735,4.811,4.811063833534718,-9.382432901936758,2.72121791520356,2.7827520462145814,9.328578671732226
DIS,Corp,BBG00SMMG3D7,US254687FQ40,US91282CKG59,DIS 3.8 03/22/30,WALT DISNEY COMPANY/THE,GLOBAL,3.79999999999999,FIXED,30/360,2,2,2020-03-23,2020-09-22,2020-03-23,2030-03-22,AT MATURITY,Sr Unsecured,1250.0,US,USD,ACTV,9.995893223819301,5.952087611225188,2024-04-08,94.223,94.573,4.932,4.861,94.398,4.8965,4.896302709658834,-1.3673548390172874,5.138544335049634,5.2852491217536794,32.473579364466396
DIS,Corp,BBG00SMMG3H3,US254687FR23,US912810TZ12,DIS 4 5/8 03/23/40,WALT DISNEY COMPANY/THE,GLOBAL,4.625,FIXED,30/360,2,2,2020-03-23,2020-09-23,2020-03-23,2040-03-23,CALLABLE,Sr Unsecured,750.0,US,USD,ACTV,20.0,15.956194387405887,2024-04-08,93.664,94.36,5.215,5.147,94.012,5.181,5.18094740062952,26.485969153881573,11.16920800724554,11.147770411500295,159.40632351846943
DIS,Corp,BBG00SMMG454,US254687FS06,US912810TV08,DIS 4.7 03/23/50,WALT DISNEY COMPANY/THE,GLOBAL,4.7,FIXED,30/360,2,2,2020-03-23,2020-09-23,2020-03-23,2050-03-23,CALLABLE,Sr Unsecured,1750.0,US,USD,ACTV,29.998631074606433,25.95482546201232,2024-04-08,91.389,92.193,5.315,5.254,91.791,5.2844999999999995,5.2846972569823265,36.69942642687024,14.876209305096115,14.663586833419766,306.4743877485263
DIS,Corp,BBG00TSCC372,US254687FV35,US91282CKH33,DIS 1 3/4 01/13/26,WALT DISNEY COMPANY/THE,GLOBAL,1.75,FIXED,30/360,2,2,2020-05-13,2021-01-13,2020-05-13,2026-01-13,AT MATURITY,Sr Unsecured,1500.0,US,USD,ACTV,5.670088980150582,1.7659137577002053,2024-04-08,94.329,94.463,5.164,5.08,94.39599999999999,5.122,5.121720232069495,19.97351892431804,1.6373315694067652,1.7150383421779019,3.8078397632155587
DIS,Corp,BBG00TSCC3H1,US254687FW18,US91282CKG59,DIS 2.2 01/13/28,WALT DISNEY COMPANY/THE,GLOBAL,2.2,FIXED,30/360,2,2,2020-05-13,2021-01-13,2020-05-13,2028-01-13,AT MATURITY,Sr Unsecured,1000.0,US,USD,ACTV,7.668720054757015,3.7645448323066395,2024-04-08,91.158,91.438,4.798,4.712,91.298,4.755,4.754824616014957,-15.658865050610405,3.299777696096865,3.560922925118124,14.78840176834034
DIS,Corp,BBG00TSCC3R0,US254687FX90,US91282CJZ59,DIS 2.65 01/13/31,WALT DISNEY COMPANY/THE,GLOBAL,2.64999999999999,FIXED,30/360,2,2,2020-05-13,2021-01-13,2020-05-13,2031-01-13,AT MATURITY,Sr Unsecured,2500.0,US,USD,ACTV,10.669404517453799,6.765229295003422,2024-04-08,86.79,87.181,4.975,4.9,86.9855,4.9375,4.937583013946785,2.3415070350517633,5.493519440879176,6.070332099247064,42.253132618930806
DIS,Corp,BBG00TSCC3T8,US254687FY73,US912810TZ12,DIS 3 1/2 05/13/40,WALT DISNEY COMPANY/THE,GLOBAL,3.5,FIXED,30/360,2,2,2020-05-13,2020-11-13,2020-05-13,2040-05-13,CALLABLE,Sr Unsecured,1750.0,US,USD,ACTV,20.0,16.095824777549623,2024-04-08,80.47,80.963,5.321,5.269,80.7165,5.295,5.295097984373571,37.7011164018825,10.345485976747659,11.646441626392226,171.8304862207565
DIS,Corp,BBG00TSCC3Y2,US254687FZ49,US912810TV08,DIS 3.6 01/13/51,WALT DISNEY COMPANY/THE,GLOBAL,3.6,FIXED,30/360,2,2,2020-05-13,2021-01-13,2020-05-13,2051-01-13,CALLABLE,Sr Unsecured,2750.0,US,USD,ACTV,30.6694045174538,26.765229295003422,2024-04-08,75.429,76.044,5.334,5.282,75.7365,5.308,5.308031342923641,38.92086874351822,13.391633797512936,15.630710259375979,345.3213005216094
DIS,Corp,BBG00TSCC416,US254687GA88,US912810TV08,DIS 3.8 05/13/60,WALT DISNEY COMPANY/THE,GLOBAL,3.79999999999999,FIXED,30/360,2,2,2020-05-13,2020-11-13,2020-05-13,2060-05-13,CALLABLE,Sr Unsecured,1500.0,US,USD,ACTV,40.0,36.09582477754962,2024-04-08,75.56,76.415,5.332,5.267,75.98750000000001,5.2995,5.29932750016451,38.09581405891292,15.40837110336398,17.206384284138423,463.56717483512966
F,Corp,BBG00R9PG6L1,US345397A456,US91282CKE02,F 4.271 01/09/27,FORD MOTOR CREDIT CO LLC,GLOBAL,4.27099999999999,FIXED,30/360,2,2,2020-01-09,2020-07-09,2020-01-09,2027-01-09,CALLABLE,Sr Unsecured,900.0,US,USD,ACTV,7.000684462696783,2.754277891854894,2024-04-08,95.722,95.982,5.98,5.873,95.852,5.926500000000001,5.926228979974985,99.51343900417703,2.5688589278942544,2.566222943483038,8.094381358706666
F,Corp,BBG00WMLSG20,US345397A860,US91282CKE02,F 4 1/8 08/17/27,FORD MOTOR CREDIT CO LLC,GLOBAL,4.125,FIXED,30/360,2,2,2020-08-17,2021-02-17,2020-08-17,2027-08-17,CALLABLE,Sr Unsecured,1250.0,US,USD,ACTV,6.997946611909651,3.356605065023956,2024-04-08,94.465,94.718,5.969,5.882,94.5915,5.9254999999999995,5.925299263745547,99.9881048286021,3.0877053751389143,3.108686898335961,11.585337205944898
F,Corp,BBG00Y48PFN7,US345397B363,US91282CKG59,F 4 11/13/30,FORD MOTOR CREDIT CO LLC,GLOBAL,4.0,FIXED,30/360,2,2,2020-11-13,2021-05-13,2020-11-13,2030-11-13,CALLABLE,Sr Unsecured,1650.0,US,USD,ACTV,9.998631074606434,6.598220396988364,2024-04-08,88.355,88.704,6.177,6.106,88.5295,6.1415,6.141460088640454,120.96831160820332,5.632541631566698,5.669011340284015,38.079373580804464
F,Corp,BBG00Z71PLM4,US345397B512,US91282CKG59,F 2.9 02/16/28,FORD MOTOR CREDIT CO LLC,GLOBAL,2.89999999999999,FIXED,30/360,2,2,2021-02-16,2021-08-16,2021-02-16,2028-02-16,CALLABLE,Sr Unsecured,750.0,US,USD,ACTV,6.997946611909651,3.8576317590691307,2024-04-08,89.693,89.971,5.933,5.845,89.832,5.888999999999999,5.888972782343625,95.83785631185384,3.4246106377091188,3.6083775137420164,15.247733449168209
F,Corp,BBG01223KN02,US345397B777,US91282CKH33,F 2.7 08/10/26,FORD MOTOR CREDIT CO LLC,GLOBAL,2.7,FIXED,30/360,2,2,2021-08-10,2022-02-10,2021-08-10,2026-08-10,CALLABLE,Sr Unsecured,1500.0,US,USD,ACTV,4.999315537303217,2.3381245722108144,2024-04-08,93.025,93.267,5.943,5.826,93.146,5.884499999999999,5.884628120809793,95.87986793497723,2.1531142778133314,2.2406421042802243,6.20883811530773
F,Corp,BBG014D9M323,US345397B934,US91282CKG59,F 2.9 02/10/29,FORD MOTOR CREDIT CO LLC,GLOBAL,2.89999999999999,FIXED,30/360,2,2,2022-01-10,2022-08-10,2022-01-10,2029-02-10,CALLABLE,Sr Unsecured,750.0,US,USD,ACTV,7.085557837097878,4.843258042436688,2024-04-08,87.419,87.741,5.931,5.847,87.58,5.889,5.888960055261849,95.63810835523795,4.190808647001698,4.459099520581557,22.996149931779357
F,Corp,BBG0169SHRC3,US345397C270,US91282CKE02,F 4.95 05/28/27,FORD MOTOR CREDIT CO LLC,GLOBAL,4.95,FIXED,30/360,2,2,2022-03-28,2022-11-28,2022-03-28,2027-05-28,CALLABLE,Sr Unsecured,1500.0,US,USD,ACTV,5.166324435318275,3.134839151266256,2024-04-08,97.129,97.369,5.966,5.879,97.249,5.922499999999999,5.922403881698847,100.15020782802969,2.9313893599740637,2.8553994508669738,10.008188539036585
F,Corp,BBG01BB95RZ9,US345397C353,US91282CKE02,F 7.35 11/04/27,FORD MOTOR CREDIT CO LLC,GLOBAL,7.34999999999999,FIXED,30/360,2,2,2022-11-04,2023-05-04,2022-11-04,2027-11-04,CALLABLE,Sr Unsecured,1500.0,US,USD,ACTV,4.999315537303217,3.572895277207392,2024-04-08,104.288,104.561,5.968,5.883,104.4245,5.9254999999999995,5.952862935513576,102.36076777401527,3.470015800718899,3.0913209401384383,11.971614575789836
F,Corp,BBG01C6YJZP6,US345397C437,US91282CKH33,F 6.95 03/06/26,FORD MOTOR CREDIT CO LLC,GLOBAL,6.95,FIXED,30/360,2,2,2023-01-06,2023-03-06,2023-01-06,2026-03-06,CALLABLE,Sr Unsecured,1300.0,US,USD,ACTV,3.162217659137577,1.9082819986310746,2024-04-08,101.703,101.883,5.949,5.845,101.793,5.897,5.936591381579637,101.65708114349441,1.8693824485014745,1.7872197174774715,4.166861377825992
F,Corp,BBG01C6YK080,US345397C684,US91282CKG59,F 7.35 03/06/30,FORD MOTOR CREDIT CO LLC,GLOBAL,7.34999999999999,FIXED,30/360,2,2,2023-01-06,2023-03-06,2023-01-06,2030-03-06,CALLABLE,Sr Unsecured,1150.0,US,USD,ACTV,7.162217659137577,5.908281998631074,2024-04-08,105.596,105.99,6.177,6.097,105.793,6.1370000000000005,6.163121639937162,123.42351715538761,5.6409133997427015,4.871764536919722,28.92863441338286
F,Corp,BBG01G4FPH00,US345397C924,US91282CKG59,F 6.8 05/12/28,FORD MOTOR CREDIT CO LLC,GLOBAL,6.79999999999999,FIXED,30/360,2,2,2023-04-06,2023-11-12,2023-04-06,2028-05-12,CALLABLE,Sr Unsecured,1500.0,US,USD,ACTV,5.100616016427105,4.093086926762491,2024-04-08,103.012,103.333,5.943,5.854,103.1725,5.8985,5.91315817013383,98.73253661496724,3.922591378645508,3.521287683547908,15.333323426554866
F,Corp,BBG01GXL4DH9,US345397D260,US91282CKH33,F 6.95 06/10/26,FORD MOTOR CREDIT CO LLC,GLOBAL,6.95,FIXED,30/360,2,2,2023-06-08,2023-12-10,2023-06-08,2026-06-10,CALLABLE,Sr Unsecured,900.0,US,USD,ACTV,3.0061601642710474,2.1711156741957565,2024-04-08,101.87,102.062,5.979,5.881,101.96600000000001,5.93,5.96361901536584,103.77231830399232,2.1223462514923166,1.9858510442365298,5.121636354618273
F,Corp,BBG01GXL4DP0,US345397D427,US91282CKG59,F 7.2 06/10/30,FORD MOTOR CREDIT CO LLC,GLOBAL,7.2,FIXED,30/360,2,2,2023-06-08,2023-12-10,2023-06-08,2030-06-10,CALLABLE,Sr Unsecured,850.0,US,USD,ACTV,7.006160164271047,6.1711156741957565,2024-04-08,105.049,105.437,6.179,6.103,105.243,6.141,6.162739691883325,123.22358532076133,5.8507049946948175,4.98714544905558,30.769003385056656
F,Corp,BBG01K0V0QY0,US345397D591,US91282CKG59,F 6.798 11/07/28,FORD MOTOR CREDIT CO LLC,GLOBAL,6.798,FIXED,30/360,2,2,2023-11-07,2024-05-07,2023-11-07,2028-11-07,CALLABLE,Sr Unsecured,1500.0,US,USD,ACTV,5.002053388090349,4.583162217659138,2024-04-08,103.537,103.861,5.89,5.809,103.69900000000001,5.8495,5.862890013307331,93.31252912855399,4.370156795365021,3.883642683717132,18.6218968093829
F,Corp,BBG01K0V0RC2,US345397D674,US91282CJZ59,F 7.122 11/07/33,FORD MOTOR CREDIT CO LLC,GLOBAL,7.12199999999999,FIXED,30/360,2,2,2023-11-07,2024-05-07,2023-11-07,2033-11-07,CALLABLE,Sr Unsecured,1250.0,US,USD,ACTV,10.001368925393566,9.582477754962355,2024-04-08,105.755,106.233,6.297,6.231,105.994,6.263999999999999,6.278603363782167,134.47034477490269,8.696941349606668,7.024803713511135,63.15784457144143
F,Corp,BBG01KV3Y2C8,US345397D831,US91282CKE02,F 5.8 03/05/27,FORD MOTOR CREDIT CO LLC,GLOBAL,5.79999999999999,FIXED,30/360,2,2,2024-01-05,2024-03-05,2024-01-05,2027-03-05,CALLABLE,Sr Unsecured,1500.0,US,USD,ACTV,3.162217659137577,2.9048596851471595,2024-04-08,99.849,100.096,5.855,5.761,99.9725,5.808,5.807972309868466,88.82043843923032,2.766878466546791,2.6695976167888693,8.752829873496813
F,Corp,BBG01KV3XZW4,US345397E250,US91282CKF76,F 6.05 03/05/31,FORD MOTOR CREDIT CO LLC,GLOBAL,6.04999999999999,FIXED,30/360,2,2,2024-01-05,2024-03-05,2024-01-05,2031-03-05,CALLABLE,Sr Unsecured,1000.0,US,USD,ACTV,7.162217659137577,6.9048596851471595,2024-04-08,99.626,100.079,6.116,6.035,99.85249999999999,6.0755,6.0752104364335535,114.77268245806555,6.2593124289114295,5.682903962300963,38.98677505377057
F,Corp,BBG01LTXTPR2,US345397E581,US91282CKG59,F 5.8 03/08/29,FORD MOTOR CREDIT CO LLC,GLOBAL,5.79999999999999,FIXED,30/360,2,2,2024-03-08,2024-09-08,2024-03-08,2029-03-08,CALLABLE,Sr Unsecured,1600.0,US,USD,ACTV,4.999315537303217,4.914442162902122,2024-04-08,99.466,99.748,5.925,5.858,99.607,5.8915,5.891865975409745,96.6903202489524,4.564472740360465,4.284008689907225,21.941646870261405
F,Corp,BBG01LTXTPY4,US345397E664,US91282CJZ59,F 6 1/8 03/08/34,FORD MOTOR CREDIT CO LLC,GLOBAL,6.125,FIXED,30/360,2,2,2024-03-08,2024-09-08,2024-03-08,2034-03-08,CALLABLE,Sr Unsecured,900.0,US,USD,ACTV,9.998631074606434,9.91375770020534,2024-04-08,98.77,99.177,6.293,6.237,98.9735,6.265000000000001,6.264651351775152,133.33037864716675,8.600135402840365,7.546484766410774,70.62184998153447
F,Corp,BBG00BTFRN91,US345397XU23,US91282CKH33,F 4.389 01/08/26,FORD MOTOR CREDIT CO LLC,GLOBAL,4.389,FIXED,30/360,2,2,2016-01-08,2016-07-08,2016-01-08,2026-01-08,AT MATURITY,Sr Unsecured,1200.0,US,USD,ACTV,10.001368925393566,1.7522245037645447,2024-04-08,97.362,97.53,5.999,5.895,97.446,5.946999999999999,5.94705823493465,101.12525157704842,1.673086758588109,1.6646541667455377,3.6525053164840244
F,Corp,BBG00J3M66Y9,US345397YT41,US91282CKE02,F 3.815 11/02/27,FORD MOTOR CREDIT CO LLC,GLOBAL,3.81499999999999,FIXED,30/360,2,2,2017-11-02,2018-05-02,2017-11-02,2027-11-02,CALLABLE,Sr Unsecured,750.0,US,USD,ACTV,9.998631074606434,3.567419575633128,2024-04-08,93.207,93.499,5.959,5.863,93.353,5.911,5.911309369887246,98.24382658033561,3.241428171055598,3.266439987867568,12.842656834283128
F,Corp,BBG00P1DTJX5,US345397ZR75,US91282CKG59,F 5.113 05/03/29,FORD MOTOR CREDIT CO LLC,GLOBAL,5.113,FIXED,30/360,2,2,2019-05-03,2019-11-03,2019-05-03,2029-05-03,CALLABLE,Sr Unsecured,1487.0,US,USD,ACTV,10.001368925393566,5.06776180698152,2024-04-08,96.181,96.551,5.998,5.91,96.366,5.954000000000001,5.95381774827838,102.72251212919396,4.610634546269874,4.377758754802958,23.131446091753787
F,Corp,BBG00PVK6NR9,US345397ZW60,US91282CKH33,F 4.542 08/01/26,FORD MOTOR CREDIT CO LLC,GLOBAL,4.54199999999999,FIXED,30/360,2,2,2019-08-01,2020-02-01,2019-08-01,2026-08-01,CALLABLE,Sr Unsecured,750.0,US,USD,ACTV,7.000684462696783,2.3134839151266258,2024-04-08,96.822,97.077,6.034,5.912,96.9495,5.973,5.972601284855047,104.42974976738736,2.184523603420906,2.175329662066978,5.942587251921315
F,Corp,BBG017ZMVWP4,US34540TA286,US91282CJZ59,F 6 06/20/32,FORD MOTOR CREDIT CO LLC,DOMESTIC MTN,6.0,FIXED,30/360,2,2,2022-06-16,2022-12-20,2022-06-16,2032-06-20,CALLABLE,Sr Unsecured,3.397,US,USD,ACTV,10.012320328542094,8.199863107460644,2024-04-08,95.902,96.679,6.655,6.528,96.29050000000001,6.5915,6.59128228995949,165.3858786590813,7.281038240449635,6.459655764442975,51.430466834008946
F,Corp,BBG019BPT2Z7,US34540TA443,US91282CKH33,F 5.55 09/20/26,FORD MOTOR CREDIT CO LLC,DOMESTIC MTN,5.54999999999999,FIXED,30/360,2,2,2022-09-01,2023-03-20,2022-09-01,2026-09-20,CALLABLE,Sr Unsecured,11.886,US,USD,ACTV,4.05201916495551,2.4503764544832305,2024-04-08,98.102,98.398,6.399,6.265,98.25,6.332,6.332089797146617,139.7346873737275,2.3446636997917785,2.2893979846028993,6.5345540736475725
F,Corp,BBG019BPBN62,US34540TA518,US91282CKG59,F 5.9 09/20/29,FORD MOTOR CREDIT CO LLC,DOMESTIC MTN,5.9,FIXED,30/360,2,2,2022-09-01,2023-03-20,2022-09-01,2029-09-20,CALLABLE,Sr Unsecured,2.661,US,USD,ACTV,7.052703627652293,5.451060917180014,2024-04-08,97.398,97.994,6.474,6.341,97.696,6.407500000000001,6.4069411289319405,147.11696177450528,5.042911739941562,4.685091108786506,26.226577899472254
F,Corp,BBG019FHM5Z1,US34540TA773,US91282CKE02,F 6.1 09/20/27,FORD MOTOR CREDIT CO LLC,DOMESTIC MTN,6.09999999999999,FIXED,30/360,2,2,2022-09-09,2023-03-20,2022-09-09,2027-09-20,CALLABLE,Sr Unsecured,10.536,US,USD,ACTV,5.02943189596167,3.4496919917864477,2024-04-08,98.832,99.224,6.482,6.353,99.02799999999999,6.4175,6.417461210750044,148.31068862539976,3.2857003634442834,3.119652759177589,11.795367140069981
F,Corp,BBG019J9M5Z5,US34540TA930,US91282CKG59,F 6.65 09/20/29,FORD MOTOR CREDIT CO LLC,DOMESTIC MTN,6.65,FIXED,30/360,2,2,2022-09-15,2023-03-20,2022-09-15,2029-09-20,CALLABLE,Sr Unsecured,3.593,US,USD,ACTV,7.014373716632443,5.451060917180014,2024-04-08,99.123,99.704,6.844,6.715,99.4135,6.7795000000000005,6.779407065175473,183.81207535036341,5.142832066440104,4.622067079461241,25.739748963254968
F,Corp,BBG019LXFT85,US34540TB276,US91282CKH33,F 6.35 09/20/26,FORD MOTOR CREDIT CO LLC,DOMESTIC MTN,6.34999999999999,FIXED,30/360,2,2,2022-09-22,2023-03-20,2022-09-22,2026-09-20,CALLABLE,Sr Unsecured,15.055,US,USD,ACTV,3.994524298425736,2.4503764544832305,2024-04-08,99.495,99.785,6.575,6.444,99.64,6.5095,6.509433280266823,157.2071361901257,2.37086705351595,2.273408077670152,6.473329050903178
F,Corp,BBG019LXFLX4,US34540TB359,US91282CJZ59,F 6.65 09/20/32,FORD MOTOR CREDIT CO LLC,DOMESTIC MTN,6.65,FIXED,30/360,2,2,2022-09-22,2023-03-20,2022-09-22,2032-09-20,CALLABLE,Sr Unsecured,1.091,US,USD,ACTV,9.995893223819301,8.451745379876797,2024-04-08,98.715,99.533,6.852,6.723,99.124,6.7875,6.787133299910461,184.58798968037075,7.663232335825274,6.602745569466513,53.608335735130645
F,Corp,BBG019R34DD6,US34540TB508,US91282CKE02,F 6.4 09/20/27,FORD MOTOR CREDIT CO LLC,DOMESTIC MTN,6.4,FIXED,30/360,2,2,2022-09-29,2023-03-20,2022-09-29,2027-09-20,CALLABLE,Sr Unsecured,3.578,US,USD,ACTV,4.974674880219028,3.4496919917864477,2024-04-08,98.981,99.394,6.735,6.598,99.1875,6.6665,6.666195748113096,172.81960368581005,3.3036049297252656,3.1082541564459003,11.736871318077414
F,Corp,BBG01BFJB6M6,US34540TB763,US91282CKH33,F 7.3 11/20/26,FORD MOTOR CREDIT CO LLC,DOMESTIC MTN,7.29999999999999,FIXED,30/360,2,2,2022-11-17,2023-05-20,2022-11-17,2026-11-20,CALLABLE,Sr Unsecured,28.444,US,USD,ACTV,4.008213552361396,2.617385352498289,2024-04-08,99.919,100.12,7.815,6.037,100.0195,6.926,7.286822741430566,233.7069700399213,2.5622068643013125,2.34265044406139,7.014733542304008
F,Corp,BBG01BFJDX63,US34540TB847,US91282CKH33,F 7.65 11/20/32,FORD MOTOR CREDIT CO LLC,DOMESTIC MTN,7.65,FIXED,30/360,2,2,2022-11-17,2023-05-20,2022-11-17,2032-11-20,CALLABLE,Sr Unsecured,4.277,US,USD,ACTV,10.009582477754963,8.618754277891854,2024-04-08,99.982,100.1,7.59,6.546,100.041,7.068,7.641416704223926,268.71708572031633,8.08415000550674,6.415317780267627,52.44334933639284
F,Corp,BBG01BJ20KB2,US34540TC266,US91282CKH33,F 7.45 11/20/29,FORD MOTOR CREDIT CO LLC,DOMESTIC MTN,7.45,FIXED,30/360,2,2,2022-11-25,2023-05-20,2022-11-25,2029-11-20,CALLABLE,Sr Unsecured,10.031,US,USD,ACTV,6.9869952087611225,5.618069815195072,2024-04-08,100.067,100.132,6.654,6.079,100.0995,6.3665,7.425390811243365,247.40754595626393,5.398672470570642,4.57432108811699,25.997204916064142
F,Corp,BBG01BNKPXD0,US34540TC340,US91282CKH33,F 6 3/4 12/20/26,FORD MOTOR CREDIT CO LLC,DOMESTIC MTN,6.75,FIXED,30/360,2,2,2022-12-01,2023-06-20,2022-12-01,2026-12-20,CALLABLE,Sr Unsecured,4.81,US,USD,ACTV,4.05201916495551,2.6995208761122518,2024-04-08,99.605,99.938,6.907,6.77,99.7715,6.8385,6.8387237703427655,189.84012666622786,2.6203600492670587,2.4391310720142907,7.502033589546775
F,Corp,BBG01BNKTHY8,US34540TC423,US91282CKH33,F 7.15 12/20/32,FORD MOTOR CREDIT CO LLC,DOMESTIC MTN,7.15,FIXED,30/360,2,2,2022-12-01,2023-06-20,2022-12-01,2032-12-20,CALLABLE,Sr Unsecured,1.886,US,USD,ACTV,10.053388090349076,8.700889801505818,2024-04-08,99.741,100.541,7.188,4.252,100.14099999999999,5.72,7.1256383783264345,217.96963537539494,8.008087148280625,6.573474369986321,54.43067057205968
F,Corp,BBG01BSNV6B3,US34540TC670,US91282CKE02,F 6.55 12/20/27,FORD MOTOR CREDIT CO LLC,DOMESTIC MTN,6.54999999999999,FIXED,30/360,2,2,2022-12-08,2023-06-20,2022-12-08,2027-12-20,CALLABLE,Sr Unsecured,6.83,US,USD,ACTV,5.032169746748802,3.698836413415469,2024-04-08,99.29,99.712,6.766,6.635,99.501,6.7005,6.700733003106421,176.3402564642227,3.5439382752276587,3.2533056634530384,13.015332225354312
F,Corp,BBG01BWMW5S3,US34540TC753,US91282CKH33,F 6.3 12/20/26,FORD MOTOR CREDIT CO LLC,DOMESTIC MTN,6.29999999999999,FIXED,30/360,2,2,2022-12-15,2023-06-20,2022-12-15,2026-12-20,CALLABLE,Sr Unsecured,8.617,US,USD,ACTV,4.01368925393566,2.6995208761122518,2024-04-08,99.142,99.467,6.648,6.514,99.30449999999999,6.5809999999999995,6.580910523198547,164.4375666273588,2.6028348859733472,2.4516823969043946,7.552058477464611
F,Corp,BBG01BYVR259,US34540TD256,US91282CKG59,F 6.6 12/20/29,FORD MOTOR CREDIT CO LLC,DOMESTIC MTN,6.59999999999999,FIXED,30/360,2,2,2022-12-22,2023-06-20,2022-12-22,2029-12-20,CALLABLE,Sr Unsecured,3.804,US,USD,ACTV,6.995208761122519,5.700205338809035,2024-04-08,99.13,99.73,6.784,6.655,99.43,6.7195,6.7193387870863095,177.96543539427174,5.352725528669166,4.732658428618456,27.39260745630342
F,Corp,BBG01FJNH3V5,US34540TD413,US91282CKE02,F 6.8 03/20/27,FORD MOTOR CREDIT CO LLC,DOMESTIC MTN,6.79999999999999,FIXED,30/360,2,2,2023-03-02,2023-09-20,2023-03-02,2027-03-20,CALLABLE,Sr Unsecured,12.553,US,USD,ACTV,4.049281314168378,2.945927446954141,2024-04-08,99.746,100.084,6.895,6.58,99.91499999999999,6.7375,6.830219622440634,189.77397413204653,2.854325221554219,2.6820612666808614,8.865155950516703
F,Corp,BBG01FP0TQW3,US34540TD587,US91282CKG59,F 7.15 03/20/28,FORD MOTOR CREDIT CO LLC,DOMESTIC MTN,7.15,FIXED,30/360,2,2,2023-03-09,2023-09-20,2023-03-09,2028-03-20,CALLABLE,Sr Unsecured,51.736,US,USD,ACTV,5.032169746748802,3.9479808350444903,2024-04-08,99.611,100.05,7.263,7.007,99.8305,7.135,7.198286872695875,225.51513888464638,3.8194750604761794,3.4719349559898807,14.638930786460865
F,Corp,BBG01FRH9T05,US34540TD660,US91282CKH33,F 6.8 03/20/26,FORD MOTOR CREDIT CO LLC,DOMESTIC MTN,6.79999999999999,FIXED,30/360,2,2,2023-03-16,2023-09-20,2023-03-16,2026-03-20,CALLABLE,Sr Unsecured,12.297,US,USD,ACTV,3.0116358658453115,1.946611909650924,2024-04-08,99.894,100.135,6.856,6.463,100.0145,6.6594999999999995,6.788802324794233,185.91933957940392,1.9057427493910886,1.8269442849076816,4.328053574793758
F,Corp,BBG01GVK65G9,US34540TD900,US91282CKH33,F 7 06/20/28,FORD MOTOR CREDIT CO LLC,DOMESTIC MTN,7.0,FIXED,30/360,2,2,2023-06-08,2023-12-20,2023-06-08,2028-06-20,CALLABLE,Sr Unsecured,36.076,US,USD,ACTV,5.034907597535934,4.199863107460644,2024-04-08,99.832,100.236,7.043,5.654,100.03399999999999,6.3485,6.986517187617719,204.3309109126685,4.043112265215889,3.615198017026173,16.070710621474596
F,Corp,BBG01GXMP787,US34540TE247,US91282CKH33,F 7.05 06/20/27,FORD MOTOR CREDIT CO LLC,DOMESTIC MTN,7.04999999999999,FIXED,30/360,2,2,2023-06-15,2023-12-20,2023-06-15,2027-06-20,CALLABLE,Sr Unsecured,13.003,US,USD,ACTV,4.01368925393566,3.1978097193702943,2024-04-08,99.979,100.03,7.009,6.747,100.00450000000001,6.878,7.043248861698846,210.320739988204,3.104874097849118,2.835575946558458,10.019115798702401
F,Corp,BBG01GZYGCF0,US34540TE320,US91282CKH33,F 6.85 06/20/26,FORD MOTOR CREDIT CO LLC,DOMESTIC MTN,6.84999999999999,FIXED,30/360,2,2,2023-06-23,2023-12-20,2023-06-23,2026-06-20,CALLABLE,Sr Unsecured,11.291,US,USD,ACTV,2.9924709103353866,2.198494182067077,2024-04-08,99.813,100.081,6.936,6.297,99.947,6.6165,6.869567409418526,193.19408802159413,2.148565110315702,2.0148487340965255,5.249524078070589
F,Corp,BBG01GZYGL06,US34540TE403,US91282CKH33,F 7.2 06/20/33,FORD MOTOR CREDIT CO LLC,DOMESTIC MTN,7.2,FIXED,30/360,2,2,2023-06-23,2023-12-20,2023-06-23,2033-06-20,CALLABLE,Sr Unsecured,8.839,US,USD,ACTV,9.99315537303217,9.19917864476386,2024-04-08,99.885,100.607,7.215,3.968,100.24600000000001,5.5915,7.160752639882266,221.52681587428305,8.432915355168307,6.850001277381564,59.43830041590269
F,Corp,BBG01HQ6WHK4,US34540TE650,US91282CKH33,F 6 1/2 08/20/26,FORD MOTOR CREDIT CO LLC,DOMESTIC MTN,6.5,FIXED,30/360,2,2,2023-08-10,2024-02-20,2023-08-10,2026-08-20,CALLABLE,Sr Unsecured,10.458,US,USD,ACTV,3.028062970568104,2.3655030800821355,2024-04-08,99.685,99.973,6.641,6.508,99.82900000000001,6.5745000000000005,6.574489328053522,163.92690960147783,2.2968809318398904,2.1869998421170207,6.048482317423555
F,Corp,BBG01J1GV4S7,US34540TF319,US91282CKH33,F 7 08/20/26,FORD MOTOR CREDIT CO LLC,DOMESTIC MTN,7.0,FIXED,30/360,2,2,2023-08-31,2024-02-20,2023-08-31,2026-08-20,CALLABLE,Sr Unsecured,23.625,US,USD,ACTV,2.97056810403833,2.3655030800821355,2024-04-08,99.933,100.201,7.026,6.368,100.06700000000001,6.697,6.96314481552322,202.22222842172664,2.3123775235925703,2.177392867718985,6.013295591616387
F,Corp,BBG01J3J05J0,US34540TF491,US91282CKH33,F 7 09/20/27,FORD MOTOR CREDIT CO LLC,DOMESTIC MTN,7.0,FIXED,30/360,2,2,2023-09-08,2024-03-20,2023-09-08,2027-09-20,CALLABLE,Sr Unsecured,17.955,US,USD,ACTV,4.032854209445585,3.4496919917864477,2024-04-08,100.193,100.247,6.528,6.404,100.22,6.465999999999999,6.925173817746291,198.33887216309844,3.3394201180652474,3.0860707323994983,11.623029503010342
F,Corp,BBG01JZH81L7,US34540TF566,US91282CKH33,F 7.15 11/20/26,FORD MOTOR CREDIT CO LLC,DOMESTIC MTN,7.15,FIXED,30/360,2,2,2023-11-09,2024-05-20,2023-11-09,2026-11-20,CALLABLE,Sr Unsecured,119.743,US,USD,ACTV,3.030800821355236,2.617385352498289,2024-04-08,100.911,101.008,5.596,5.434,100.95949999999999,5.515000000000001,6.738759346269073,179.72751906716582,2.5566909177238886,2.3466877849060253,7.030163436339628
F,Corp,BBG01K4MC5L3,US34540TF723,US91282CKH33,F 6.65 11/20/26,FORD MOTOR CREDIT CO LLC,DOMESTIC MTN,6.65,FIXED,30/360,2,2,2023-11-24,2024-05-20,2023-11-24,2026-11-20,CALLABLE,Sr Unsecured,23.99,US,USD,ACTV,2.9897330595482545,2.617385352498289,2024-04-08,100.008,100.081,6.622,6.497,100.0445,6.5595,6.627408231683074,168.75733279497484,2.5382449118430452,2.3619366129484423,7.0873406100464065
F,Corp,BBG01KJP1KW7,US34540TF988,US91282CKH33,F 6 1/4 12/20/27,FORD MOTOR CREDIT CO LLC,DOMESTIC MTN,6.25,FIXED,30/360,2,2,2023-12-21,2024-06-20,2023-12-21,2027-12-20,CALLABLE,Sr Unsecured,75.1,US,USD,ACTV,3.997262149212868,3.698836413415469,2024-04-08,100.227,100.523,5.895,5.457,100.375,5.676,6.131644388988543,120.25808898291638,3.5236502551039712,3.2682156256238346,13.093608874718976
F,Corp,BBG01LM5FXD3,US34540TG309,US91282CKH33,F 5.7 02/20/26,FORD MOTOR CREDIT CO LLC,DOMESTIC MTN,5.7,FIXED,30/360 NON-EOM,2,2,2024-02-29,2024-08-20,2024-02-29,2026-02-20,CALLABLE,Sr Unsecured,17.2,US,USD,ACTV,1.9767282683093772,1.8699520876112252,2024-04-08,99.752,99.982,5.84,5.707,99.86699999999999,5.7735,5.773583324998616,83.76668386250685,1.809809586162826,1.7663240570088083,4.065279242587806
F,Corp,BBG01LQD8VK6,US34540TG481,US91282CKE02,F 5.6 03/20/27,FORD MOTOR CREDIT CO LLC,DOMESTIC MTN,5.59999999999999,FIXED,30/360,2,2,2024-03-07,2024-09-20,2024-03-07,2027-03-20,CALLABLE,Sr Unsecured,5.474,US,USD,ACTV,3.033538672142368,2.945927446954141,2024-04-08,99.456,99.818,5.8,5.665,99.637,5.7325,5.734282170932092,81.66954235285452,2.799923813187925,2.7160450593416354,9.017260563322706
F,Corp,BBG01LTL21P2,US34540TG556,US91282CKH33,F 5.65 03/20/26,FORD MOTOR CREDIT CO LLC,DOMESTIC MTN,5.65,FIXED,30/360,2,2,2024-03-14,2024-09-20,2024-03-14,2026-03-20,CALLABLE,Sr Unsecured,9.838,US,USD,ACTV,2.0150581793292264,1.946611909650924,2024-04-08,99.351,99.6,6.005,5.867,99.4755,5.936,5.937348303943872,101.90446331392569,1.8804059418842667,1.8410991037496987,4.372929735593618
F,Corp,BBG01LXJ2LF9,US34540TG630,US91282CKE02,F 5 1/2 03/20/27,FORD MOTOR CREDIT CO LLC,DOMESTIC MTN,5.5,FIXED,30/360,2,2,2024-03-21,2024-09-20,2024-03-21,2027-03-20,CALLABLE,Sr Unsecured,7.084,US,USD,ACTV,2.9952087611225187,2.945927446954141,2024-04-08,98.344,98.701,6.122,5.986,98.5225,6.054,6.054015583544969,113.21254824663687,2.7953292482657175,2.7193133607942106,9.0316566247087
F,Corp,BBG01LXJBVH5,US34540TG713,US91282CKF76,F 5 3/4 03/20/31,FORD MOTOR CREDIT CO LLC,DOMESTIC MTN,5.75,FIXED,30/360,2,2,2024-03-21,2024-09-20,2024-03-21,2031-03-20,CALLABLE,Sr Unsecured,5.263,US,USD,ACTV,6.995208761122519,6.945927446954141,2024-04-08,97.806,98.501,6.142,6.017,98.15350000000001,6.0795,6.07924102768302,115.23286799308069,6.243004056267313,5.762693579598994,39.84603723194545
F,Corp,BBG01M2L11L4,US34540TG895,US91282CKH33,F 5.8 03/20/26,FORD MOTOR CREDIT CO LLC,DOMESTIC MTN,5.8,FIXED,30/360,2,2,2024-03-28,2024-09-20,2024-03-28,2026-03-20,CALLABLE,Sr Unsecured,43.438,US,USD,ACTV,1.9767282683093772,1.946611909650924,2024-04-08,99.344,100.048,6.163,5.746,99.696,5.9545,5.967426814883946,104.87272526641755,1.8831633175202094,1.8409559879916684,4.371886199600454
F,Corp,BBG01M2L8RV9,US34540TG978,US91282CJZ59,F 6.1 03/20/34,FORD MOTOR CREDIT CO LLC,DOMESTIC MTN,6.1,FIXED,30/360,2,2,2024-03-28,2024-09-20,2024-03-28,2034-03-20,CALLABLE,Sr Unsecured,16.933,US,USD,ACTV,9.976728268309378,9.946611909650924,2024-04-08,98.064,98.868,6.366,6.254,98.466,6.31,6.309893862979924,137.82839143194101,8.627766059091618,7.592963310155387,71.28620619722372
F,Corp,BBG00DRGRHJ9,US34540TNK42,US91282CKH33,F 3 1/4 09/20/26,FORD MOTOR CREDIT CO LLC,DOMESTIC MTN,3.25,FIXED,30/360,2,2,2016-09-15,2017-03-20,2016-09-15,2026-09-20,CALLABLE,Sr Unsecured,4.658,US,USD,ACTV,10.012320328542094,2.4503764544832305,2024-04-08,92.888,93.196,6.44,6.296,93.042,6.368,6.367591390274464,143.22130704911174,2.2693463828924463,2.3388253551563847,6.723810452628434
F,Corp,BBG00JF21GV6,US34540TSG84,US91282CKE02,F 3.8 12/20/27,FORD MOTOR CREDIT CO LLC,DOMESTIC MTN,3.79999999999999,FIXED,30/360,2,2,2017-12-14,2018-06-20,2017-12-14,2027-12-20,CALLABLE,Sr Unsecured,5.876,US,USD,ACTV,10.015058179329227,3.698836413415469,2024-04-08,92.02,92.446,6.25,6.113,92.233,6.1815,6.1816136936982415,125.18283055754165,3.358314870031394,3.397539950753886,13.777752560933507
F,Corp,BBG00Y7153F7,US34540TWW88,US91282CKE02,F 3.6 11/20/27,FORD MOTOR CREDIT CO LLC,DOMESTIC MTN,3.6,FIXED,30/360,2,2,2020-11-27,2021-05-20,2020-11-27,2027-11-20,CALLABLE,Sr Unsecured,1.435,US,USD,ACTV,6.978781656399726,3.6167008898015056,2024-04-08,91.43,91.869,6.288,6.143,91.6495,6.2155000000000005,6.2157780133187766,128.36799673964114,3.275910670145119,3.327735415965023,13.25155438884616
F,Corp,BBG00YD67CH5,US34540TXA59,US91282CKE02,F 3.6 12/20/27,FORD MOTOR CREDIT CO LLC,DOMESTIC MTN,3.6,FIXED,30/360,2,2,2020-12-10,2021-06-20,2020-12-10,2027-12-20,CALLABLE,Sr Unsecured,4.978,US,USD,ACTV,7.025325119780972,3.698836413415469,2024-04-08,91.253,91.68,6.288,6.15,91.4665,6.219,6.2188748377014935,128.85490512543393,3.3448288335927945,3.409200842454818,13.83939186411274
F,Corp,BBG00ZDRP6J7,US34540TXC16,US91282CKG59,F 2 1/2 03/20/28,FORD MOTOR CREDIT CO LLC,DOMESTIC MTN,2.5,FIXED,30/360,2,2,2021-03-04,2021-09-20,2021-03-04,2028-03-20,CALLABLE,Sr Unsecured,1.97,US,USD,ACTV,7.044490075290897,3.9479808350444903,2024-04-08,87.208,87.666,6.205,6.062,87.437,6.1335,6.133612036200951,120.57448879063293,3.4677537928890576,3.7231577639048656,16.09082855917668
F,Corp,BBG00ZDRPFW2,US34540TXD98,US91282CJZ59,F 2.9 03/20/31,FORD MOTOR CREDIT CO LLC,DOMESTIC MTN,2.89999999999999,FIXED,30/360,2,2,2021-03-04,2021-09-20,2021-03-04,2031-03-20,CALLABLE,Sr Unsecured,0.075,US,USD,ACTV,10.042436687200547,6.945927446954141,2024-04-08,81.43,82.155,6.235,6.089,81.7925,6.162000000000001,6.161931744962931,123.39866564460318,5.664887456763382,6.203130279433283,44.09702881765211
F,Corp,BBG00ZHQPQR2,US34540TXE71,US91282CKG59,F 2.95 03/20/28,FORD MOTOR CREDIT CO LLC,DOMESTIC MTN,2.95,FIXED,30/360,2,2,2021-03-11,2021-09-20,2021-03-11,2028-03-20,CALLABLE,Sr Unsecured,1.159,US,USD,ACTV,7.025325119780972,3.9479808350444903,2024-04-08,88.727,89.196,6.216,6.071,88.9615,6.1434999999999995,6.143149962276221,121.5146207791387,3.5017410928158927,3.6948840684269846,15.927425738264526
F,Corp,BBG00ZL5PN90,US34540TXF47,US91282CKH33,F 3 03/20/26,FORD MOTOR CREDIT CO LLC,DOMESTIC MTN,3.0,FIXED,30/360,2,2,2021-03-18,2021-09-20,2021-03-18,2026-03-20,CALLABLE,Sr Unsecured,9.347,US,USD,ACTV,5.004791238877481,1.946611909650924,2024-04-08,93.891,94.137,6.39,6.248,94.01400000000001,6.319,6.318544536419211,139.54399457781645,1.8220287963644848,1.876141976271894,4.484028973227591
F,Corp,BBG00ZL5VDM0,US34540TXG20,US91282CJZ59,F 3.8 03/20/31,FORD MOTOR CREDIT CO LLC,DOMESTIC MTN,3.79999999999999,FIXED,30/360,2,2,2021-03-18,2021-09-20,2021-03-18,2031-03-20,CALLABLE,Sr Unsecured,1.347,US,USD,ACTV,10.004106776180699,6.945927446954141,2024-04-08,86.213,86.916,6.28,6.142,86.5645,6.211,6.210755962434248,128.20642799175147,5.8471051686020985,6.04663615866431,42.5872212680559
F,Corp,BBG010R8M9B5,US34540TXH03,US91282CKH33,F 2 3/4 05/20/26,FORD MOTOR CREDIT CO LLC,DOMESTIC MTN,2.75,FIXED,30/360,2,2,2021-05-13,2021-11-20,2021-05-13,2026-05-20,CALLABLE,Sr Unsecured,14.726,US,USD,ACTV,5.018480492813142,2.113620807665982,2024-04-08,93.128,93.385,6.274,6.137,93.2565,6.2055,6.2054555751383305,128.20549184165966,1.9626691071957583,2.0173682208621604,5.150851361722424
F,Corp,BBG010R8N407,US34540TXJ68,US91282CJZ59,F 3.7 05/20/31,FORD MOTOR CREDIT CO LLC,DOMESTIC MTN,3.7,FIXED,30/360,2,2,2021-05-13,2021-11-20,2021-05-13,2031-05-20,CALLABLE,Sr Unsecured,9.585,US,USD,ACTV,10.017796030116358,7.112936344969199,2024-04-08,85.957,86.615,6.169,6.043,86.286,6.106,6.105368351191283,117.77964102461132,5.938402357071579,6.107000455505929,43.96961723143021
F,Corp,BBG010ZDGBP2,US34540TXK32,US91282CKH33,F 2.7 05/20/26,FORD MOTOR CREDIT CO LLC,DOMESTIC MTN,2.7,FIXED,30/360,2,2,2021-05-20,2021-11-20,2021-05-20,2026-05-20,CALLABLE,Sr Unsecured,3.967,US,USD,ACTV,4.999315537303217,2.113620807665982,2024-04-08,92.538,92.811,6.54,6.393,92.6745,6.4665,6.465987507589162,153.90943586391253,1.9613980421451247,2.0185282302892174,5.154521888120245
F,Corp,BBG010ZDGLF1,US34540TXL15,US91282CJZ59,F 3 3/4 05/20/31,FORD MOTOR CREDIT CO LLC,DOMESTIC MTN,3.75,FIXED,30/360,2,2,2021-05-20,2021-11-20,2021-05-20,2031-05-20,CALLABLE,Sr Unsecured,1.624,US,USD,ACTV,9.998631074606434,7.112936344969199,2024-04-08,85.676,86.385,6.277,6.141,86.0305,6.209,6.208931463211775,127.987299509753,5.948924531564692,6.09766245935419,43.87969990830915
F,Corp,BBG01191CW73,US34540TXM97,US91282CKH33,F 2.85 06/20/26,FORD MOTOR CREDIT CO LLC,DOMESTIC MTN,2.85,FIXED,30/360,2,2,2021-06-10,2021-12-20,2021-06-10,2026-06-20,CALLABLE,Sr Unsecured,16.504,US,USD,ACTV,5.026694045174538,2.198494182067077,2024-04-08,92.742,93.004,6.447,6.311,92.873,6.379,6.379174104966225,144.86806173138464,2.0393997019583052,2.098947394401074,5.529710358654583
F,Corp,BBG01191CWB8,US34540TXN70,US91282CJZ59,F 3 3/4 06/20/31,FORD MOTOR CREDIT CO LLC,DOMESTIC MTN,3.75,FIXED,30/360,2,2,2021-06-10,2021-12-20,2021-06-10,2031-06-20,CALLABLE,Sr Unsecured,7.068,US,USD,ACTV,10.026009582477755,7.197809719370294,2024-04-08,85.958,86.633,6.198,6.07,86.2955,6.134,6.133385173471242,120.41756760826156,6.008313228115818,6.181268119911558,44.948917647149656
F,Corp,BBG011C7CCB5,US34540TXQ02,US91282CKG59,F 3 1/4 06/20/28,FORD MOTOR CREDIT CO LLC,DOMESTIC MTN,3.25,FIXED,30/360,2,2,2021-06-17,2021-12-20,2021-06-17,2028-06-20,CALLABLE,Sr Unsecured,9.206,US,USD,ACTV,7.008898015058179,4.199863107460644,2024-04-08,89.497,89.952,6.126,5.993,89.7245,6.0595,6.059432461250202,112.98287111203464,3.7271566595272203,3.8615629882937412,17.533068041111104
F,Corp,BBG011FH1F61,US34540TXS67,US91282CKG59,F 3.2 06/20/28,FORD MOTOR CREDIT CO LLC,DOMESTIC MTN,3.2,FIXED,30/360,2,2,2021-06-24,2021-12-20,2021-06-24,2028-06-20,CALLABLE,Sr Unsecured,8.006,US,USD,ACTV,6.9897330595482545,4.199863107460644,2024-04-08,89.327,89.786,6.122,5.988,89.5565,6.055,6.055148196965457,112.56062709124461,3.7229518389503466,3.8653854414323123,17.55575711366733
F,Corp,BBG01236M5G4,US34540TXW79,US91282CKG59,F 2.9 08/20/28,FORD MOTOR CREDIT CO LLC,DOMESTIC MTN,2.89999999999999,FIXED,30/360,2,2,2021-08-19,2022-02-20,2021-08-19,2028-08-20,CALLABLE,Sr Unsecured,11.539,US,USD,ACTV,7.003422313483915,4.3668720054757015,2024-04-08,87.956,88.416,6.085,5.954,88.186,6.0195,6.019234561175107,108.94743089045035,3.8292914430026235,4.054067663930605,19.087748969969436
F,Corp,BBG01259M059,US34540TXY36,US91282CJZ59,F 3.2 08/20/31,FORD MOTOR CREDIT CO LLC,DOMESTIC MTN,3.2,FIXED,30/360,2,2,2021-08-26,2022-02-20,2021-08-26,2031-08-20,CALLABLE,Sr Unsecured,8.897,US,USD,ACTV,9.982203969883642,7.364818617385352,2024-04-08,82.805,83.472,6.137,6.011,83.1385,6.074,6.073962562531235,114.49949855835641,6.000965159715576,6.453176922423169,48.17908937846422
F,Corp,BBG0129DCB44,US34540TYA41,US91282CJZ59,F 3.3 09/20/31,FORD MOTOR CREDIT CO LLC,DOMESTIC MTN,3.29999999999999,FIXED,30/360,2,2,2021-09-02,2022-03-20,2021-09-02,2031-09-20,CALLABLE,Sr Unsecured,6.951,US,USD,ACTV,10.047912388774812,7.449691991786447,2024-04-08,83.028,83.71,6.178,6.05,83.369,6.114,6.113832672433768,118.36213297312615,6.078737275313175,6.5162633669362515,49.09780675946489
F,Corp,BBG012C7JXD8,US34540TYC07,US91282CJZ59,F 3.3 09/20/31,FORD MOTOR CREDIT CO LLC,DOMESTIC MTN,3.29999999999999,FIXED,30/360,2,2,2021-09-10,2022-03-20,2021-09-10,2031-09-20,CALLABLE,Sr Unsecured,5.685,US,USD,ACTV,10.026009582477755,7.449691991786447,2024-04-08,83.043,83.732,6.175,6.046,83.3875,6.1105,6.11035145893693,118.01914047866995,6.078737275313175,6.5162633669362515,49.09780675946489
F,Corp,BBG012FD0HC8,US34540TYE62,US91282CJZ59,F 3 1/4 09/20/31,FORD MOTOR CREDIT CO LLC,DOMESTIC MTN,3.25,FIXED,30/360,2,2,2021-09-16,2022-03-20,2021-09-16,2031-09-20,CALLABLE,Sr Unsecured,2.722,US,USD,ACTV,10.009582477754963,7.449691991786447,2024-04-08,82.356,83.064,6.25,6.116,82.71,6.183,6.182564576481682,125.13379463030383,6.067336426701605,6.526206527688022,49.2001535946257
F,Corp,BBG012J3JK57,US34540TYG11,US91282CKG59,F 2.9 09/20/28,FORD MOTOR CREDIT CO LLC,DOMESTIC MTN,2.89999999999999,FIXED,30/360,2,2,2021-09-23,2022-03-20,2021-09-23,2028-09-20,CALLABLE,Sr Unsecured,3.373,US,USD,ACTV,6.992470910335387,4.4517453798767965,2024-04-08,87.414,87.909,6.181,6.042,87.6615,6.1114999999999995,6.1116443134844305,117.88995984469513,3.8950747097289375,4.137574398288658,19.814221247204667
F,Corp,BBG012N19FB1,US34540TYJ59,US91282CKH33,F 2.4 09/20/26,FORD MOTOR CREDIT CO LLC,DOMESTIC MTN,2.39999999999999,FIXED,30/360,2,2,2021-09-30,2022-03-20,2021-09-30,2026-09-20,CALLABLE,Sr Unsecured,9.138,US,USD,ACTV,4.971937029431896,2.4503764544832305,2024-04-08,91.031,91.326,6.422,6.282,91.1785,6.352,6.352299829609692,141.71103817577531,2.2415188647158133,2.358516920338873,6.799209048207591
F,Corp,BBG013KGT6K7,US34540TYL06,US91282CKG59,F 2.9 11/20/28,FORD MOTOR CREDIT CO LLC,DOMESTIC MTN,2.89999999999999,FIXED,30/360,2,2,2021-11-26,2022-05-20,2021-11-26,2028-11-20,CALLABLE,Sr Unsecured,7.888,US,USD,ACTV,6.98425735797399,4.618754277891855,2024-04-08,88.66,89.158,5.733,5.6,88.90899999999999,5.666499999999999,5.6659984357655055,73.96689779599349,4.023067553522942,4.236985646590549,20.956333362554332
F,Corp,BBG013QK5HG9,US34540TYM88,US91282CKH33,F 2.65 12/20/26,FORD MOTOR CREDIT CO LLC,DOMESTIC MTN,2.64999999999999,FIXED,30/360,2,2,2021-12-02,2022-06-20,2021-12-02,2026-12-20,CALLABLE,Sr Unsecured,5.356,US,USD,ACTV,5.048596851471594,2.6995208761122518,2024-04-08,90.667,90.995,6.478,6.336,90.831,6.407,6.407162763705834,147.31778781998258,2.4607661482356455,2.56580340072377,8.006902127447434
F,Corp,BBG013TWNDP9,US34540TYQ92,US91282CKH33,F 2.55 12/20/26,FORD MOTOR CREDIT CO LLC,DOMESTIC MTN,2.54999999999999,FIXED,30/360,2,2,2021-12-09,2022-06-20,2021-12-09,2026-12-20,CALLABLE,Sr Unsecured,5.733,US,USD,ACTV,5.02943189596167,2.6995208761122518,2024-04-08,90.438,90.764,6.472,6.33,90.601,6.401,6.401191506889332,146.72942115884752,2.456876102511628,2.5692769773147845,8.020746504926382
F,Corp,BBG013YMGSH9,US34540TYS58,US91282CKG59,F 3.05 12/20/28,FORD MOTOR CREDIT CO LLC,DOMESTIC MTN,3.04999999999999,FIXED,30/360,2,2,2021-12-16,2022-06-20,2021-12-16,2028-12-20,CALLABLE,Sr Unsecured,11.472,US,USD,ACTV,7.011635865845311,4.700889801505818,2024-04-08,87.589,88.075,6.131,6.001,87.832,6.066000000000001,6.06606034711962,113.50972309485478,4.1018596619954,4.304025850101966,21.59714915139693
F,Corp,BBG01626JXJ6,US34540TYV87,US91282CKG59,F 4.55 03/20/29,FORD MOTOR CREDIT CO LLC,DOMESTIC MTN,4.54999999999999,FIXED,30/360,2,2,2022-03-24,2022-09-20,2022-03-24,2029-03-20,CALLABLE,Sr Unsecured,3.926,US,USD,ACTV,6.9897330595482545,4.947296372347707,2024-04-08,92.808,93.352,6.263,6.128,93.08000000000001,6.1955,6.1954289399087425,126.67909284402648,4.458582024116536,4.4147921815055415,22.932258470936205
F,Corp,BBG0168FCQX6,US34540TYW60,US91282CKH33,F 4.7 03/20/26,FORD MOTOR CREDIT CO LLC,DOMESTIC MTN,4.7,FIXED,30/360,2,2,2022-03-31,2022-09-20,2022-03-31,2026-03-20,CALLABLE,Sr Unsecured,32.516,US,USD,ACTV,3.969883641341547,1.946611909650924,2024-04-08,96.917,97.144,6.41,6.281,97.0305,6.3454999999999995,6.345388818867503,142.179344573967,1.8594770066345334,1.853257220582267,4.411475591396609
F,Corp,BBG0168FDY04,US34540TYX44,US91282CJZ59,F 4.95 03/20/32,FORD MOTOR CREDIT CO LLC,DOMESTIC MTN,4.95,FIXED,30/360,2,2,2022-03-31,2022-09-20,2022-03-31,2032-03-20,CALLABLE,Sr Unsecured,4.054,US,USD,ACTV,9.971252566735114,7.94798083504449,2024-04-08,91.611,92.368,6.308,6.18,91.98949999999999,6.244,6.243722752481701,131.27620608283962,6.820085238586335,6.56279860345843,51.422284586772676
F,Corp,BBG017JWXBF5,US34540TZA32,US91282CKH33,F 5 3/4 05/20/26,FORD MOTOR CREDIT CO LLC,DOMESTIC MTN,5.75,FIXED,30/360,2,2,2022-05-26,2022-11-20,2022-05-26,2026-05-20,CALLABLE,Sr Unsecured,29.999,US,USD,ACTV,3.9835728952772076,2.113620807665982,2024-04-08,98.588,98.833,6.472,6.345,98.7105,6.4085,6.408748396821321,148.24245975144535,2.0389539675457975,1.9526212190460486,4.945977527249567
F,Corp,BBG017QYHT99,US34540TZC97,US91282CKE02,F 6.05 06/20/27,FORD MOTOR CREDIT CO LLC,DOMESTIC MTN,6.04999999999999,FIXED,30/360,2,2,2022-06-03,2022-12-20,2022-06-03,2027-06-20,CALLABLE,Sr Unsecured,28.389,US,USD,ACTV,5.045859000684462,3.1978097193702943,2024-04-08,99.396,99.739,6.258,6.137,99.5675,6.1975,6.197473563998937,126.94911055761082,3.052478670047098,2.872831882590456,10.191786741851486
F,Corp,BBG017WT3G32,US34540TZD70,US91282CKG59,F 6 06/20/29,FORD MOTOR CREDIT CO LLC,DOMESTIC MTN,6.0,FIXED,30/360,2,2,2022-06-09,2022-12-20,2022-06-09,2029-06-20,CALLABLE,Sr Unsecured,10.458,US,USD,ACTV,7.030800821355236,5.19917864476386,2024-04-08,97.946,98.484,6.469,6.345,98.215,6.407,6.406827654503287,147.28214741181438,4.839129893121719,4.427909333732092,23.773335021378053
GM,Corp,BBG00CBV64R8,US37045XBG07,US91282CKH33,GM 5 1/4 03/01/26,GENERAL MOTORS FINL CO,GLOBAL,5.25,FIXED,30/360,2,2,2016-03-01,2016-09-01,2016-03-01,2026-03-01,CALLABLE,Sr Unsecured,1250.0,US,USD,ACTV,9.998631074606434,1.894592744695414,2024-04-08,99.453,99.62,5.555,5.461,99.5365,5.508,5.507960217965706,59.327682483125656,1.8194193261658287,1.7947001325645888,4.176520791925714
GM,Corp,BBG00DYBW4J5,US37045XBQ88,US91282CKH33,GM 4 10/06/26,GENERAL MOTORS FINL CO,GLOBAL,4.0,FIXED,30/360,2,2,2016-10-06,2017-04-06,2016-10-06,2026-10-06,CALLABLE,Sr Unsecured,750.0,US,USD,ACTV,9.998631074606434,2.4941820670773445,2024-04-08,96.536,96.756,5.508,5.41,96.646,5.459,5.459241561591625,53.870629705484376,2.328305039832078,2.3655599836021057,6.884475970178612
GM,Corp,BBG00FQXLWM7,US37045XBT28,US91282CKE02,GM 4.35 01/17/27,GENERAL MOTORS FINL CO,US DOMESTIC,4.34999999999999,FIXED,30/360,2,2,2017-01-17,2017-07-17,2017-01-17,2027-01-17,CALLABLE,Sr Unsecured,1250.0,US,USD,ACTV,9.998631074606434,2.7761806981519506,2024-04-08,97.165,97.404,5.464,5.368,97.28450000000001,5.416,5.416249997913837,49.36614620307069,2.593777863798028,2.5854033225391144,8.206339000012544
GM,Corp,BBG00JNGBRF9,US37045XCG97,US91282CKG59,GM 3.85 01/05/28,GENERAL MOTORS FINL CO,GLOBAL,3.85,FIXED,30/360,2,2,2018-01-05,2018-07-05,2018-01-05,2028-01-05,CALLABLE,Sr Unsecured,400.0,US,USD,ACTV,9.998631074606434,3.7426420260095825,2024-04-08,94.501,94.811,5.496,5.4,94.656,5.448,5.448275960981847,52.60568635866809,3.392971989314029,3.4377751028242867,14.078892999712066
GM,Corp,BBG00N2HJ8S1,US37045XCS36,US91282CKG59,GM 5.65 01/17/29,GENERAL MOTORS FINL CO,GLOBAL,5.65,FIXED,30/360,2,2,2019-01-17,2019-07-17,2019-01-17,2029-01-17,CALLABLE,Sr Unsecured,500.0,US,USD,ACTV,10.001368925393566,4.777549623545517,2024-04-08,100.224,100.546,5.593,5.511,100.385,5.552,5.554682341963052,62.975136979187184,4.433796391651265,4.1586553104388875,20.803355086272877
GM,Corp,BBG00VJFTZ26,US37045XCY04,US91282CKG59,GM 3.6 06/21/30,GENERAL MOTORS FINL CO,GLOBAL,3.6,FIXED,30/360,2,2,2020-06-22,2020-12-21,2020-06-22,2030-06-21,CALLABLE,Sr Unsecured,1100.0,US,USD,ACTV,9.995893223819301,6.201232032854209,2024-04-08,89.205,89.561,5.69,5.617,89.38300000000001,5.6535,5.653490163583511,73.09828591131168,5.285622222019608,5.453700318197354,34.80278774678008
GM,Corp,BBG00WRC0128,US37045XDA19,US91282CKE02,GM 2.7 08/20/27,GENERAL MOTORS FINL CO,GLOBAL,2.7,FIXED,30/360,2,2,2020-08-20,2021-02-20,2020-08-20,2027-08-20,CALLABLE,Sr Unsecured,900.0,US,USD,ACTV,6.997946611909651,3.3648186173853527,2024-04-08,91.599,91.85,5.469,5.382,91.7245,5.4254999999999995,5.4254045113921165,50.75231204016193,3.014179566156704,3.1816222899777395,11.961719691786712
GM,Corp,BBG00YRTM258,US37045XDD57,US91282CKH33,GM 1 1/4 01/08/26,GENERAL MOTORS FINL CO,GLOBAL,1.25,FIXED,30/360,2,2,2021-01-08,2021-07-08,2021-01-08,2026-01-08,CALLABLE,Sr Unsecured,1500.0,US,USD,ACTV,4.999315537303217,1.7522245037645447,2024-04-08,92.926,93.089,5.56,5.456,93.0075,5.508,5.507694754568236,57.88497789533969,1.6151789487193466,1.7089188603239063,3.775611815261681
GM,Corp,BBG00YRTM294,US37045XDE31,US91282CJZ59,GM 2.35 01/08/31,GENERAL MOTORS FINL CO,GLOBAL,2.35,FIXED,30/360,2,2,2021-01-08,2021-07-08,2021-01-08,2031-01-08,CALLABLE,Sr Unsecured,1000.0,US,USD,ACTV,9.998631074606434,6.751540041067762,2024-04-08,81.32,81.726,5.727,5.645,81.523,5.686,5.685926717578375,76.03841189550835,5.423779612125288,6.1152706937133585,42.62380924359162
GM,Corp,BBG00ZXNHN60,US37045XDH61,US91282CKG59,GM 2.4 04/10/28,GENERAL MOTORS FINL CO,GLOBAL,2.39999999999999,FIXED,30/360,2,2,2021-04-09,2021-10-10,2021-04-09,2028-04-10,CALLABLE,Sr Unsecured,1000.0,US,USD,ACTV,7.003422313483915,4.005475701574264,2024-04-08,89.087,89.352,5.475,5.395,89.21950000000001,5.435,5.435007147490979,51.451313917135955,3.5011854695094953,3.786317523211568,16.58256325310771
GM,Corp,BBG011BYMQQ9,US37045XDK90,US91282CKH33,GM 1 1/2 06/10/26,GENERAL MOTORS FINL CO,GLOBAL,1.5,FIXED,30/360,2,2,2021-06-10,2021-12-10,2021-06-10,2026-06-10,CALLABLE,Sr Unsecured,1250.0,US,USD,ACTV,4.999315537303217,2.1711156741957565,2024-04-08,91.842,92.014,5.547,5.457,91.928,5.502,5.5018318082261235,58.28153461173372,1.9771211255670509,2.1040893989142,5.509158275183898
GM,Corp,BBG011BYMR23,US37045XDL73,US91282CJZ59,GM 2.7 06/10/31,GENERAL MOTORS FINL CO,GLOBAL,2.7,FIXED,30/360,2,2,2021-06-10,2021-12-10,2021-06-10,2031-06-10,CALLABLE,Sr Unsecured,1000.0,US,USD,ACTV,9.998631074606434,7.170431211498974,2024-04-08,82.16,82.518,5.774,5.705,82.339,5.7395,5.73980919495225,81.59920284808655,5.758396787027006,6.364584842788183,46.651364400030126
GM,Corp,BBG012Y2VFY7,US37045XDP87,US91282CKG59,GM 2.4 10/15/28,GENERAL MOTORS FINL CO,GLOBAL,2.39999999999999,FIXED,30/360,2,2,2021-10-15,2022-04-15,2021-10-15,2028-10-15,CALLABLE,Sr Unsecured,1000.0,US,USD,ACTV,7.000684462696783,4.520191649555099,2024-04-08,87.734,88.059,5.506,5.417,87.8965,5.4615,5.46163759380579,53.982312548917086,3.896492204128561,4.189356003983169,20.402193875132873
GM,Corp,BBG014FFBBW8,US37045XDR44,US91282CKE02,GM 2.35 02/26/27,GENERAL MOTORS FINL CO,GLOBAL,2.35,FIXED,30/360,2,2,2022-01-11,2022-08-26,2022-01-11,2027-02-26,CALLABLE,Sr Unsecured,1000.0,US,USD,ACTV,5.125256673511293,2.8856947296372346,2024-04-08,91.763,91.985,5.482,5.393,91.874,5.4375,5.4493871107697505,50.29636515711289,2.595964332791128,2.7613734374787366,9.124838640623212
GM,Corp,BBG014FFBF13,US37045XDS27,US91282CJZ59,GM 3.1 01/12/32,GENERAL MOTORS FINL CO,GLOBAL,3.1,FIXED,30/360,2,2,2022-01-11,2022-07-12,2022-01-11,2032-01-12,CALLABLE,Sr Unsecured,1250.0,US,USD,ACTV,10.001368925393566,7.761806981519507,2024-04-08,83.449,83.823,5.777,5.71,83.636,5.7435,5.74345390573144,81.78514331142541,6.224263884783182,6.749784815245784,52.870429060816946
GM,Corp,BBG016KFH7F9,US37045XDV55,US91282CKG59,GM 4.3 04/06/29,GENERAL MOTORS FINL CO,GLOBAL,4.29999999999999,FIXED,30/360,2,2,2022-04-07,2022-10-06,2022-04-07,2029-04-06,CALLABLE,Sr Unsecured,1100.0,US,USD,ACTV,6.997946611909651,4.993839835728953,2024-04-08,94.532,94.84,5.57,5.496,94.686,5.533,5.533373545855285,61.19267833549429,4.460637971316866,4.481534881418746,23.512237830768758
GM,Corp,BBG017ZGS614,US37045XDW39,US91282CKE02,GM 5 04/09/27,GENERAL MOTORS FINL CO,GLOBAL,5.0,FIXED,30/360,2,2,2022-06-09,2022-10-09,2022-06-09,2027-04-09,CALLABLE,Sr Unsecured,1250.0,US,USD,ACTV,4.832306639288158,3.0006844626967832,2024-04-08,98.752,98.96,5.457,5.38,98.856,5.4185,5.418588720262052,50.17191561853563,2.8175613557042447,2.787852616151946,9.421950191160072
GM,Corp,BBG01C76FJL0,US37045XEB82,US91282CKG59,GM 6 01/09/28,GENERAL MOTORS FINL CO,GLOBAL,6.0,FIXED,30/360,2,2,2023-01-09,2023-07-09,2023-01-09,2028-01-09,CALLABLE,Sr Unsecured,1000.0,US,USD,ACTV,4.999315537303217,3.753593429158111,2024-04-08,101.748,102.009,5.465,5.387,101.8785,5.426,5.4361423924565315,51.44034045608815,3.5523298313870724,3.3338146579331767,13.5396837287128
GM,Corp,BBG01C76FK37,US37045XED49,US91282CJZ59,GM 6.4 01/09/33,GENERAL MOTORS FINL CO,GLOBAL,6.4,FIXED,30/360,2,2,2023-01-09,2023-07-09,2023-01-09,2033-01-09,CALLABLE,Sr Unsecured,1000.0,US,USD,ACTV,10.001368925393566,8.75564681724846,2024-04-08,103.269,103.728,5.905,5.837,103.4985,5.871,5.880950265377758,95.22820724446909,7.817643028325706,6.750602381435525,56.62798559043449
GM,Corp,BBG01G4FRZW3,US37045XEF96,US91282CKH33,GM 5.4 04/06/26,GENERAL MOTORS FINL CO,GLOBAL,5.4,FIXED,30/360,2,2,2023-04-06,2023-10-06,2023-04-06,2026-04-06,AT MATURITY,Sr Unsecured,1650.0,US,USD,ACTV,3.0006844626967832,1.9931553730321698,2024-04-08,99.73,99.901,5.545,5.453,99.8155,5.4990000000000006,5.498772732913494,58.039363147412494,1.9143295157469986,1.8901597331037703,4.577004883566187
GM,Corp,BBG01G4FS0C1,US37045XEG79,US91282CKG59,GM 5.85 04/06/30,GENERAL MOTORS FINL CO,GLOBAL,5.84999999999999,FIXED,30/360,2,2,2023-04-06,2023-10-06,2023-04-06,2030-04-06,CALLABLE,Sr Unsecured,1000.0,US,USD,ACTV,7.000684462696783,5.993155373032169,2024-04-08,101.017,101.377,5.644,5.571,101.197,5.6075,5.611726459115743,68.95650674876636,5.480765435370089,5.095879876118876,30.980715992643553
GM,Corp,BBG01H3V4Z89,US37045XEH52,US91282CKG59,GM 5.8 06/23/28,GENERAL MOTORS FINL CO,GLOBAL,5.79999999999999,FIXED,30/360,2,2,2023-06-23,2023-12-23,2023-06-23,2028-06-23,CALLABLE,Sr Unsecured,1350.0,US,USD,ACTV,5.002053388090349,4.20807665982204,2024-04-08,101.097,101.346,5.497,5.43,101.22149999999999,5.4635,5.46820180863142,54.75518066761233,3.9387411007502897,3.694374798217137,16.5563864414094
GM,Corp,BBG01KFGCVC7,US37045XEN21,US91282CKG59,GM 5.8 01/07/29,GENERAL MOTORS FINL CO,GLOBAL,5.79999999999999,FIXED,30/360,2,2,2023-12-07,2024-07-07,2023-12-07,2029-01-07,CALLABLE,Sr Unsecured,1500.0,US,USD,ACTV,5.086926762491444,4.7501711156741955,2024-04-08,100.847,101.07,5.588,5.533,100.95849999999999,5.5605,5.564818000048399,63.91922345149419,4.420575007059647,4.12030586117169,20.49035300493608
GM,Corp,BBG01KFGCVK8,US37045XEP78,US91282CJZ59,GM 6.1 01/07/34,GENERAL MOTORS FINL CO,GLOBAL,6.09999999999999,FIXED,30/360,2,2,2023-12-07,2024-07-07,2023-12-07,2034-01-07,CALLABLE,Sr Unsecured,1500.0,US,USD,ACTV,10.08624229979466,9.749486652977414,2024-04-08,100.831,101.21,5.982,5.93,101.0205,5.9559999999999995,5.958873034673211,102.94467215461253,8.46660607839326,7.3868919811174765,68.16194740817305
GM,Corp,BBG01LC4WY91,US37045XEQ51,US91282CKE02,GM 5.4 05/08/27,GENERAL MOTORS FINL CO,GLOBAL,5.4,FIXED,30/360,2,2,2024-02-08,2024-11-08,2024-02-08,2027-05-08,AT MATURITY,Sr Unsecured,1200.0,US,USD,ACTV,3.24435318275154,3.080082135523614,2024-04-08,99.803,100.023,5.458,5.38,99.913,5.4190000000000005,5.431380100548268,51.603938276165806,2.9069763246623403,2.817864724580327,9.71863989413584
GM,Corp,BBG01LC4WZ07,US37045XER35,US91282CKF76,GM 5 3/4 02/08/31,GENERAL MOTORS FINL CO,GLOBAL,5.75,FIXED,30/360,2,2,2024-02-08,2024-08-08,2024-02-08,2031-02-08,CALLABLE,Sr Unsecured,1000.0,US,USD,ACTV,7.000684462696783,6.836413415468857,2024-04-08,99.727,100.124,5.797,5.726,99.9255,5.7615,5.761702561507684,83.35846776075522,6.146592280527927,5.651970484458821,38.53936015743956
GM,Corp,BBG01M7V0HK4,US37045XEU63,US91282CKG59,GM 5.55 07/15/29,GENERAL MOTORS FINL CO,GLOBAL,5.54999999999999,FIXED,30/360,2,2,2024-04-04,2024-07-15,2024-04-04,2029-07-15,CALLABLE,Sr Unsecured,1250.0,US,USD,ACTV,5.278576317590692,5.2676249144421625,2024-04-08,99.702,99.956,5.618,5.562,99.82900000000001,5.59,5.589736231416463,66.84933102492914,4.838263931516146,4.585969387593561,24.993051063383263
GM,Corp,BBG01M7V0HX0,US37045XEV47,US91282CJZ59,GM 5.95 04/04/34,GENERAL MOTORS FINL CO,GLOBAL,5.95,FIXED,30/360,2,2,2024-04-04,2024-10-04,2024-04-04,2034-04-04,CALLABLE,Sr Unsecured,1250.0,US,USD,ACTV,9.998631074606434,9.987679671457906,2024-04-08,99.567,99.955,6.008,5.956,99.761,5.982,5.981952560693025,105.38700982219545,8.584377922984693,7.6554197970774265,72.25435041490007
GM,Corp,BBG00LY8L0Z6,US37046ACR41,US91282CKH33,GM 4.7 09/20/26,GENERAL MOTORS FINL CO,DOMESTIC MTN,4.7,FIXED,30/360,2,2,2018-09-20,2019-03-20,2018-09-20,2026-09-20,CALLABLE,Sr Unsecured,1.394,US,USD,ACTV,8.0,2.4503764544832305,2024-04-08,96.352,96.664,6.333,6.19,96.50800000000001,6.2615,6.2612636931240555,132.75432284162497,2.3168259285921513,2.3070440485469996,6.602120487315307
GM,Corp,BBG00XJFQ237,US37046AED37,US91282CKG59,GM 2 3/4 10/20/29,GENERAL MOTORS FINL CO,DOMESTIC MTN,2.75,FIXED,30/360,2,2,2020-10-01,2021-04-20,2020-10-01,2029-10-20,CALLABLE,Sr Unsecured,2.109,US,USD,ACTV,9.051334702258726,5.533196440793977,2024-04-08,83.447,84.008,6.347,6.212,83.72749999999999,6.2795000000000005,6.279460004487386,134.6615213829514,4.680209654403388,5.009077782226387,29.10677282262702
GM,Corp,BBG00YCZN446,US37046AEF84,US91282CKG59,GM 2 1/4 12/20/29,GENERAL MOTORS FINL CO,DOMESTIC MTN,2.25,FIXED,30/360,2,2,2020-12-10,2021-06-20,2020-12-10,2029-12-20,CALLABLE,Sr Unsecured,10.341,US,USD,ACTV,9.026694045174539,5.700205338809035,2024-04-08,81.373,81.919,6.179,6.05,81.646,6.1145,6.11444964412351,118.36192552839286,4.728213188836599,5.246628532083712,31.43935548600905
GM,Corp,BBG00ZDRGRW6,US37046AEG67,US91282CKH33,GM 1 1/4 03/20/26,GENERAL MOTORS FINL CO,DOMESTIC MTN,1.25,FIXED,30/360,2,2,2021-03-04,2021-09-20,2021-03-04,2026-03-20,CALLABLE,Sr Unsecured,1.483,US,USD,ACTV,5.04312114989733,1.946611909650924,2024-04-08,90.914,91.166,6.287,6.139,91.03999999999999,6.213,6.2125202871859075,129.09524198473432,1.7834843770482056,1.9013464811713359,4.563936842580942
GM,Corp,BBG00ZDRJ1G8,US37046AEH41,US91282CKG59,GM 2 1/4 03/20/30,GENERAL MOTORS FINL CO,DOMESTIC MTN,2.25,FIXED,30/360,2,2,2021-03-04,2021-09-20,2021-03-04,2030-03-20,CALLABLE,Sr Unsecured,1.195,US,USD,ACTV,9.043121149897331,5.946611909650924,2024-04-08,79.783,80.363,6.391,6.256,80.07300000000001,6.3235,6.3233714974365345,139.30833912338338,4.894241758480227,5.490865880767439,34.17865131881048
GM,Corp,BBG00ZHDXZF5,US37046AEK79,US91282CKG59,GM 2.35 03/20/29,GENERAL MOTORS FINL CO,DOMESTIC MTN,2.35,FIXED,30/360,2,2,2021-03-11,2021-09-20,2021-03-11,2029-03-20,CALLABLE,Sr Unsecured,3.303,US,USD,ACTV,8.02464065708419,4.947296372347707,2024-04-08,83.713,84.231,6.227,6.091,83.972,6.159000000000001,6.159089404356892,123.10287790608979,4.211780689378992,4.617405712218288,24.36551007701744
GM,Corp,BBG00ZS3KYH0,US37046AEM36,US91282CKG59,GM 2.7 04/20/29,GENERAL MOTORS FINL CO,DOMESTIC MTN,2.7,FIXED,30/360,2,2,2021-04-01,2021-10-20,2021-04-01,2029-04-20,CALLABLE,Sr Unsecured,6.694,US,USD,ACTV,8.05201916495551,5.032169746748802,2024-04-08,85.245,85.767,6.157,6.023,85.506,6.09,6.08967272117734,116.07938714447234,4.311753651376295,4.596881717267683,24.561886867302796
GM,Corp,BBG00ZVCPDR6,US37046AEN19,US91282CKH33,GM 1.7 04/20/26,GENERAL MOTORS FINL CO,DOMESTIC MTN,1.7,FIXED,30/360,2,2,2021-04-08,2021-10-20,2021-04-08,2026-04-20,CALLABLE,Sr Unsecured,3.292,US,USD,ACTV,5.032169746748802,2.0314852840520192,2024-04-08,91.527,91.788,6.211,6.064,91.6575,6.1375,6.137813662514146,121.21779867893504,1.8658579507201418,1.9610323672614316,4.864808062735143
GM,Corp,BBG00ZVCPJ75,US37046AEP66,US91282CJZ59,GM 2.9 04/20/31,GENERAL MOTORS FINL CO,DOMESTIC MTN,2.89999999999999,FIXED,30/360,2,2,2021-04-08,2021-10-20,2021-04-08,2031-04-20,CALLABLE,Sr Unsecured,2.61,US,USD,ACTV,10.03148528405202,7.030800821355236,2024-04-08,80.063,80.711,6.476,6.344,80.387,6.41,6.40994742061943,147.71459479190486,5.7160641018780405,6.183927776993715,44.44221262294261
GM,Corp,BBG010ZDD5Y8,US37046AER23,US91282CKG59,GM 2 1/4 05/20/29,GENERAL MOTORS FINL CO,DOMESTIC MTN,2.25,FIXED,30/360,2,2,2021-05-20,2021-11-20,2021-05-20,2029-05-20,CALLABLE,Sr Unsecured,1.613,US,USD,ACTV,8.0,5.114305270362765,2024-04-08,82.523,83.052,6.302,6.166,82.7875,6.234,6.233677520602941,130.40284415030493,4.319681491025899,4.733276093464742,25.744191302399148
GM,Corp,BBG013B51WK4,US37046AEU51,US91282CKG59,GM 2.4 11/20/28,GENERAL MOTORS FINL CO,DOMESTIC MTN,2.39999999999999,FIXED,30/360,2,2,2021-11-12,2022-05-20,2021-11-12,2028-11-20,CALLABLE,Sr Unsecured,17.237,US,USD,ACTV,7.02258726899384,4.618754277891855,2024-04-08,85.641,86.105,6.011,5.884,85.873,5.9475,5.947229943364019,101.65757300623532,3.973616055395149,4.286686876705927,21.275434598692964
GM,Corp,BBG013Y37K15,US37046AEW18,US91282CKG59,GM 2.55 12/20/29,GENERAL MOTORS FINL CO,DOMESTIC MTN,2.54999999999999,FIXED,30/360,2,2,2021-12-16,2022-06-20,2021-12-16,2029-12-20,CALLABLE,Sr Unsecured,2.749,US,USD,ACTV,8.010951403148528,5.700205338809035,2024-04-08,82.191,82.76,6.322,6.187,82.47550000000001,6.2545,6.254344908424854,132.14478126211364,4.771112439535269,5.202725478145875,31.093684413269287
GM,Corp,BBG0156KPD64,US37046AEX90,US91282CKG59,GM 3.05 02/20/29,GENERAL MOTORS FINL CO,DOMESTIC MTN,3.04999999999999,FIXED,30/360,2,2,2022-02-17,2022-08-20,2022-02-17,2029-02-20,CALLABLE,Sr Unsecured,2.993,US,USD,ACTV,7.008898015058179,4.870636550308008,2024-04-08,86.809,87.33,6.236,6.1,87.0695,6.167999999999999,6.168059044550736,123.16800157194916,4.232606185232687,4.471741540988484,23.151715975797426
GM,Corp,BBG015KM6508,US37046AEY73,US91282CKG59,GM 3.2 03/20/28,GENERAL MOTORS FINL CO,DOMESTIC MTN,3.2,FIXED,30/360,2,2,2022-03-03,2022-09-20,2022-03-03,2028-03-20,CALLABLE,Sr Unsecured,3.203,US,USD,ACTV,6.047912388774812,3.9479808350444903,2024-04-08,89.787,90.237,6.155,6.017,90.012,6.086,6.085706811398269,115.85245212969363,3.5206282842683403,3.6795989743408577,15.839088241189385
GM,Corp,BBG016DX9MT9,US37046AEZ49,US91282CKH33,GM 4 04/20/26,GENERAL MOTORS FINL CO,DOMESTIC MTN,4.0,FIXED,30/360,2,2,2022-04-07,2022-10-20,2022-04-07,2026-04-20,CALLABLE,Sr Unsecured,69.594,US,USD,ACTV,4.035592060232717,2.0314852840520192,2024-04-08,96.478,96.974,5.867,5.599,96.726,5.7330000000000005,5.732449048012496,81.2395788668755,1.9200059240042384,1.9078967224798953,4.705338653940579
GM,Corp,BBG017B6GFF0,US37046AFA88,US91282CKG59,GM 5 08/20/28,GENERAL MOTORS FINL CO,DOMESTIC MTN,5.0,FIXED,30/360,2,2,2022-05-19,2022-11-20,2022-05-19,2028-08-20,CALLABLE,Sr Unsecured,24.742,US,USD,ACTV,6.2559890485968515,4.3668720054757015,2024-04-08,95.96,96.41,6.068,5.947,96.185,6.0075,6.00536458252125,107.56989294043166,4.018832670836399,3.902893911949652,18.140357829759687
GM,Corp,BBG017HZ7QT1,US37046AFB61,US91282CKH33,GM 4 1/4 05/20/26,GENERAL MOTORS FINL CO,DOMESTIC MTN,4.25,FIXED,30/360,2,2,2022-05-26,2022-11-20,2022-05-26,2026-05-20,CALLABLE,Sr Unsecured,5.122,US,USD,ACTV,3.9835728952772076,2.113620807665982,2024-04-08,96.33,96.605,6.127,5.983,96.4675,6.055,6.054870022088288,113.33940942624957,2.000806573051327,1.983845019014877,5.044776536423695
GM,Corp,BBG01963PZF5,US37046AFC45,US91282CKG59,GM 5.15 08/20/28,GENERAL MOTORS FINL CO,DOMESTIC MTN,5.15,FIXED,30/360,2,2,2022-08-25,2023-02-20,2022-08-25,2028-08-20,CALLABLE,Sr Unsecured,19.747,US,USD,ACTV,5.987679671457905,4.3668720054757015,2024-04-08,96.676,97.137,6.026,5.902,96.9065,5.964,5.964049480670981,103.49924497678678,4.03238597191193,3.893061026157321,18.07873609476747
GM,Corp,BBG019LXFPP4,US37046AFD28,US91282CKG59,GM 5.7 09/20/28,GENERAL MOTORS FINL CO,DOMESTIC MTN,5.7,FIXED,30/360,2,2,2022-09-22,2023-03-20,2022-09-22,2028-09-20,CALLABLE,Sr Unsecured,9.426,US,USD,ACTV,5.9958932238193015,4.4517453798767965,2024-04-08,97.901,98.391,6.247,6.118,98.146,6.1825,6.182343795150519,124.8801140172151,4.155994752243136,3.9411544820855275,18.55075717875455
GM,Corp,BBG01BFJ4ZG7,US37046AFE01,US91282CKH33,GM 6 3/4 11/20/28,GENERAL MOTORS FINL CO,DOMESTIC MTN,6.75,FIXED,30/360,2,2,2022-11-17,2023-05-20,2022-11-17,2028-11-20,CALLABLE,Sr Unsecured,26.363,US,USD,ACTV,6.009582477754963,4.618754277891855,2024-04-08,99.894,100.351,6.775,3.486,100.1225,5.1305000000000005,6.716196445394335,177.42852420677818,4.405008671688529,3.922158404315115,18.935019967553995
GM,Corp,BBG01BS31KY4,US37046AFF75,US91282CKH33,GM 5 3/4 12/20/26,GENERAL MOTORS FINL CO,DOMESTIC MTN,5.75,FIXED,30/360,2,2,2022-12-08,2023-06-20,2022-12-08,2026-12-20,CALLABLE,Sr Unsecured,12.503,US,USD,ACTV,4.032854209445585,2.6995208761122518,2024-04-08,98.963,99.287,6.169,6.036,99.125,6.102499999999999,6.102897476404904,117.33732602537594,2.58141792931209,2.467437608789885,7.614852860973465
GM,Corp,BBG01F7T1477,US37046AFG58,US91282CKE02,GM 5.4 02/20/27,GENERAL MOTORS FINL CO,DOMESTIC MTN,5.4,FIXED,30/360,2,2,2023-02-24,2023-08-20,2023-02-24,2027-02-20,CALLABLE,Sr Unsecured,5.244,US,USD,ACTV,3.9890485968514717,2.869267624914442,2024-04-08,98.348,98.706,6.034,5.895,98.527,5.964499999999999,5.964573623985052,103.06047578214373,2.7220493841227347,2.645433607058131,8.59740400787381
GM,Corp,BBG01G2897B6,US37046AFH32,US91282CKG59,GM 5.85 04/20/29,GENERAL MOTORS FINL CO,DOMESTIC MTN,5.84999999999999,FIXED,30/360,2,2,2023-04-06,2023-10-20,2023-04-06,2029-04-20,CALLABLE,Sr Unsecured,14.143,US,USD,ACTV,6.039698836413415,5.032169746748802,2024-04-08,98.563,99.089,6.186,6.062,98.826,6.1240000000000006,6.124279613047838,119.4937926857499,4.674085401491884,4.27567427922983,22.34645486719112
IBM,Corp,BBG00003PFM7,US459200AP64,US912810TV08,IBM 7 1/8 12/01/2096,IBM CORP,US DOMESTIC,7.125,FIXED,30/360,2,2,1996-12-06,1997-06-01,1996-12-06,2096-12-01,AT MATURITY,Sr Unsecured,316.39,US,USD,ACTV,99.98631074606433,72.64887063655031,2024-04-08,124.589,126.256,5.699,5.622,125.4225,5.6605,5.660084252668147,73.61200911974483,30.067180549222954,18.4357290328862,639.0927341301303
IBM,Corp,BBG00004MXL0,US459200AR21,US91282CKE02,IBM 6.22 08/01/27,IBM CORP,US DOMESTIC,6.21999999999999,FIXED,30/360,2,2,1997-08-04,1998-02-01,1997-08-01,2027-08-01,PUTABLE,Sr Unsecured,468.574,US,USD,ACTV,29.99041752224504,3.3127994524298425,2024-04-08,103.802,104.168,4.957,4.839,103.98500000000001,4.898,4.897647298872472,-1.422602976885523,3.1612460862709315,2.980337992250294,10.883235613303063
IBM,Corp,BBG000058NM4,US459200AS04,US91282CKG59,IBM 6 1/2 01/15/28,IBM CORP,US DOMESTIC,6.5,FIXED,30/360,2,2,1998-01-09,1998-07-15,1998-01-09,2028-01-15,AT MATURITY,Sr Unsecured,313.19,US,USD,ACTV,30.015058179329227,3.7700205338809036,2024-04-08,105.805,106.146,4.793,4.697,105.97550000000001,4.745,4.744935177266598,-16.612288185978674,3.604546781833663,3.325783082730153,13.524480943851323
IBM,Corp,BBG00001HBL0,US459200BB69,US91282CJZ59,IBM 5 7/8 11/29/32,IBM CORP,GLOBAL,5.875,FIXED,30/360,2,2,2002-11-27,2003-05-29,2002-11-27,2032-11-29,AT MATURITY,Sr Unsecured,600.0,US,USD,ACTV,30.00684462696783,8.643394934976044,2024-04-08,105.031,105.618,5.145,5.063,105.3245,5.103999999999999,5.103861384093761,18.766448174886346,7.562969527512445,6.733591269445071,56.177652463494205
IBM,Corp,BBG0000L5Z27,US459200GS40,US91282CJZ59,IBM 5.6 11/30/39,IBM CORP,US DOMESTIC,5.59999999999999,FIXED,30/360 NON-EOM,2,2,2009-11-30,2010-05-30,2009-11-30,2039-11-30,AT MATURITY,Sr Unsecured,745.095,US,USD,ACTV,29.998631074606433,15.644079397672828,2024-04-08,101.515,102.142,5.454,5.395,101.82849999999999,5.4245,5.4243501648306856,50.392830112867664,11.781289522290875,10.426378360592183,144.0554898824874
IBM,Corp,BBG0032VNXV0,US459200HF10,US912810TZ12,IBM 4 06/20/42,IBM CORP,US DOMESTIC,4.0,FIXED,30/360,2,2,2012-06-20,2012-12-20,2012-06-20,2042-06-20,AT MATURITY,Sr Unsecured,1107.313,US,USD,ACTV,29.998631074606433,18.198494182067076,2024-04-08,82.566,83.139,5.532,5.475,82.85249999999999,5.5035,5.503053841573065,58.18955839161424,11.487844010893241,12.334608417762249,199.19089214896212
IBM,Corp,BBG00C7QBBX5,US459200JG74,US91282CKH33,IBM 3.45 02/19/26,IBM CORP,GLOBAL,3.45,FIXED,30/360,2,2,2016-02-19,2016-08-19,2016-02-19,2026-02-19,AT MATURITY,Sr Unsecured,1350.0,US,USD,ACTV,10.001368925393566,1.8672142368240932,2024-04-08,97.0,97.167,5.161,5.064,97.0835,5.1125,5.11259277909994,18.748452680793186,1.761356278380174,1.7910960071461934,4.137815784167579
IBM,Corp,BBG00C7QBDN2,US459200JH57,US912810TZ12,IBM 4.7 02/19/46,IBM CORP,GLOBAL,4.7,FIXED,30/360,2,2,2016-02-19,2016-08-19,2016-02-19,2046-02-19,AT MATURITY,Sr Unsecured,650.0,US,USD,ACTV,30.001368925393567,21.867214236824093,2024-04-08,89.341,90.367,5.547,5.46,89.854,5.5035,5.503150504082442,58.07736834370526,13.530910079048997,13.371534373507389,245.69358266093056
IBM,Corp,BBG00FVNGFP3,US459200JR30,US91282CKE02,IBM 3.3 01/27/27,IBM CORP,GLOBAL,3.29999999999999,FIXED,30/360,2,2,2017-01-27,2017-07-27,2017-01-27,2027-01-27,AT MATURITY,Sr Unsecured,500.0,US,USD,ACTV,9.998631074606434,2.8035592060232717,2024-04-08,95.531,95.777,5.031,4.933,95.654,4.981999999999999,4.9817980453372,6.652986967067157,2.568130360158653,2.6465056986320095,8.502871717687166
IBM,Corp,BBG00P3BLH05,US459200JZ55,US91282CKH33,IBM 3.3 05/15/26,IBM CORP,GLOBAL,3.29999999999999,FIXED,30/360,2,2,2019-05-15,2019-11-15,2019-05-15,2026-05-15,AT MATURITY,Sr Unsecured,3000.0,US,USD,ACTV,7.000684462696783,2.099931553730322,2024-04-08,96.276,96.456,5.195,5.102,96.366,5.1485,5.148510434533518,23.875750340091564,1.9632982093822644,1.991250022141172,5.050338415221452
IBM,Corp,BBG00P3BLH14,US459200KA85,US91282CKG59,IBM 3 1/2 05/15/29,IBM CORP,GLOBAL,3.5,FIXED,30/360,2,2,2019-05-15,2019-11-15,2019-05-15,2029-05-15,AT MATURITY,Sr Unsecured,3250.0,US,USD,ACTV,10.001368925393566,5.100616016427105,2024-04-08,93.053,93.33,5.063,4.998,93.19149999999999,5.0305,5.030145876109601,11.750120077737778,4.4544836272850254,4.573411902454666,24.58043145746961
IBM,Corp,BBG00P3BLH23,US459200KB68,US91282CJZ59,IBM 4.15 05/15/39,IBM CORP,GLOBAL,4.15,FIXED,30/360,2,2,2019-05-15,2019-11-15,2019-05-15,2039-05-15,AT MATURITY,Sr Unsecured,2000.0,US,USD,ACTV,20.0,15.099247091033538,2024-04-08,86.525,87.068,5.473,5.414,86.79650000000001,5.4435,5.443380967722107,52.37015275107461,10.46646441881483,10.791898166248929,148.77255154998042
IBM,Corp,BBG00P3BLH50,US459200KC42,US912810TV08,IBM 4 1/4 05/15/49,IBM CORP,GLOBAL,4.25,FIXED,30/360,2,2,2019-05-15,2019-11-15,2019-05-15,2049-05-15,AT MATURITY,Sr Unsecured,3000.0,US,USD,ACTV,30.001368925393567,25.100616016427104,2024-04-08,82.702,83.35,5.533,5.478,83.026,5.5055,5.50551497116685,58.42927896533134,13.960311965140342,14.494518934085196,299.23517982170523
IBM,Corp,BBG00TL9X0Q8,US459200KH39,US91282CKE02,IBM 1.7 05/15/27,IBM CORP,GLOBAL,1.7,FIXED,30/360,2,2,2020-05-07,2020-11-15,2020-05-07,2027-05-15,CALLABLE,Sr Unsecured,1250.0,US,USD,ACTV,7.019849418206708,3.0992470910335386,2024-04-08,90.373,90.596,5.099,5.015,90.4845,5.057,5.05716983228922,14.769577274773267,2.744465047929933,2.9682783446007988,10.450096278038798
IBM,Corp,BBG00TL9X0X0,US459200KJ94,US91282CKG59,IBM 1.95 05/15/30,IBM CORP,GLOBAL,1.95,FIXED,30/360,2,2,2020-05-07,2020-11-15,2020-05-07,2030-05-15,CALLABLE,Sr Unsecured,1350.0,US,USD,ACTV,10.020533880903491,6.099931553730322,2024-04-08,83.423,83.778,5.152,5.077,83.60050000000001,5.1145,5.114395014623937,20.078088175328094,4.942718757536256,5.623494514475381,35.91689681271994
IBM,Corp,BBG00TL9X159,US459200KK67,US912810TZ12,IBM 2.85 05/15/40,IBM CORP,GLOBAL,2.85,FIXED,30/360,2,2,2020-05-07,2020-11-15,2020-05-07,2040-05-15,CALLABLE,Sr Unsecured,650.0,US,USD,ACTV,20.021902806297057,16.10130047912389,2024-04-08,71.972,72.603,5.495,5.423,72.2875,5.459,5.459050647014374,53.85975594500253,9.831492547862501,12.110841188806532,181.56240598767977
IBM,Corp,BBG00TL9X186,US459200KL41,US912810TV08,IBM 2.95 05/15/50,IBM CORP,GLOBAL,2.95,FIXED,30/360,2,2,2020-05-07,2020-11-15,2020-05-07,2050-05-15,CALLABLE,Sr Unsecured,750.0,US,USD,ACTV,30.02053388090349,26.099931553730322,2024-04-08,64.907,65.592,5.498,5.432,65.2495,5.465,5.464579723775385,54.404351038264004,12.236926065593138,16.050816517970738,356.21205020827466
IBM,Corp,BBG0152L6FV4,US459200KM24,US91282CKE02,IBM 2.2 02/09/27,IBM CORP,GLOBAL,2.2,FIXED,30/360,2,2,2022-02-09,2022-08-09,2022-02-09,2027-02-09,CALLABLE,Sr Unsecured,650.0,US,USD,ACTV,4.999315537303217,2.839151266255989,2024-04-08,92.472,92.699,5.088,4.997,92.5855,5.0425,5.04248758405447,12.214837147933519,2.555657606555996,2.719645150550043,8.86925315037096
IBM,Corp,BBG0152L6H31,US459200KN07,US91282CJZ59,IBM 2.72 02/09/32,IBM CORP,GLOBAL,2.72,FIXED,30/360,2,2,2022-02-09,2022-08-09,2022-02-09,2032-02-09,CALLABLE,Sr Unsecured,500.0,US,USD,ACTV,9.998631074606434,7.838466803559206,2024-04-08,85.172,85.718,5.034,4.941,85.445,4.9875,4.987483732402326,7.191159028762137,6.177035897721561,6.915135477767817,54.89583449192557
IBM,Corp,BBG0152L6HW9,US459200KP54,US912810TV08,IBM 3.43 02/09/52,IBM CORP,GLOBAL,3.43,FIXED,30/360,2,2,2022-02-09,2022-08-09,2022-02-09,2052-02-09,CALLABLE,Sr Unsecured,650.0,US,USD,ACTV,29.998631074606433,27.838466803559207,2024-04-08,69.994,70.811,5.562,5.488,70.4025,5.525,5.5244270466268075,60.19050547384281,13.33812236337256,16.141945671948264,369.26915286673585
IBM,Corp,BBG018WYFHJ7,US459200KT76,US91282CKE02,IBM 4.15 07/27/27,IBM CORP,GLOBAL,4.15,FIXED,30/360,2,3,2022-07-27,2023-01-27,2022-07-27,2027-07-27,CALLABLE,Sr Unsecured,750.0,US,USD,ACTV,4.999315537303217,3.299110198494182,2024-04-08,97.18,97.457,5.088,4.994,97.3185,5.041,5.041521318256856,13.192847261793561,3.0302893842539946,3.048012274421578,11.184098915935966
IBM,Corp,BBG018WYFHX1,US459200KU40,US91282CJZ59,IBM 4.4 07/27/32,IBM CORP,GLOBAL,4.4,FIXED,30/360,2,3,2022-07-27,2023-01-27,2022-07-27,2032-07-27,CALLABLE,Sr Unsecured,750.0,US,USD,ACTV,10.001368925393566,8.301163586584531,2024-04-08,94.978,95.395,5.15,5.086,95.1865,5.118,5.118488900363446,20.3501960422579,6.899780916886301,6.858046468697176,56.137512382145324
IBM,Corp,BBG018WYFJ12,US459200KV23,US912810TV08,IBM 4.9 07/27/52,IBM CORP,GLOBAL,4.9,FIXED,30/360,2,3,2022-07-27,2023-01-27,2022-07-27,2052-07-27,CALLABLE,Sr Unsecured,750.0,US,USD,ACTV,30.001368925393567,28.301163586584533,2024-04-08,91.156,92.032,5.521,5.455,91.594,5.4879999999999995,5.487952806055545,56.69168102641043,15.90637021161011,15.005716769515903,331.8679107613172
IBM,Corp,BBG01DMT8922,US459200KW06,US91282CKH33,IBM 4 1/2 02/06/26,IBM CORP,GLOBAL,4.5,FIXED,30/360,2,4,2023-02-06,2023-08-06,2023-02-06,2026-02-06,AT MATURITY,Sr Unsecured,850.0,US,USD,ACTV,3.0006844626967832,1.8316221765913758,2024-04-08,99.11,99.311,5.013,4.896,99.2105,4.9544999999999995,4.956083588302136,3.167884123907137,1.7426113453531193,1.736320672723622,3.9327023927416924
IBM,Corp,BBG01DMT8986,US459200KX88,US91282CKG59,IBM 4 1/2 02/06/28,IBM CORP,GLOBAL,4.5,FIXED,30/360,2,4,2023-02-06,2023-08-06,2023-02-06,2028-02-06,CALLABLE,Sr Unsecured,1000.0,US,USD,ACTV,4.999315537303217,3.8302532511978096,2024-04-08,98.362,98.61,4.974,4.901,98.48599999999999,4.9375,4.938250206410884,2.1517091862208737,3.5088784111639613,3.482425334253605,14.481227945921171
IBM,Corp,BBG01DMT89M0,US459200KY61,US91282CJZ59,IBM 4 3/4 02/06/33,IBM CORP,GLOBAL,4.75,FIXED,30/360,2,4,2023-02-06,2023-08-06,2023-02-06,2033-02-06,CALLABLE,Sr Unsecured,750.0,US,USD,ACTV,10.001368925393566,8.83230663928816,2024-04-08,96.878,97.365,5.195,5.124,97.1215,5.1594999999999995,5.159474469721319,24.03298185985302,7.369228565563253,7.14102799578226,61.446100128525856
IBM,Corp,BBG01DMT89X8,US459200KZ37,US912810TV08,IBM 5.1 02/06/53,IBM CORP,GLOBAL,5.09999999999999,FIXED,30/360,2,4,2023-02-06,2023-08-06,2023-02-06,2053-02-06,CALLABLE,Sr Unsecured,650.0,US,USD,ACTV,30.001368925393567,28.83230663928816,2024-04-08,94.182,95.042,5.504,5.442,94.612,5.473,5.473195008933544,55.11720158796825,16.430795769099333,15.020855907148922,334.7631251582769
MS,Corp,BBG0072J1B86,US6174467Y92,US91282CKH33,MS 4.35 09/08/26,MORGAN STANLEY,DOMESTIC MTN,4.34999999999999,FIXED,30/360,2,2,2014-09-08,2015-03-08,2014-09-08,2026-09-08,AT MATURITY,Subordinated,2250.0,US,USD,ACTV,12.0,2.4175222450376452,2024-04-08,97.595,97.845,5.426,5.312,97.72,5.369,5.3688865676522255,44.735263460076574,2.272988404189008,2.2820115833788095,6.465474837093046
MS,Corp,BBG00001WGX9,US617446HD43,US91282CJZ59,MS 7 1/4 04/01/32,MORGAN STANLEY,GLOBAL,7.25,FIXED,30/360,2,2,2002-04-03,2002-10-01,2002-04-03,2032-04-01,AT MATURITY,Sr Unsecured,984.55,US,USD,ACTV,29.9958932238193,7.9808350444900755,2024-04-08,112.929,113.398,5.245,5.178,113.1635,5.2115,5.211269862949848,29.38796727593849,7.420345880977968,6.242187337100663,47.98503074159654
MS,Corp,BBG00000DYG2,US61746BCY02,US91282CKH33,MS 6 1/4 08/09/26,MORGAN STANLEY,DOMESTIC MTN,6.25,FIXED,30/360,2,2,2006-08-09,2007-02-09,2006-08-09,2026-08-09,AT MATURITY,Sr Unsecured,723.23,US,USD,ACTV,20.0,2.3353867214236823,2024-04-08,102.019,102.265,5.313,5.201,102.142,5.257,5.257252402603626,34.006555379458206,2.258015295446634,2.1620890041618384,5.922116553168713
MS,Corp,BBG00C025VB2,US61746BDZ67,US91282CKH33,MS 3 7/8 01/27/26,MORGAN STANLEY,GLOBAL,3.875,FIXED,30/360,2,2,2016-01-27,2016-07-27,2016-01-27,2026-01-27,AT MATURITY,Sr Unsecured,3000.0,US,USD,ACTV,10.001368925393566,1.8042436687200547,2024-04-08,97.452,97.641,5.378,5.264,97.54650000000001,5.321,5.320923767525204,39.76859452993146,1.7083163172076195,1.723001668588906,3.8714395304009974
MS,Corp,BBG00FRY84X9,US61746BEF94,US91282CKE02,MS 3 5/8 01/20/27,MORGAN STANLEY,US DOMESTIC,3.625,FIXED,30/360,2,2,2017-01-20,2017-07-20,2017-01-20,2027-01-20,AT MATURITY,Sr Unsecured,3000.0,US,USD,ACTV,9.998631074606434,2.784394250513347,2024-04-08,96.087,96.303,5.153,5.066,96.195,5.1095,5.10949742007618,19.177750753284183,2.572153043976862,2.61679726686475,8.348999670957188
MS,Corp,BBG00FRY86T9,US61746BEG77,US912810TZ12,MS 4 3/8 01/22/47,MORGAN STANLEY,US DOMESTIC,4.375,FIXED,30/360,2,2,2017-01-20,2017-07-22,2017-01-20,2047-01-22,AT MATURITY,Sr Unsecured,2250.0,US,USD,ACTV,30.0041067761807,22.78986995208761,2024-04-08,85.343,86.215,5.512,5.437,85.779,5.4745,5.474255420267584,55.308908416317095,13.413076997909572,13.833466652769527,264.54922173691006
MS,Corp,BBG00801CC81,US61747YDY86,US912810TZ12,MS 4.3 01/27/45,MORGAN STANLEY,GLOBAL,4.29999999999999,FIXED,30/360,2,2,2015-01-27,2015-07-27,2015-01-27,2045-01-27,AT MATURITY,Sr Unsecured,2500.0,US,USD,ACTV,30.001368925393567,20.804928131416837,2024-04-08,85.84,86.559,5.445,5.381,86.1995,5.413,5.413258068263531,49.28349508843133,12.673992100960895,13.216426716032645,235.91147015631927
MS,Corp,BBG0036X1KT7,US617482V925,US912810TZ12,MS 6 3/8 07/24/42,MORGAN STANLEY,GLOBAL,6.375,FIXED,30/360,2,2,2012-07-24,2013-01-24,2012-07-24,2042-07-24,AT MATURITY,Sr Unsecured,2000.0,US,USD,ACTV,29.998631074606433,18.29158110882957,2024-04-08,110.458,111.34,5.463,5.391,110.899,5.427,5.426860384643079,50.70362841988965,13.804134385839198,11.282968892653287,174.33240710894233
MS,Corp,BBG005ZPSLP0,US61760LFM28,US91282CKG59,MS 4.2 02/21/29,MORGAN STANLEY,GLOBAL,4.2,FIXED,30/360,2,2,2014-02-21,2014-08-21,2014-02-21,2029-02-21,AT MATURITY,Sr Unsecured,0.179,US,USD,ACTV,15.000684462696784,4.87337440109514,2024-04-08,93.669,94.166,5.708,5.585,93.91749999999999,5.6465,5.646193327634368,71.80578052881592,4.348336289734469,4.370255670404361,22.45580429445452
MS,Corp,BBG00DF1C1P9,US61761J3R84,US91282CKH33,MS 3 1/8 07/27/26,MORGAN STANLEY,DOMESTIC MTN,3.125,FIXED,30/360,2,2,2016-07-25,2017-01-27,2016-07-25,2026-07-27,AT MATURITY,Sr Unsecured,3000.0,US,USD,ACTV,10.004106776180699,2.299794661190965,2024-04-08,95.328,95.521,5.31,5.217,95.4245,5.2635,5.263368420302869,35.17983280269942,2.1291889819578347,2.192950080567216,5.987333942076054
MS,Corp,BBG008KF2W76,US61761JZN26,US91282CKE02,MS 3.95 04/23/27,MORGAN STANLEY,GLOBAL,3.95,FIXED,30/360,2,2,2015-04-23,2015-10-23,2015-04-23,2027-04-23,AT MATURITY,Subordinated,2000.0,US,USD,ACTV,12.0,3.0390143737166326,2024-04-08,96.162,96.472,5.335,5.221,96.31700000000001,5.2780000000000005,5.278136245906352,36.427643501357714,2.805016848717378,2.801947521109413,9.609714500316265
ORCL,Corp,BBG0000CCZ38,US68389XAE58,US91282CJZ59,ORCL 6 1/2 04/15/38,ORACLE CORP,GLOBAL,6.5,FIXED,30/360,2,2,2008-04-09,2008-10-15,2008-04-09,2038-04-15,AT MATURITY,Sr Unsecured,1250.0,US,USD,ACTV,30.015058179329227,14.017796030116358,2024-04-08,107.106,107.794,5.754,5.686,107.44999999999999,5.72,5.7198468156158935,79.57046309169621,11.521309994111052,9.3415781004645,116.30949406882608
ORCL,Corp,BBG00005C1C8,US68389XAH89,US91282CJZ59,ORCL 6 1/8 07/08/39,ORACLE CORP,GLOBAL,6.125,FIXED,30/360,2,2,2009-07-08,2010-01-08,2009-07-08,2039-07-08,AT MATURITY,Sr Unsecured,1250.0,US,USD,ACTV,29.998631074606433,15.247091033538672,2024-04-08,102.95,103.68,5.829,5.758,103.315,5.7935,5.793530943244695,86.82975477115869,11.982830788825447,10.126853455556446,135.81695645512275
ORCL,Corp,BBG0027G8HG9,US68389XAM74,US912810TZ12,ORCL 5 3/8 07/15/40,ORACLE CORP,GLOBAL,5.375,FIXED,30/360,2,2,2011-12-12,2012-01-15,2011-07-15,2040-07-15,AT MATURITY,Sr Unsecured,2240.435,US,USD,ACTV,28.591375770020534,16.268309377138944,2024-04-08,95.32,95.907,5.823,5.765,95.61349999999999,5.7940000000000005,5.794159083813429,86.85889508277009,11.939919416470492,10.853131954889903,155.43072215867923
ORCL,Corp,BBG006R54KG9,US68389XAV73,US91282CJZ59,ORCL 4.3 07/08/34,ORACLE CORP,GLOBAL,4.29999999999999,FIXED,30/360,2,2,2014-07-08,2015-01-08,2014-07-08,2034-07-08,CALLABLE,Sr Unsecured,1750.0,US,USD,ACTV,20.0,10.247775496235455,2024-04-08,90.692,91.065,5.5,5.449,90.8785,5.4745,5.474147824566819,55.38759622976072,8.122758091315095,8.127698485522265,80.12269075496549
ORCL,Corp,BBG006R54KN1,US68389XAW56,US912810TZ12,ORCL 4 1/2 07/08/44,ORACLE CORP,GLOBAL,4.5,FIXED,30/360,2,2,2014-07-08,2015-01-08,2014-07-08,2044-07-08,CALLABLE,Sr Unsecured,1000.0,US,USD,ACTV,30.001368925393567,20.249144421629023,2024-04-08,83.823,84.476,5.876,5.814,84.14949999999999,5.845000000000001,5.844947985559701,91.84384286714163,12.726378984863384,12.855835747864306,223.53074922284117
ORCL,Corp,BBG008LS4TV5,US68389XBD66,US91282CKG59,ORCL 3 1/4 05/15/30,ORACLE CORP,GLOBAL,3.25,FIXED,30/360,2,2,2015-05-05,2015-11-15,2015-05-05,2030-05-15,CALLABLE,Sr Unsecured,500.0,US,USD,ACTV,15.028062970568104,6.099931553730322,2024-04-08,89.638,90.042,5.258,5.175,89.84,5.2165,5.216156773269177,30.102866511711852,5.151635833739352,5.406454720004608,34.11105760086976
ORCL,Corp,BBG008LS4VN9,US68389XBE40,US91282CJZ59,ORCL 3.9 05/15/35,ORACLE CORP,GLOBAL,3.89999999999999,FIXED,30/360,2,2,2015-05-05,2015-11-15,2015-05-05,2035-05-15,CALLABLE,Sr Unsecured,1250.0,US,USD,ACTV,20.027378507871322,11.099247091033538,2024-04-08,86.356,86.776,5.564,5.508,86.566,5.536,5.535917044430973,61.53455171211889,8.44107430599497,8.723027893250066,92.74515529509118
ORCL,Corp,BBG008LS4X46,US68389XBF15,US912810TZ12,ORCL 4 1/8 05/15/45,ORACLE CORP,GLOBAL,4.125,FIXED,30/360,2,2,2015-05-05,2015-11-15,2015-05-05,2045-05-15,CALLABLE,Sr Unsecured,2000.0,US,USD,ACTV,30.028747433264886,21.100616016427104,2024-04-08,78.948,79.483,5.879,5.827,79.21549999999999,5.853,5.852807350457921,92.65643879095916,12.58724950461061,13.31583224728427,241.4355287007227
ORCL,Corp,BBG008LS4XX4,US68389XBG97,US912810TV08,ORCL 4 3/8 05/15/55,ORACLE CORP,GLOBAL,4.375,FIXED,30/360,2,2,2015-05-05,2015-11-15,2015-05-05,2055-05-15,CALLABLE,Sr Unsecured,1250.0,US,USD,ACTV,40.02737850787132,31.09924709103354,2024-04-08,78.085,78.87,5.926,5.859,78.47749999999999,5.8925,5.8921803362667555,96.53049921888893,15.707807532372499,15.836389827576197,379.52424783849347
ORCL,Corp,BBG00D7FYG98,US68389XBH70,US91282CJZ59,ORCL 3.85 07/15/36,ORACLE CORP,GLOBAL,3.85,FIXED,30/360,2,2,2016-07-07,2017-01-15,2016-07-07,2036-07-15,CALLABLE,Sr Unsecured,1250.0,US,USD,ACTV,20.021902806297057,12.268309377138946,2024-04-08,84.11,84.598,5.664,5.602,84.354,5.633,5.6332490198314185,71.01812557714324,9.01726877740483,9.50099151683078,110.2922377567203
ORCL,Corp,BBG00D7FYSW6,US68389XBJ37,US912810TZ12,ORCL 4 07/15/46,ORACLE CORP,GLOBAL,4.0,FIXED,30/360,2,2,2016-07-07,2017-01-15,2016-07-07,2046-07-15,CALLABLE,Sr Unsecured,3000.0,US,USD,ACTV,30.02053388090349,22.26694045174538,2024-04-08,76.946,77.51,5.868,5.813,77.22800000000001,5.8405000000000005,5.840399828943423,91.42687824573441,12.800371412879535,13.919723148470725,264.1275938671623
ORCL,Corp,BBG00D7FYFT8,US68389XBM65,US91282CKH33,ORCL 2.65 07/15/26,ORACLE CORP,GLOBAL,2.64999999999999,FIXED,30/360,2,2,2016-07-07,2017-01-15,2016-07-07,2026-07-15,CALLABLE,Sr Unsecured,3000.0,US,USD,ACTV,10.020533880903491,2.2669404517453797,2024-04-08,94.341,94.501,5.335,5.256,94.42099999999999,5.2955000000000005,5.295406371224284,38.237525528826254,2.0917114448464993,2.1713786179617434,5.86789227024049
ORCL,Corp,BBG00J5HRSQ6,US68389XBN49,US91282CKE02,ORCL 3 1/4 11/15/27,ORACLE CORP,GLOBAL,3.25,FIXED,30/360,2,2,2017-11-09,2018-05-15,2017-11-09,2027-11-15,CALLABLE,Sr Unsecured,2750.0,US,USD,ACTV,10.015058179329227,3.6030116358658453,2024-04-08,93.61,93.843,5.22,5.146,93.7265,5.183,5.183043606579303,26.58772795169121,3.240128406191128,3.335046112322009,13.26125155463692
ORCL,Corp,BBG00J5HRSG7,US68389XBP96,US91282CJZ59,ORCL 3.8 11/15/37,ORACLE CORP,GLOBAL,3.79999999999999,FIXED,30/360,2,2,2017-11-09,2018-05-15,2017-11-09,2037-11-15,CALLABLE,Sr Unsecured,1750.0,US,USD,ACTV,20.016427104722794,13.604380561259411,2024-04-08,82.185,82.694,5.7,5.639,82.43950000000001,5.6695,5.669520326350706,74.50906942839669,9.597581132436027,10.198859893693177,129.55860328889287
ORCL,Corp,BBG00J5HST74,US68389XBQ79,US912810TZ12,ORCL 4 11/15/47,ORACLE CORP,GLOBAL,4.0,FIXED,30/360,2,2,2017-11-09,2018-05-15,2017-11-09,2047-11-15,CALLABLE,Sr Unsecured,2250.0,US,USD,ACTV,30.015058179329227,23.603011635865844,2024-04-08,76.13,76.739,5.884,5.826,76.4345,5.855,5.854600711911914,92.79477479349238,13.179628892859412,14.243596463908336,282.7175719057876
ORCL,Corp,BBG00SXGDG79,US68389XBU81,US91282CKE02,ORCL 2.8 04/01/27,ORACLE CORP,GLOBAL,2.79999999999999,FIXED,30/360,2,2,2020-04-01,2020-10-01,2020-04-01,2027-04-01,CALLABLE,Sr Unsecured,2250.0,US,USD,ACTV,6.997946611909651,2.9787816563997263,2024-04-08,93.352,93.533,5.242,5.173,93.4425,5.2075,5.20755571871996,29.318507888969812,2.6944883648295614,2.837040334312273,9.612688259273183
ORCL,Corp,BBG00SXGDGF0,US68389XBV64,US91282CKG59,ORCL 2.95 04/01/30,ORACLE CORP,GLOBAL,2.95,FIXED,30/360,2,2,2020-04-01,2020-10-01,2020-04-01,2030-04-01,CALLABLE,Sr Unsecured,3250.0,US,USD,ACTV,9.998631074606434,5.979466119096509,2024-04-08,88.029,88.338,5.315,5.249,88.1835,5.282,5.281708128750324,36.42195143640535,5.01378018928169,5.423138409613739,33.70827377591398
ORCL,Corp,BBG00SXGDGM2,US68389XBW48,US912810TZ12,ORCL 3.6 04/01/40,ORACLE CORP,GLOBAL,3.6,FIXED,30/360,2,2,2020-04-01,2020-10-01,2020-04-01,2040-04-01,CALLABLE,Sr Unsecured,3000.0,US,USD,ACTV,20.0,15.980835044490075,2024-04-08,77.308,77.74,5.797,5.748,77.524,5.7725,5.772753313928843,84.71442392551243,10.378408874074415,11.717571088132297,171.45072146768808
ORCL,Corp,BBG00SXGDGX0,US68389XBX21,US912810TV08,ORCL 3.6 04/01/50,ORACLE CORP,GLOBAL,3.6,FIXED,30/360,2,2,2020-04-01,2020-10-01,2020-04-01,2050-04-01,CALLABLE,Sr Unsecured,4500.0,US,USD,ACTV,29.998631074606433,25.97946611909651,2024-04-08,70.41,70.927,5.824,5.774,70.6685,5.7989999999999995,5.799014107137918,87.32320278355458,13.205906456170329,15.566142982030183,336.3825579149919
ORCL,Corp,BBG00SXGDH40,US68389XBY04,US912810TV08,ORCL 3.85 04/01/60,ORACLE CORP,GLOBAL,3.85,FIXED,30/360,2,2,2020-04-01,2020-10-01,2020-04-01,2060-04-01,CALLABLE,Sr Unsecured,3500.0,US,USD,ACTV,40.0,35.98083504449008,2024-04-08,69.372,69.99,5.915,5.86,69.681,5.8875,5.8876646436750875,96.04333126844311,15.514716176572366,17.461921755281704,468.64899722000314
ORCL,Corp,BBG00ZS0BPP6,US68389XBZ78,US912810TZ12,ORCL 3.65 03/25/41,ORACLE CORP,GLOBAL,3.64999999999999,FIXED,30/360,2,2,2021-03-24,2021-09-25,2021-03-24,2041-03-25,CALLABLE,Sr Unsecured,2250.0,US,USD,ACTV,20.00273785078713,16.960985626283367,2024-04-08,76.852,77.391,5.815,5.756,77.1215,5.785500000000001,5.7851600103080285,86.03893791143199,10.747109268001827,12.151550023806285,186.69769473411665
ORCL,Corp,BBG00ZS0BPT2,US68389XCA19,US912810TV08,ORCL 3.95 03/25/51,ORACLE CORP,GLOBAL,3.95,FIXED,30/360,2,2,2021-03-24,2021-09-25,2021-03-24,2051-03-25,CALLABLE,Sr Unsecured,3250.0,US,USD,ACTV,30.001368925393567,26.9596167008898,2024-04-08,74.384,74.932,5.85,5.8,74.658,5.824999999999999,5.824767463654279,89.92536779580422,13.976629408922157,15.504418170494866,340.47450454427576
ORCL,Corp,BBG00ZS0BPY6,US68389XCB91,US912810TV08,ORCL 4.1 03/25/61,ORACLE CORP,GLOBAL,4.09999999999999,FIXED,30/360,2,2,2021-03-24,2021-09-25,2021-03-24,2061-03-25,CALLABLE,Sr Unsecured,1500.0,US,USD,ACTV,40.002737850787135,36.96098562628337,2024-04-08,72.815,73.573,5.92,5.855,73.19399999999999,5.8875,5.887401057394267,96.06908174613115,16.20882498202391,17.36799187220107,469.7597105346224
ORCL,Corp,BBG00ZS0BNP1,US68389XCC74,US91282CKH33,ORCL 1.65 03/25/26,ORACLE CORP,GLOBAL,1.64999999999999,FIXED,30/360,2,2,2021-03-24,2021-09-25,2021-03-24,2026-03-25,CALLABLE,Sr Unsecured,2750.0,US,USD,ACTV,5.002053388090349,1.9603011635865846,2024-04-08,93.171,93.331,5.37,5.279,93.251,5.3245000000000005,5.324268721044064,41.47669179423068,1.798318918760443,1.9089726728046388,4.603305036506138
ORCL,Corp,BBG00ZS0BP03,US68389XCD57,US91282CKG59,ORCL 2.3 03/25/28,ORACLE CORP,GLOBAL,2.29999999999999,FIXED,30/360,2,2,2021-03-24,2021-09-25,2021-03-24,2028-03-25,CALLABLE,Sr Unsecured,2000.0,US,USD,ACTV,7.003422313483915,3.9616700889801506,2024-04-08,89.722,89.922,5.207,5.146,89.822,5.1765,5.176404127598919,26.24603930918379,3.4536725725275947,3.749592491290141,16.273316339818294
ORCL,Corp,BBG00ZS0BP85,US68389XCE31,US91282CJZ59,ORCL 2 7/8 03/25/31,ORACLE CORP,GLOBAL,2.875,FIXED,30/360,2,2,2021-03-24,2021-09-25,2021-03-24,2031-03-25,CALLABLE,Sr Unsecured,3250.0,US,USD,ACTV,10.001368925393566,6.959616700889802,2024-04-08,85.884,86.2,5.329,5.269,86.042,5.2989999999999995,5.29937966912985,38.38672293223113,5.651250431930561,6.221290502672321,44.31650568320636
ORCL,Corp,BBG01BFF10D8,US68389XCH61,US91282CKG59,ORCL 6.15 11/09/29,ORACLE CORP,GLOBAL,6.15,FIXED,30/360,2,2,2022-11-09,2023-05-09,2022-11-09,2029-11-09,CALLABLE,Sr Unsecured,1250.0,US,USD,ACTV,7.000684462696783,5.587953456536619,2024-04-08,104.405,104.683,5.206,5.148,104.54400000000001,5.177,5.200301967561244,28.174833959202136,5.1832629754956985,4.664234815021145,26.626783217136104
ORCL,Corp,BBG01BFF10W7,US68389XCJ28,US91282CJZ59,ORCL 6 1/4 11/09/32,ORACLE CORP,GLOBAL,6.25,FIXED,30/360,2,2,2022-11-09,2023-05-09,2022-11-09,2032-11-09,CALLABLE,Sr Unsecured,2250.0,US,USD,ACTV,10.001368925393566,8.588637919233403,2024-04-08,105.516,105.898,5.419,5.363,105.707,5.391,5.409019373357296,48.767496273462264,7.638730606343583,6.611574829377641,54.64501547754477
ORCL,Corp,BBG01BFF1128,US68389XCK90,US912810TV08,ORCL 6.9 11/09/52,ORACLE CORP,GLOBAL,6.9,FIXED,30/360,2,2,2022-11-09,2023-05-09,2022-11-09,2052-11-09,CALLABLE,Sr Unsecured,2500.0,US,USD,ACTV,30.001368925393567,28.588637919233403,2024-04-08,112.473,113.222,5.978,5.927,112.8475,5.9525,5.958239392191173,102.98624847673918,19.46360275650584,13.924706152454931,296.6409786479282
ORCL,Corp,BBG01DZ9FPC7,US68389XCM56,US91282CKG59,ORCL 4 1/2 05/06/28,ORACLE CORP,GLOBAL,4.5,FIXED,30/360,2,2,2023-02-06,2023-11-06,2023-02-06,2028-05-06,CALLABLE,Sr Unsecured,750.0,US,USD,ACTV,5.245722108145106,4.076659822039699,2024-04-08,97.787,98.014,5.108,5.045,97.9005,5.076499999999999,5.076220177114009,16.21760467933924,3.7212134792042075,3.6494162249004756,16.033116114402397
ORCL,Corp,BBG01DZ9FPG3,US68389XCN30,US91282CKG59,ORCL 4.65 05/06/30,ORACLE CORP,GLOBAL,4.65,FIXED,30/360,2,2,2023-02-06,2023-11-06,2023-02-06,2030-05-06,CALLABLE,Sr Unsecured,750.0,US,USD,ACTV,7.24435318275154,6.075290896646133,2024-04-08,97.1,97.425,5.213,5.148,97.26249999999999,5.1805,5.180494599044323,26.547449578138288,5.352192564209377,5.1838160294829905,32.19624318800467
ORCL,Corp,BBG01DZ9FPR1,US68389XCP87,US91282CJZ59,ORCL 4.9 02/06/33,ORACLE CORP,GLOBAL,4.9,FIXED,30/360,2,2,2023-02-06,2023-08-06,2023-02-06,2033-02-06,CALLABLE,Sr Unsecured,1500.0,US,USD,ACTV,10.001368925393566,8.83230663928816,2024-04-08,96.443,96.822,5.411,5.356,96.6325,5.3835,5.38344793766737,46.09481085110586,7.418602765987913,7.114184005897314,61.139867521266964
ORCL,Corp,BBG01DZ9FPY3,US68389XCQ60,US912810TV08,ORCL 5.55 02/06/53,ORACLE CORP,GLOBAL,5.54999999999999,FIXED,30/360,2,2,2023-02-06,2023-08-06,2023-02-06,2053-02-06,CALLABLE,Sr Unsecured,2250.0,US,USD,ACTV,30.001368925393567,28.83230663928816,2024-04-08,95.402,96.066,5.882,5.833,95.73400000000001,5.8575,5.857599169760941,92.98544698220795,17.21962797429105,14.770082473664052,325.58051224592566
VZ,Corp,BBG00000BHR9,US92343VAF13,US91282CJZ59,VZ 6 1/4 04/01/37,VERIZON COMMUNICATIONS,US DOMESTIC,6.25,FIXED,30/360,2,2,2007-04-03,2007-10-01,2007-04-03,2037-04-01,AT MATURITY,Sr Unsecured,241.298,US,USD,ACTV,29.9958932238193,12.980150581793293,2024-04-08,104.526,105.779,5.75,5.617,105.1525,5.6835,5.683049354702234,75.895048248615,10.719371214434522,9.168552952214457,107.5165651992233
VZ,Corp,BBG0000M1DD6,US92343VAK08,US91282CJZ59,VZ 6.4 02/15/38,VERIZON COMMUNICATIONS,GLOBAL,6.4,FIXED,30/360,2,2,2008-02-12,2008-08-15,2008-02-12,2038-02-15,AT MATURITY,Sr Unsecured,172.067,US,USD,ACTV,30.00958247775496,13.856262833675565,2024-04-08,103.048,107.497,6.07,5.613,105.27250000000001,5.8415,5.8385224641648605,91.05594065216462,11.372145890964843,9.476398621675218,117.02424797574373
VZ,Corp,BBG0027BCJ08,US92343VBE39,US912810TZ12,VZ 4 3/4 11/01/41,VERIZON COMMUNICATIONS,GLOBAL,4.75,FIXED,30/360,2,2,2011-11-03,2012-05-01,2011-11-03,2041-11-01,AT MATURITY,Sr Unsecured,487.801,US,USD,ACTV,29.9958932238193,17.56605065023956,2024-04-08,92.13,92.972,5.452,5.373,92.55099999999999,5.4125,5.412298001348974,49.161826589218364,11.944030381937042,11.564674662218922,178.45510358888905
VZ,Corp,BBG003LZSS91,US92343VBG86,US912810TZ12,VZ 3.85 11/01/42,VERIZON COMMUNICATIONS,GLOBAL,3.85,FIXED,30/360,2,2,2012-11-07,2013-05-01,2012-11-07,2042-11-01,CALLABLE,Sr Unsecured,715.499,US,USD,ACTV,29.982203969883642,18.56536618754278,2024-04-08,80.111,80.84,5.585,5.512,80.47550000000001,5.5485,5.548111797124148,62.556073011138174,11.456534255089892,12.509627353153526,206.10015814470452
VZ,Corp,BBG00580D503,US92343VBS25,US91282CJZ59,VZ 6.4 09/15/33,VERIZON COMMUNICATIONS,GLOBAL,6.4,FIXED,30/360,2,2,2013-09-18,2014-03-15,2013-09-18,2033-09-15,AT MATURITY,Sr Unsecured,354.154,US,USD,ACTV,19.991786447638603,9.437371663244353,2024-04-08,107.231,107.896,5.41,5.323,107.5635,5.3665,5.3667932525277156,44.690909300849036,8.351412173554634,7.225282006819386,64.6305583262011
VZ,Corp,BBG00580DD79,US92343VBT08,US912810TZ12,VZ 6.55 09/15/43,VERIZON COMMUNICATIONS,GLOBAL,6.54999999999999,FIXED,30/360,2,2,2013-09-18,2014-03-15,2013-09-18,2043-09-15,AT MATURITY,Sr Unsecured,803.356,US,USD,ACTV,29.99041752224504,19.43600273785079,2024-04-08,111.08,112.062,5.606,5.529,111.571,5.5675,5.567460529207631,64.52227420601544,14.617298346660384,11.719636514870668,189.28715013346033
VZ,Corp,BBG0083CP3G1,US92343VCK89,US912810TZ12,VZ 4.862 08/21/46,VERIZON COMMUNICATIONS,GLOBAL,4.862,FIXED,30/360,2,2,2015-03-11,2015-08-21,2015-02-21,2046-08-21,AT MATURITY,Sr Unsecured,2359.957,US,USD,ACTV,31.446954140999317,22.368240930869266,2024-04-08,91.499,92.137,5.528,5.475,91.818,5.5015,5.501893719285728,58.01806264606551,13.904693788680234,13.442797913432026,250.3621797414376
VZ,Corp,BBG0083CP816,US92343VCM46,US912810TV08,VZ 5.012 08/21/54,VERIZON COMMUNICATIONS,GLOBAL,5.01199999999999,FIXED,30/360,2,2,2015-03-11,2015-08-21,2015-02-21,2054-08-21,AT MATURITY,Sr Unsecured,793.981,US,USD,ACTV,39.44695414099932,30.368240930869266,2024-04-08,92.069,92.813,5.555,5.501,92.441,5.5280000000000005,5.528024855916286,60.585142795410256,16.71071398875672,15.450177661163625,357.7375181675675
VZ,Corp,BBG007DM1125,US92343VCQ59,US91282CJZ59,VZ 4.4 11/01/34,VERIZON COMMUNICATIONS,GLOBAL,4.4,FIXED,30/360,2,2,2014-10-29,2015-05-01,2014-10-29,2034-11-01,CALLABLE,Sr Unsecured,1888.445,US,USD,ACTV,20.008213552361397,10.565366187542779,2024-04-08,92.631,93.05,5.321,5.266,92.84049999999999,5.2935,5.293481133878232,37.43787725262299,8.338386487782293,8.219712416576108,83.0984075961485
VZ,Corp,BBG009PNV1G8,US92343VCV45,US91282CJZ59,VZ 4.272 01/15/36,VERIZON COMMUNICATIONS,GLOBAL,4.272,FIXED,30/360,2,2,2015-08-20,2016-01-15,2015-07-15,2036-01-15,AT MATURITY,Sr Unsecured,1289.884,US,USD,ACTV,20.40520191649555,11.770020533880903,2024-04-08,90.53,91.033,5.367,5.306,90.7815,5.3365,5.336432360112667,41.714514264651406,8.977349898541782,9.051903808242137,100.66655041053944
VZ,Corp,BBG009PNW3Z2,US92343VCX01,US912810TV08,VZ 4.522 09/15/48,VERIZON COMMUNICATIONS,GLOBAL,4.522,FIXED,30/360,2,2,2015-08-20,2015-09-15,2015-03-13,2048-09-15,AT MATURITY,Sr Unsecured,1246.661,US,USD,ACTV,33.073237508555785,24.438056125941138,2024-04-08,86.403,87.255,5.544,5.474,86.82900000000001,5.509,5.5090524412691595,58.73797959203805,14.172697564544363,14.340022109279575,288.0211178584711
VZ,Corp,BBG009PNW578,US92343VCZ58,US912810TV08,VZ 4.672 03/15/55,VERIZON COMMUNICATIONS,GLOBAL,4.67199999999999,FIXED,30/360,2,2,2015-08-20,2015-09-15,2015-03-13,2055-03-15,AT MATURITY,Sr Unsecured,722.561,US,USD,ACTV,39.56741957563313,30.93223819301848,2024-04-08,87.713,88.51,5.503,5.444,88.1115,5.4735,5.473305441439153,55.26922405615434,16.257795415935227,15.844361055793934,375.00420504379247
VZ,Corp,BBG00DGYPVQ5,US92343VDC54,US912810TZ12,VZ 4 1/8 08/15/46,VERIZON COMMUNICATIONS,GLOBAL,4.125,FIXED,30/360,2,2,2016-08-01,2017-02-15,2016-08-01,2046-08-15,AT MATURITY,Sr Unsecured,926.858,US,USD,ACTV,30.036960985626283,22.351813826146476,2024-04-08,81.66,82.425,5.569,5.5,82.04249999999999,5.5344999999999995,5.534748923033477,61.24918677685518,12.988765225892012,13.910546150736396,263.83485132141567
VZ,Corp,BBG00DGYP877,US92343VDD38,US91282CKH33,VZ 2 5/8 08/15/26,VERIZON COMMUNICATIONS,GLOBAL,2.625,FIXED,30/360,2,2,2016-08-01,2017-02-15,2016-08-01,2026-08-15,AT MATURITY,Sr Unsecured,1869.415,US,USD,ACTV,10.036960985626283,2.351813826146475,2024-04-08,94.391,94.588,5.192,5.099,94.48949999999999,5.1455,5.145720086991785,23.107487386877946,2.163829564271378,2.2559310028879858,6.2826626773570435
VZ,Corp,BBG00GX2G1Z5,US92343VDR24,US91282CJZ59,VZ 4.812 03/15/39,VERIZON COMMUNICATIONS,GLOBAL,4.812,FIXED,30/360,2,2,2017-07-06,2017-09-15,2017-02-03,2039-03-15,AT MATURITY,Sr Unsecured,1136.127,US,USD,ACTV,21.689253935660506,14.932238193018481,2024-04-08,92.494,93.303,5.558,5.474,92.8985,5.516,5.515863502770663,59.52766231369661,10.88015330659937,10.575110936881739,142.60989170318837
VZ,Corp,BBG00GX2GTT1,US92343VDS07,US912810TV08,VZ 5.012 04/15/49,VERIZON COMMUNICATIONS,GLOBAL,5.01199999999999,FIXED,30/360,2,2,2017-07-06,2017-10-15,2017-02-03,2049-04-15,AT MATURITY,Sr Unsecured,696.684,US,USD,ACTV,31.77549623545517,25.018480492813143,2024-04-08,95.84,96.747,5.314,5.247,96.2935,5.2805,5.280609823763371,36.25986495309249,15.050193001435844,13.896773234121905,280.4823875954105
VZ,Corp,BBG00G6QW5Q5,US92343VDU52,US91282CJZ59,VZ 5 1/4 03/16/37,VERIZON COMMUNICATIONS,GLOBAL,5.25,FIXED,30/360,2,2,2017-03-16,2017-09-16,2017-03-16,2037-03-16,AT MATURITY,Sr Unsecured,1095.06,US,USD,ACTV,20.0,12.936344969199178,2024-04-08,99.213,99.833,5.335,5.268,99.523,5.3015,5.300999663770199,38.334500575922775,10.138422706100377,9.425963963669233,111.88098454222992
VZ,Corp,BBG00G6QW816,US92343VDV36,US912810TZ12,VZ 5 1/2 03/16/47,VERIZON COMMUNICATIONS,GLOBAL,5.5,FIXED,30/360,2,2,2017-03-16,2017-09-16,2017-03-16,2047-03-16,AT MATURITY,Sr Unsecured,457.339,US,USD,ACTV,29.998631074606433,22.934976043805612,2024-04-08,99.846,100.599,5.512,5.454,100.2225,5.483,5.4825062081217775,56.19588157039637,14.981813302295244,13.318147326921748,249.1280647831384
VZ,Corp,BBG00G6QW2B8,US92343VDY74,US91282CKE02,VZ 4 1/8 03/16/27,VERIZON COMMUNICATIONS,GLOBAL,4.125,FIXED,30/360,2,2,2017-03-16,2017-09-16,2017-03-16,2027-03-16,AT MATURITY,Sr Unsecured,3250.0,US,USD,ACTV,9.998631074606434,2.9349760438056127,2024-04-08,97.386,97.605,5.095,5.012,97.49549999999999,5.0535,5.053271152079105,14.466372001894463,2.7223522209709112,2.7501410573177156,9.153367191198512
VZ,Corp,BBG00HC11V79,US92343VEA89,US91282CJZ59,VZ 4 1/2 08/10/33,VERIZON COMMUNICATIONS,GLOBAL,4.5,FIXED,30/360,2,2,2017-08-10,2018-02-10,2017-08-10,2033-08-10,AT MATURITY,Sr Unsecured,2136.945,US,USD,ACTV,16.0,9.338809034907598,2024-04-08,94.125,94.492,5.305,5.253,94.30850000000001,5.279,5.279290723522117,36.06407179530375,7.633684992372075,7.5343782995589,68.31147613806364
VZ,Corp,BBG00M1BQWX0,US92343VER15,US91282CKG59,VZ 4.329 09/21/28,VERIZON COMMUNICATIONS,GLOBAL,4.32899999999999,FIXED,30/360,2,2,2018-10-22,2019-03-21,2018-06-21,2028-09-21,AT MATURITY,Sr Unsecured,4178.531,US,USD,ACTV,9.91649555099247,4.454483230663929,2024-04-08,96.891,97.213,5.119,5.036,97.05199999999999,5.0775,5.077233366668225,16.029888002891905,4.030855820421718,4.03439379075336,19.156261346040342
VZ,Corp,BBG00N8J22P5,US92343VES97,US91282CKG59,VZ 3 7/8 02/08/29,VERIZON COMMUNICATIONS,GLOBAL,3.875,FIXED,30/360,2,2,2019-02-08,2019-08-08,2019-02-08,2029-02-08,CALLABLE,Sr Unsecured,1000.0,US,USD,ACTV,10.001368925393566,4.837782340862423,2024-04-08,94.755,95.065,5.113,5.038,94.91,5.0755,5.075727067887782,15.58207286694407,4.290578191093389,4.363366835778108,22.32622317780832
VZ,Corp,BBG00NGSL5Q7,US92343VET70,US91282CKG59,VZ 4.016 12/03/29,VERIZON COMMUNICATIONS,PRIV PLACEMENT,4.016,FIXED,30/360 NON-EOM,2,2,2019-02-28,2019-06-03,2019-02-28,2029-12-03,CALLABLE,Sr Unsecured,39.9179999999995,US,USD,ACTV,10.76249144421629,5.653661875427789,2024-04-08,94.549,94.638,5.139,5.12,94.5935,5.1295,5.129780791699886,21.28756817138397,4.935366616569899,4.962682941739947,29.084651613526955
VZ,Corp,BBG00PZ10YF2,US92343VEU44,US91282CKG59,VZ 4.016 12/03/29,VERIZON COMMUNICATIONS,GLOBAL,4.016,FIXED,30/360,2,2,2019-09-10,2019-12-03,2019-06-03,2029-12-03,CALLABLE,Sr Unsecured,3960.082,US,USD,ACTV,10.231348391512663,5.653661875427789,2024-04-08,94.4,94.722,5.171,5.102,94.561,5.1365,5.136703530809637,21.969526356708332,4.935366616569899,4.962682941739947,29.084651613526955
VZ,Corp,BBG00SK3XWH4,US92343VFD10,US912810TV08,VZ 4 03/22/50,VERIZON COMMUNICATIONS,GLOBAL,4.0,FIXED,30/360,2,2,2020-03-20,2020-09-22,2020-03-20,2050-03-22,CALLABLE,Sr Unsecured,1178.095,US,USD,ACTV,30.0041067761807,25.95208761122519,2024-04-08,78.583,79.383,5.57,5.501,78.983,5.535500000000001,5.535576125234367,61.41955478416603,13.80669336690626,15.182292787359119,323.6845122963
VZ,Corp,BBG00SK3XVZ6,US92343VFE92,US91282CKG59,VZ 3.15 03/22/30,VERIZON COMMUNICATIONS,GLOBAL,3.14999999999999,FIXED,30/360,2,2,2020-03-20,2020-09-22,2020-03-20,2030-03-22,CALLABLE,Sr Unsecured,1500.0,US,USD,ACTV,10.004106776180699,5.952087611225188,2024-04-08,89.429,89.763,5.241,5.17,89.596,5.2055,5.205435208976268,29.109731614876054,5.037883860360816,5.369216047699065,33.17673235618216
VZ,Corp,BBG00SK3XVL1,US92343VFF67,US91282CKE02,VZ 3 03/22/27,VERIZON COMMUNICATIONS,GLOBAL,3.0,FIXED,30/360,2,2,2020-03-20,2020-09-22,2020-03-20,2027-03-22,CALLABLE,Sr Unsecured,750.0,US,USD,ACTV,7.003422313483915,2.951403148528405,2024-04-08,94.281,94.492,5.113,5.032,94.38650000000001,5.0725,5.072155214846134,16.375438180831647,2.687304691877181,2.803264335227991,9.416374112227095
VZ,Corp,BBG00XDGZRB7,US92343VFL36,US91282CKG59,VZ 1 1/2 09/18/30,VERIZON COMMUNICATIONS,GLOBAL,1.5,FIXED,30/360,2,2,2020-09-18,2021-03-18,2020-09-18,2030-09-18,CALLABLE,Sr Unsecured,1000.0,US,USD,ACTV,9.998631074606434,6.444900752908967,2024-04-08,80.66,81.013,5.056,4.983,80.8365,5.0195,5.019751958549024,10.498247634018536,5.085396173316453,6.048485026544694,40.79258063395641
VZ,Corp,BBG00XRZ3Q27,US92343VFN91,US91282CKG59,VZ 1.68 10/30/30,VERIZON COMMUNICATIONS,PRIV PLACEMENT,1.67999999999999,FIXED,30/360 NON-EOM,2,2,2020-10-06,2021-04-30,2020-10-06,2030-10-30,CALLABLE,Sr Unsecured,2.494,US,USD,ACTV,10.064339493497604,6.5598904859685145,2024-04-08,80.554,80.689,5.221,5.193,80.6215,5.207,5.206959730170793,29.073039165786057,5.173581169437411,6.065704916061321,41.491467930236595
VZ,Corp,BBG00Y4Q8W68,US92343VFR06,US91282CJZ59,VZ 1 3/4 01/20/31,VERIZON COMMUNICATIONS,GLOBAL,1.75,FIXED,30/360,2,2,2020-11-20,2021-07-20,2020-11-20,2031-01-20,CALLABLE,Sr Unsecured,2250.0,US,USD,ACTV,10.165639972621491,6.784394250513347,2024-04-08,80.163,80.471,5.268,5.206,80.31700000000001,5.237,5.236828021705151,31.83962818328221,5.336630330161495,6.2723757234856645,44.20011891890408
VZ,Corp,BBG00Y4Q8WP7,US92343VFT61,US912810TZ12,VZ 2.65 11/20/40,VERIZON COMMUNICATIONS,GLOBAL,2.64999999999999,FIXED,30/360,2,2,2020-11-20,2021-05-20,2020-11-20,2040-11-20,CALLABLE,Sr Unsecured,3000.0,US,USD,ACTV,20.0,16.618754277891856,2024-04-08,68.93,69.396,5.534,5.48,69.16300000000001,5.507,5.506576936692001,58.45398320991295,9.79396915297602,12.552052538191317,194.37768398918902
VZ,Corp,BBG00Y4Q8WS4,US92343VFU35,US912810TV08,VZ 2 7/8 11/20/50,VERIZON COMMUNICATIONS,GLOBAL,2.875,FIXED,30/360,2,2,2020-11-20,2021-05-20,2020-11-20,2050-11-20,CALLABLE,Sr Unsecured,2750.0,US,USD,ACTV,29.998631074606433,26.61738535249829,2024-04-08,63.477,64.067,5.506,5.448,63.77199999999999,5.477,5.476662567816942,55.553990964813096,12.194436763406154,16.307997368892227,368.44395578890374
VZ,Corp,BBG00Y4Q8XB0,US92343VFV18,US912810TV08,VZ 3 11/20/60,VERIZON COMMUNICATIONS,GLOBAL,3.0,FIXED,30/360,2,2,2020-11-20,2021-05-20,2020-11-20,2060-11-20,CALLABLE,Sr Unsecured,2000.0,US,USD,ACTV,40.0,36.61875427789185,2024-04-08,60.366,61.051,5.538,5.475,60.7085,5.5065,5.506419117003681,58.482849319478156,13.656818319745485,18.23412341356326,512.7373481747148
VZ,Corp,BBG00ZXC1SB4,US92343VFW90,US912810TV08,VZ 2.987 10/30/56,VERIZON COMMUNICATIONS,GLOBAL,2.987,FIXED,30/360 NON-EOM,2,2,2021-05-03,2021-10-30,2021-04-30,2056-10-30,CALLABLE,Sr Unsecured,3651.154,US,USD,ACTV,35.493497604380565,32.56125941136208,2024-04-08,61.921,62.487,5.519,5.466,62.204,5.4925,5.491941347787366,57.081413717871605,13.228537646144064,17.529780527347725,456.29648111923524
VZ,Corp,BBG00ZXC1SC3,US92343VFX73,US91282CKG59,VZ 1.68 10/30/30,VERIZON COMMUNICATIONS,GLOBAL,1.67999999999999,FIXED,30/360 NON-EOM,2,2,2021-05-03,2021-10-30,2021-04-30,2030-10-30,CALLABLE,Sr Unsecured,1144.945,US,USD,ACTV,9.492128678986996,6.5598904859685145,2024-04-08,80.438,80.769,5.245,5.177,80.6035,5.211,5.210661955177784,29.437876266862443,5.173581169437411,6.065704916061321,41.491467930236595
VZ,Corp,BBG00ZLKTFB7,US92343VGB45,US912810TV08,VZ 3.55 03/22/51,VERIZON COMMUNICATIONS,GLOBAL,3.54999999999999,FIXED,30/360,2,2,2021-03-22,2021-09-22,2021-03-22,2051-03-22,CALLABLE,Sr Unsecured,4500.0,US,USD,ACTV,29.998631074606433,26.951403148528406,2024-04-08,72.36,72.863,5.536,5.491,72.6115,5.5135,5.5131993236766235,59.220520638562974,13.338387783882201,15.868243332537096,352.99662921502534
VZ,Corp,BBG00ZLKTFC6,US92343VGC28,US912810TV08,VZ 3.7 03/22/61,VERIZON COMMUNICATIONS,GLOBAL,3.7,FIXED,30/360,2,2,2021-03-22,2021-09-22,2021-03-22,2061-03-22,CALLABLE,Sr Unsecured,3500.0,US,USD,ACTV,40.0,36.95277207392197,2024-04-08,70.902,71.561,5.564,5.51,71.23150000000001,5.537,5.536902298778296,61.52878746344299,15.297485968016533,17.732924781008464,486.6656172045549
VZ,Corp,BBG00ZLKTF09,US92343VGG32,US91282CKH33,VZ 1.45 03/20/26,VERIZON COMMUNICATIONS,GLOBAL,1.45,FIXED,30/360,2,2,2021-03-22,2021-09-20,2021-03-22,2026-03-20,CALLABLE,Sr Unsecured,1916.467,US,USD,ACTV,4.993839835728953,1.946611909650924,2024-04-08,93.108,93.266,5.223,5.133,93.18700000000001,5.178,5.177794612944127,26.973054152543618,1.7878891685464424,1.8983758720606563,4.554518881559168
VZ,Corp,BBG00ZLKTF27,US92343VGH15,US91282CKG59,VZ 2.1 03/22/28,VERIZON COMMUNICATIONS,GLOBAL,2.1,FIXED,30/360,2,2,2021-03-22,2021-09-22,2021-03-22,2028-03-22,CALLABLE,Sr Unsecured,3000.0,US,USD,ACTV,7.000684462696783,3.9534565366187544,2024-04-08,89.286,89.547,5.131,5.052,89.4165,5.0915,5.091325111687183,17.84329812908798,3.4425208972230785,3.754564464313417,16.284321100963822
VZ,Corp,BBG00ZLKTF45,US92343VGJ70,US91282CJZ59,VZ 2.55 03/21/31,VERIZON COMMUNICATIONS,GLOBAL,2.54999999999999,FIXED,30/360,2,2,2021-03-22,2021-09-21,2021-03-22,2031-03-21,CALLABLE,Sr Unsecured,3706.598,US,USD,ACTV,9.995893223819301,6.9486652977412735,2024-04-08,84.27,84.59,5.284,5.223,84.43,5.2535,5.2537317499518394,33.875323693234456,5.596550321101569,6.271912669755577,44.769778445736705
VZ,Corp,BBG00ZLKTF81,US92343VGK44,US912810TZ12,VZ 3.4 03/22/41,VERIZON COMMUNICATIONS,GLOBAL,3.39999999999999,FIXED,30/360,2,2,2021-03-22,2021-09-22,2021-03-22,2041-03-22,CALLABLE,Sr Unsecured,3750.0,US,USD,ACTV,20.0,16.95277207392197,2024-04-08,76.512,77.005,5.557,5.504,76.7585,5.5305,5.530158843845129,60.905682535230376,10.53159573637771,12.309317815631037,190.1851211218633
VZ,Corp,BBG012CP0R23,US92343VGL27,US912810TZ12,VZ 2.85 09/03/41,VERIZON COMMUNICATIONS,GLOBAL,2.85,FIXED,30/360,2,2,2021-09-03,2022-03-03,2021-09-03,2041-09-03,CALLABLE,Sr Unsecured,1000.0,US,USD,ACTV,20.0,17.404517453798768,2024-04-08,70.259,70.811,5.534,5.472,70.535,5.503,5.503072165697814,58.11408254513616,10.187606756525295,12.921929616453948,207.05113810184403
VZ,Corp,BBG012MB7P66,US92343VGM00,US91282CJZ59,VZ 2.355 03/15/32,VERIZON COMMUNICATIONS,PRIV PLACEMENT,2.355,FIXED,30/360,2,2,2021-09-20,2022-03-15,2021-09-20,2032-03-15,CALLABLE,Sr Unsecured,37.83,US,USD,ACTV,10.483230663928817,7.9342915811088295,2024-04-08,81.149,81.219,5.297,5.284,81.184,5.2905,5.290543608367444,37.327073928048804,6.14685768907857,7.101374145725384,57.25797233371466
VZ,Corp,BBG016HQCKF5,US92343VGN82,US91282CJZ59,VZ 2.355 03/15/32,VERIZON COMMUNICATIONS,GLOBAL,2.355,FIXED,30/360,2,2,2022-04-28,2022-09-15,2022-03-15,2032-03-15,CALLABLE,Sr Unsecured,4626.005,US,USD,ACTV,9.880903490759753,7.9342915811088295,2024-04-08,80.959,81.3,5.33,5.27,81.12950000000001,5.3,5.300131149590016,38.27190546884061,6.14685768907857,7.101374145725384,57.25797233371466
VZ,Corp,BBG015DCTHQ9,US92343VGP31,US912810TV08,VZ 3 7/8 03/01/52,VERIZON COMMUNICATIONS,GLOBAL,3.875,FIXED,30/360,2,2,2022-03-01,2022-09-01,2022-03-01,2052-03-01,CALLABLE,Sr Unsecured,1000.0,US,USD,ACTV,30.001368925393567,27.89596167008898,2024-04-08,76.725,77.368,5.52,5.465,77.0465,5.4925,5.492248964642426,57.10327925434211,14.082031476631016,15.76327250607365,355.68750548544114
VZ,Corp,BBG01GKBNTK5,US92343VGT52,US91282CJZ59,VZ 5.05 05/09/33,VERIZON COMMUNICATIONS,GLOBAL,5.04999999999999,FIXED,30/360,2,2,2023-05-09,2023-11-09,2023-05-09,2033-05-09,CALLABLE,Sr Unsecured,1000.0,US,USD,ACTV,10.001368925393566,9.084188911704311,2024-04-08,98.448,98.885,5.267,5.205,98.6665,5.236000000000001,5.2357782435170295,31.905506515689915,7.63622443048299,7.15341637374904,62.891910204258856
VZ,Corp,BBG01LM0RJ51,US92343VGW81,US912810TV08,VZ 5 1/2 02/23/54,VERIZON COMMUNICATIONS,GLOBAL,5.5,FIXED,30/360,2,2,2024-02-23,2024-08-23,2024-02-23,2054-02-23,CALLABLE,Sr Unsecured,1000.0,US,USD,ACTV,30.001368925393567,29.87816563997262,2024-04-08,98.461,99.15,5.606,5.558,98.8055,5.582,5.5821321711149965,65.88416162989853,17.449775960983285,15.06427062533758,340.7084867633044
VZ,Corp,BBG00003TCX8,US92344GAM87,US91282CKG59,VZ 7 3/4 12/01/30,VERIZON COMMUNICATIONS,US DOMESTIC,7.75,FIXED,30/360,2,2,2001-09-07,2001-12-01,2001-06-01,2030-12-01,AT MATURITY,Sr Unsecured,561.998,US,USD,ACTV,29.232032854209447,6.647501711156742,2024-04-08,114.024,114.444,5.222,5.153,114.23400000000001,5.1875,5.187304780595594,27.004911002736424,6.3636931157353605,5.231611249642183,34.25527037080617
VZ,Corp,BBG0000BH8D4,US92344GAX43,US91282CJZ59,VZ 5.85 09/15/35,VERIZON COMMUNICATIONS,GLOBAL,5.84999999999999,FIXED,30/360,2,2,2005-09-13,2006-03-15,2005-09-13,2035-09-15,AT MATURITY,Sr Unsecured,420.213,US,USD,ACTV,30.0041067761807,11.436002737850787,2024-04-08,103.723,104.274,5.409,5.345,103.9985,5.377,5.376671604812146,45.72257978653402,9.540315484357215,8.462557311205558,89.72730712488877
VZ,Corp,BBG00MS7TQ79,US92346MEE75,US912810TV08,VZ 4.9 12/15/48,VERIZON COMMUNICATIONS,DOMESTIC MTN,4.9,FIXED,30/360,2,2,2018-12-20,2019-06-15,2018-12-20,2048-12-15,CALLABLE,Sr Unsecured,1.636,US,USD,ACTV,29.987679671457904,24.687200547570157,2024-04-08,81.372,82.637,6.412,6.294,82.00450000000001,6.353,6.353114909415853,141.89473590573132,14.785134614783688,13.99156170915346,280.3845833828725
VZ,Corp,BBG00MYZP5B5,US92346MEG24,US912810TV08,VZ 4.85 01/15/49,VERIZON COMMUNICATIONS,DOMESTIC MTN,4.84999999999999,FIXED,30/360,2,2,2019-01-10,2019-07-15,2019-01-10,2049-01-15,CALLABLE,Sr Unsecured,1.848,US,USD,ACTV,30.015058179329227,24.772073921971252,2024-04-08,80.779,82.035,6.408,6.29,81.407,6.349,6.348593514524399,141.42501061124364,14.745700436121913,14.105401535658041,283.73812422012753
VZ,Corp,BBG00NJ4Q1S9,US92346MEN74,US912810TV08,VZ 4.55 03/15/49,VERIZON COMMUNICATIONS,DOMESTIC MTN,4.54999999999999,FIXED,30/360,2,2,2019-03-14,2019-09-15,2019-03-14,2049-03-15,CALLABLE,Sr Unsecured,1.564,US,USD,ACTV,30.0041067761807,24.933607118412045,2024-04-08,77.254,78.489,6.385,6.266,77.8715,6.3255,6.325279432551762,139.21363610303987,14.368651025756101,14.465398975928705,294.7044509643222
VZ,Corp,BBG00P7KQLM3,US92346MFC01,US912810TV08,VZ 4.05 05/15/49,VERIZON COMMUNICATIONS,DOMESTIC MTN,4.04999999999999,FIXED,30/360,2,2,2019-05-31,2019-11-15,2019-05-31,2049-05-15,CALLABLE,Sr Unsecured,2.711,US,USD,ACTV,29.95756331279945,25.100616016427104,2024-04-08,71.197,72.353,6.362,6.245,71.775,6.3035,6.3035616936907175,137.0599538710713,13.665712361355142,14.651529746632452,304.23868328628555
VZ,Corp,BBG00Q21MMW9,US92346MFL00,US912810TV08,VZ 3 1/2 08/15/49,VERIZON COMMUNICATIONS,DOMESTIC MTN,3.5,FIXED,30/360,2,2,2019-08-29,2020-02-15,2019-08-29,2049-08-15,CALLABLE,Sr Unsecured,5.293,US,USD,ACTV,29.963039014373717,25.352498288843258,2024-04-08,64.493,65.554,6.331,6.217,65.0235,6.274,6.27328648492694,133.99625077528646,12.928126809072943,15.392135102025039,327.6292628094793
VZ,Corp,BBG00QDBRWC0,US92346MFS52,US912810TV08,VZ 3.55 10/15/49,VERIZON COMMUNICATIONS,DOMESTIC MTN,3.54999999999999,FIXED,30/360,2,2,2019-10-03,2020-04-15,2019-10-03,2049-10-15,CALLABLE,Sr Unsecured,7.893,US,USD,ACTV,30.034223134839152,25.519507186858316,2024-04-08,65.504,66.556,6.28,6.169,66.03,6.2245,6.224055593724606,129.20070329014723,13.022512534500436,15.158149553240765,323.73428902418505
VZ,Corp,BBG00QZ1DMM4,US92346MGC91,US912810TV08,VZ 3.45 12/15/49,VERIZON COMMUNICATIONS,DOMESTIC MTN,3.45,FIXED,30/360,2,2,2019-12-05,2020-06-15,2019-12-05,2049-12-15,CALLABLE,Sr Unsecured,2.11,US,USD,ACTV,30.028747433264886,25.686516084873375,2024-04-08,63.51,64.607,6.348,6.23,64.0585,6.289,6.2886814497411265,135.5526422540283,12.919300603224809,15.42304757407365,332.10383201986497
VZ,Corp,BBG00TN8F0C3,US92346MGJ45,US91282CKG59,VZ 1.9 05/15/30,VERIZON COMMUNICATIONS,DOMESTIC MTN,1.89999999999999,FIXED,30/360,2,2,2020-05-14,2020-11-15,2020-05-14,2030-05-15,CALLABLE,Sr Unsecured,0.874,US,USD,ACTV,10.001368925393566,6.099931553730322,2024-04-08,79.251,79.879,6.015,5.873,79.565,5.944,5.944063573330641,101.85699535575203,4.9346991011047825,5.632591509480901,35.9925866664218
VZ,Corp,BBG00TN8FCP3,US92346MGK18,US912810TV08,VZ 2 3/4 05/15/50,VERIZON COMMUNICATIONS,DOMESTIC MTN,2.75,FIXED,30/360,2,2,2020-05-14,2020-11-15,2020-05-14,2050-05-15,CALLABLE,Sr Unsecured,0.468,US,USD,ACTV,30.001368925393567,26.099931553730322,2024-04-08,54.454,55.505,6.343,6.218,54.9795,6.2805,6.280140609294177,134.76207180625022,11.930315406391474,16.31288390708339,364.8764471047736
VZ,Corp,BBG00TSWPBP6,US92346MGL90,US91282CKG59,VZ 2.05 05/15/30,VERIZON COMMUNICATIONS,DOMESTIC MTN,2.04999999999999,FIXED,30/360,2,2,2020-05-21,2020-11-15,2020-05-21,2030-05-15,CALLABLE,Sr Unsecured,0.56,US,USD,ACTV,9.982203969883642,6.099931553730322,2024-04-08,80.005,80.642,6.016,5.873,80.3235,5.9445,5.943886149674654,101.83868963591237,4.958761814708193,5.6054801926835625,35.767012001292265
VZ,Corp,BBG00TSWSKW5,US92346MGM73,US912810TV08,VZ 2.95 05/15/50,VERIZON COMMUNICATIONS,DOMESTIC MTN,2.95,FIXED,30/360,2,2,2020-05-21,2020-11-15,2020-05-21,2050-05-15,CALLABLE,Sr Unsecured,1.565,US,USD,ACTV,29.982203969883642,26.099931553730322,2024-04-08,56.99,58.033,6.343,6.222,57.5115,6.282500000000001,6.282242386781006,134.96859177435073,12.236926065593138,16.050816517970738,356.21205020827466
VZ,Corp,BBG00TYNQ6Y9,US92346MGN56,US912810TV08,VZ 2.95 05/15/50,VERIZON COMMUNICATIONS,DOMESTIC MTN,2.95,FIXED,30/360,2,2,2020-05-29,2020-11-15,2020-05-29,2050-05-15,CALLABLE,Sr Unsecured,1.828,US,USD,ACTV,29.960301163586585,26.099931553730322,2024-04-08,56.992,58.029,6.343,6.223,57.5105,6.2829999999999995,6.282357872277497,134.97997079124625,12.236926065593138,16.050816517970738,356.21205020827466
VZ,Corp,BBG00V76FBZ1,US92346MGQ87,US912810TV08,VZ 2.8 06/15/50,VERIZON COMMUNICATIONS,DOMESTIC MTN,2.79999999999999,FIXED,30/360,2,2,2020-06-11,2020-12-15,2020-06-11,2050-06-15,CALLABLE,Sr Unsecured,3.573,US,USD,ACTV,30.00958247775496,26.184804928131417,2024-04-08,55.027,56.016,6.343,6.227,55.5215,6.285,6.2845330409705635,135.16714328093002,12.02546484122206,16.3281431578071,365.39048099765535
VZ,Corp,BBG00Y6TW919,US92346MGR60,US91282CKG59,VZ 1.65 11/15/30,VERIZON COMMUNICATIONS,DOMESTIC MTN,1.64999999999999,FIXED,30/360,2,2,2020-11-27,2021-05-15,2020-11-27,2030-11-15,CALLABLE,Sr Unsecured,2.327,US,USD,ACTV,9.96577686516085,6.6036960985626285,2024-04-08,76.409,77.044,6.038,5.901,76.7265,5.9695,5.969243823736907,103.99930608087764,5.204871036633469,6.115430127830568,42.097974905617534
VZ,Corp,BBG00Y6TWD47,US92346MGS44,US912810TV08,VZ 2 3/4 11/15/50,VERIZON COMMUNICATIONS,DOMESTIC MTN,2.75,FIXED,30/360,2,2,2020-11-27,2021-05-15,2020-11-27,2050-11-15,CALLABLE,Sr Unsecured,6.16,US,USD,ACTV,29.965776865160848,26.60369609856263,2024-04-08,54.446,55.407,6.303,6.19,54.9265,6.2465,6.2461093736605475,131.35526315178095,12.01309666249475,16.463323793075208,373.6803615035492
VZ,Corp,BBG00YB21DJ8,US92346MGT27,US91282CKG59,VZ 1.6 12/15/30,VERIZON COMMUNICATIONS,DOMESTIC MTN,1.6,FIXED,30/360,2,2,2020-12-03,2021-06-15,2020-12-03,2030-12-15,CALLABLE,Sr Unsecured,0.5,US,USD,ACTV,10.03148528405202,6.685831622176591,2024-04-08,75.88,76.546,6.041,5.898,76.213,5.9695,5.969351374357938,104.10891997535735,5.245213237171014,6.2079139639825724,43.24010315251022
VZ,Corp,BBG00YB21DK6,US92346MGU99,US912810TV08,VZ 2.65 12/15/50,VERIZON COMMUNICATIONS,DOMESTIC MTN,2.64999999999999,FIXED,30/360,2,2,2020-12-03,2021-06-15,2020-12-03,2050-12-15,CALLABLE,Sr Unsecured,1.263,US,USD,ACTV,30.031485284052017,26.68583162217659,2024-04-08,52.771,53.779,6.344,6.222,53.275000000000006,6.283,6.28255888834017,134.95776529461418,11.873356467751544,16.687715227253868,381.23253890804006
VZ,Corp,BBG010ZDLD36,US92346MGV72,US91282CJZ59,VZ 2.35 05/15/31,VERIZON COMMUNICATIONS,DOMESTIC MTN,2.35,FIXED,30/360,2,2,2021-05-20,2021-11-15,2021-05-20,2031-05-15,CALLABLE,Sr Unsecured,5.839,US,USD,ACTV,9.984941820670773,7.099247091033539,2024-04-08,79.039,79.692,6.023,5.892,79.3655,5.9575,5.957192152225941,103.1640727929321,5.642884018278204,6.371857772541441,46.47100970952942
VZ,Corp,BBG010ZDLL65,US92346MGW55,US912810TV08,VZ 3.35 05/15/51,VERIZON COMMUNICATIONS,DOMESTIC MTN,3.35,FIXED,30/360,2,2,2021-05-20,2021-11-15,2021-05-20,2051-05-15,CALLABLE,Sr Unsecured,5.352,US,USD,ACTV,29.984941820670773,27.09924709103354,2024-04-08,61.699,62.744,6.321,6.208,62.2215,6.2645,6.26402262225747,133.17895779769745,13.05601549620249,15.86357639764836,356.8158672482144
VZ,Corp,BBG01138HHJ9,US92346MGX39,US91282CJZ59,VZ 2.55 05/15/33,VERIZON COMMUNICATIONS,DOMESTIC MTN,2.54999999999999,FIXED,30/360,2,2,2021-05-27,2021-11-15,2021-05-27,2033-05-15,CALLABLE,Sr Unsecured,7.539,US,USD,ACTV,11.967145790554415,9.100616016427105,2024-04-08,75.693,76.435,6.065,5.94,76.064,6.0025,6.002479890733957,107.48271757008084,6.855441620297643,7.861856934846645,71.54509686554984
VZ,Corp,BBG01138JL35,US92346MGY12,US912810TV08,VZ 3.4 05/15/51,VERIZON COMMUNICATIONS,DOMESTIC MTN,3.39999999999999,FIXED,30/360,2,2,2021-05-27,2021-11-15,2021-05-27,2051-05-15,CALLABLE,Sr Unsecured,5.076,US,USD,ACTV,29.965776865160848,27.09924709103354,2024-04-08,62.281,63.334,6.328,6.214,62.807500000000005,6.271000000000001,6.2707071296870724,133.8373951674651,13.136551765381457,15.809509315410367,354.96394798440747
VZ,Corp,BBG0116RZS37,US92346MGZ86,US91282CJZ59,VZ 2.55 06/15/33,VERIZON COMMUNICATIONS,DOMESTIC MTN,2.54999999999999,FIXED,30/360,2,2,2021-06-04,2021-12-15,2021-06-04,2033-06-15,CALLABLE,Sr Unsecured,2.694,US,USD,ACTV,12.030116358658454,9.1854893908282,2024-04-08,75.117,75.895,6.134,6.003,75.506,6.0685,6.0685320697724805,113.89706084794307,6.902770295034844,7.945468289137155,72.90995257688373
VZ,Corp,BBG0116S0ZN5,US92346MHA27,US912810TV08,VZ 3.35 06/15/51,VERIZON COMMUNICATIONS,DOMESTIC MTN,3.35,FIXED,30/360,2,2,2021-06-04,2021-12-15,2021-06-04,2051-06-15,CALLABLE,Sr Unsecured,5.523,US,USD,ACTV,30.028747433264886,27.184120465434635,2024-04-08,61.683,62.727,6.318,6.205,62.205,6.2615,6.260748666697467,132.83120083917672,13.077637137059778,15.94641843567404,359.5003128308349
VZ,Corp,BBG01191QMP0,US92346MHB00,US91282CJZ59,VZ 2.55 06/15/33,VERIZON COMMUNICATIONS,DOMESTIC MTN,2.54999999999999,FIXED,30/360,2,2,2021-06-10,2021-12-15,2021-06-10,2033-06-15,CALLABLE,Sr Unsecured,1.884,US,USD,ACTV,12.013689253935661,9.1854893908282,2024-04-08,75.118,75.906,6.134,6.001,75.512,6.067500000000001,6.067516791110831,113.79702923283507,6.902770295034844,7.945468289137155,72.90995257688373
VZ,Corp,BBG011C76F52,US92346MHD65,US91282CKH33,VZ 1.1 06/15/26,VERIZON COMMUNICATIONS,DOMESTIC MTN,1.1,FIXED,30/360,2,2,2021-06-17,2021-12-15,2021-06-17,2026-06-15,CALLABLE,Sr Unsecured,3.692,US,USD,ACTV,4.993839835728953,2.184804928131417,2024-04-08,90.019,90.298,6.054,5.906,90.1585,5.98,5.980079009552478,105.4778273391804,1.9790661941852394,2.1276098424945555,5.605907893232734
VZ,Corp,BBG011C77R19,US92346MHE49,US91282CJZ59,VZ 2.35 06/15/31,VERIZON COMMUNICATIONS,DOMESTIC MTN,2.35,FIXED,30/360,2,2,2021-06-17,2021-12-15,2021-06-17,2031-06-15,CALLABLE,Sr Unsecured,4.27,US,USD,ACTV,9.99315537303217,7.184120465434634,2024-04-08,78.653,79.319,6.06,5.928,78.986,5.994,5.993573471158744,106.62565392448937,5.695976940733882,6.455572337759368,47.5871173042854
VZ,Corp,BBG011C77V10,US92346MHF14,US912810TV08,VZ 3.35 06/15/51,VERIZON COMMUNICATIONS,DOMESTIC MTN,3.35,FIXED,30/360,2,2,2021-06-17,2021-12-15,2021-06-17,2051-06-15,CALLABLE,Sr Unsecured,6.087,US,USD,ACTV,29.99315537303217,27.184120465434635,2024-04-08,61.797,62.837,6.305,6.193,62.317,6.249,6.248645053058863,131.63870501789333,13.077637137059778,15.94641843567404,359.5003128308349
VZ,Corp,BBG011F6KFX4,US92346MHG96,US91282CKH33,VZ 1.05 06/15/26,VERIZON COMMUNICATIONS,DOMESTIC MTN,1.05,FIXED,30/360,2,2,2021-06-24,2021-12-15,2021-06-24,2026-06-15,CALLABLE,Sr Unsecured,1.74,US,USD,ACTV,4.974674880219028,2.184804928131417,2024-04-08,89.919,90.206,6.053,5.902,90.0625,5.9775,5.9775760362589425,105.2313295583583,1.9777186093532884,2.1288713336471394,5.610076554832039
VZ,Corp,BBG011F6KM78,US92346MHH79,US91282CJZ59,VZ 2.2 06/15/31,VERIZON COMMUNICATIONS,DOMESTIC MTN,2.2,FIXED,30/360,2,2,2021-06-24,2021-12-15,2021-06-24,2031-06-15,CALLABLE,Sr Unsecured,3.036,US,USD,ACTV,9.973990417522245,7.184120465434634,2024-04-08,77.797,78.469,6.059,5.924,78.133,5.9915,5.991237615793943,106.39604912606694,5.664001271146596,6.490011939427452,47.9235658295456
VZ,Corp,BBG011F6KXW6,US92346MHJ36,US912810TV08,VZ 3 1/4 06/15/51,VERIZON COMMUNICATIONS,DOMESTIC MTN,3.25,FIXED,30/360,2,2,2021-06-24,2021-12-15,2021-06-24,2051-06-15,CALLABLE,Sr Unsecured,5.224,US,USD,ACTV,29.973990417522245,27.184120465434635,2024-04-08,60.339,61.371,6.324,6.21,60.855000000000004,6.2669999999999995,6.266449639946223,133.39306288032967,12.915981269985567,16.057847313984514,363.33560253442386
VZ,Corp,BBG012112DV5,US92346MHM64,US91282CJZ59,VZ 2 08/15/31,VERIZON COMMUNICATIONS,DOMESTIC MTN,2.0,FIXED,30/360,2,2,2021-08-12,2022-02-15,2021-08-12,2031-08-15,CALLABLE,Sr Unsecured,1.769,US,USD,ACTV,10.00684462696783,7.351129363449692,2024-04-08,76.19,76.879,6.064,5.927,76.53450000000001,5.9955,5.994985075516092,106.71427444538955,5.72141887512795,6.702614804646431,50.654116406101814
VZ,Corp,BBG01211FTL7,US92346MHN48,US912810TV08,VZ 2.95 08/15/51,VERIZON COMMUNICATIONS,DOMESTIC MTN,2.95,FIXED,30/360,2,2,2021-08-12,2022-02-15,2021-08-12,2051-08-15,CALLABLE,Sr Unsecured,1.591,US,USD,ACTV,30.00684462696783,27.351129363449694,2024-04-08,56.201,57.242,6.343,6.223,56.7215,6.2829999999999995,6.282613169401882,134.93567313624524,12.46935158643388,16.587328281963035,381.3968619014364
VZ,Corp,BBG01236GVZ3,US92346MHP95,US91282CJZ59,VZ 2.2 08/15/33,VERIZON COMMUNICATIONS,DOMESTIC MTN,2.2,FIXED,30/360,2,2,2021-08-19,2022-02-15,2021-08-19,2033-08-15,CALLABLE,Sr Unsecured,4.129,US,USD,ACTV,11.989048596851472,9.352498288843258,2024-04-08,72.309,73.068,6.136,6.007,72.6885,6.0715,6.071481374767305,114.14117013656572,6.877913187098374,8.234308891712015,77.2064187469006
VZ,Corp,BBG01236JJ78,US92346MHQ78,US912810TV08,VZ 3 08/15/51,VERIZON COMMUNICATIONS,DOMESTIC MTN,3.0,FIXED,30/360,2,2,2021-08-19,2022-02-15,2021-08-19,2051-08-15,CALLABLE,Sr Unsecured,5.192,US,USD,ACTV,29.987679671457904,27.351129363449694,2024-04-08,57.003,58.001,6.325,6.211,57.501999999999995,6.268000000000001,6.267633258498647,133.45949311958947,12.550635073261933,16.523575772801653,379.1814205956388
VZ,Corp,BBG01255VG98,US92346MHR51,US91282CJZ59,VZ 2.2 08/15/33,VERIZON COMMUNICATIONS,DOMESTIC MTN,2.2,FIXED,30/360,2,2,2021-08-26,2022-02-15,2021-08-26,2033-08-15,CALLABLE,Sr Unsecured,0.682,US,USD,ACTV,11.969883641341546,9.352498288843258,2024-04-08,72.31,73.116,6.136,5.999,72.713,6.0675,6.067303974181414,113.72962306118023,6.877913187098374,8.234308891712015,77.2064187469006
VZ,Corp,BBG01255VPR8,US92346MHS35,US912810TV08,VZ 3 08/15/51,VERIZON COMMUNICATIONS,DOMESTIC MTN,3.0,FIXED,30/360,2,2,2021-08-26,2022-02-15,2021-08-26,2051-08-15,CALLABLE,Sr Unsecured,6.42,US,USD,ACTV,29.968514715947983,27.351129363449694,2024-04-08,57.247,58.239,6.297,6.185,57.742999999999995,6.241,6.2402728620881485,130.7641987235792,12.550635073261933,16.523575772801653,379.1814205956388
VZ,Corp,BBG012938C76,US92346MHT18,US912810TV08,VZ 3 09/15/51,VERIZON COMMUNICATIONS,DOMESTIC MTN,3.0,FIXED,30/360,2,2,2021-09-02,2022-03-15,2021-09-02,2051-09-15,CALLABLE,Sr Unsecured,5.439,US,USD,ACTV,30.034223134839152,27.43600273785079,2024-04-08,57.013,58.01,6.318,6.205,57.5115,6.2615,6.261169276386499,132.8624912028625,12.56764436360574,16.604469108858762,381.92725549296506
VZ,Corp,BBG012F6QLR0,US92346MHU80,US91282CJZ59,VZ 2.15 09/15/31,VERIZON COMMUNICATIONS,DOMESTIC MTN,2.14999999999999,FIXED,30/360,2,2,2021-09-16,2022-03-15,2021-09-16,2031-09-15,CALLABLE,Sr Unsecured,2.376,US,USD,ACTV,9.995893223819301,7.436002737850787,2024-04-08,77.228,77.922,5.992,5.857,77.57499999999999,5.9245,5.924241768503799,99.65903466503723,5.805280389539572,6.750424343762895,51.45784017013678
VZ,Corp,BBG012F6PR25,US92346MHV63,US912810TV08,VZ 3.05 09/15/51,VERIZON COMMUNICATIONS,DOMESTIC MTN,3.04999999999999,FIXED,30/360,2,2,2021-09-16,2022-03-15,2021-09-16,2051-09-15,CALLABLE,Sr Unsecured,5.251,US,USD,ACTV,29.9958932238193,27.43600273785079,2024-04-08,57.673,58.679,6.317,6.203,58.176,6.26,6.259684591868442,132.71641720301648,12.649268619817528,16.542053081965992,379.7479552554226
VZ,Corp,BBG012J3CSK0,US92346MHW47,US91282CJZ59,VZ 2.2 09/15/33,VERIZON COMMUNICATIONS,DOMESTIC MTN,2.2,FIXED,30/360,2,2,2021-09-23,2022-03-15,2021-09-23,2033-09-15,CALLABLE,Sr Unsecured,1.339,US,USD,ACTV,11.978097193702943,9.437371663244353,2024-04-08,72.116,72.911,6.138,6.004,72.5135,6.071,6.070677638798952,114.00722728955922,6.921486216726392,8.317378857357625,78.62828273147817
VZ,Corp,BBG012J3DQ87,US92346MHX20,US912810TV08,VZ 2.95 09/15/51,VERIZON COMMUNICATIONS,DOMESTIC MTN,2.95,FIXED,30/360,2,2,2021-09-23,2022-03-15,2021-09-23,2051-09-15,CALLABLE,Sr Unsecured,1.869,US,USD,ACTV,29.976728268309376,27.43600273785079,2024-04-08,56.167,57.202,6.341,6.222,56.6845,6.2815,6.28133270424198,134.84888443782535,12.486056948393719,16.668232508646373,384.15360021917417
VZ,Corp,BBG012N0Z4Z3,US92346MHY03,US91282CJZ59,VZ 2 1/4 09/15/33,VERIZON COMMUNICATIONS,DOMESTIC MTN,2.25,FIXED,30/360,2,2,2021-09-30,2022-03-15,2021-09-30,2033-09-15,CALLABLE,Sr Unsecured,2.827,US,USD,ACTV,11.958932238193018,9.437371663244353,2024-04-08,72.471,73.247,6.138,6.007,72.85900000000001,6.0725,6.072283788770437,114.165869508127,6.938384431214423,8.299254731698985,78.39598051768529
VZ,Corp,BBG012N0ZND5,US92346MHZ77,US912810TV08,VZ 2.9 09/15/51,VERIZON COMMUNICATIONS,DOMESTIC MTN,2.89999999999999,FIXED,30/360,2,2,2021-09-30,2022-03-15,2021-09-30,2051-09-15,CALLABLE,Sr Unsecured,2.556,US,USD,ACTV,29.95756331279945,27.43600273785079,2024-04-08,55.523,56.538,6.341,6.223,56.0305,6.282,6.281792185455562,134.89394458666564,12.404507580125989,16.73338738591839,386.4285293773515
VZ,Corp,BBG013B5Y7R6,US92346MJA09,US91282CJZ59,VZ 2.45 11/15/33,VERIZON COMMUNICATIONS,DOMESTIC MTN,2.45,FIXED,30/360,2,2,2021-11-12,2022-05-15,2021-11-12,2033-11-15,CALLABLE,Sr Unsecured,2.358,US,USD,ACTV,12.008213552361397,9.604380561259411,2024-04-08,73.522,74.317,6.142,6.01,73.9195,6.0760000000000005,6.075936984270812,114.50567803745062,7.088331430151776,8.268114465657769,79.10111618278454
VZ,Corp,BBG013B60FX6,US92346MJB81,US912810TV08,VZ 3.1 11/15/51,VERIZON COMMUNICATIONS,DOMESTIC MTN,3.1,FIXED,30/360,2,2,2021-11-12,2022-05-15,2021-11-12,2051-11-15,CALLABLE,Sr Unsecured,5.268,US,USD,ACTV,30.00684462696783,27.603011635865844,2024-04-08,58.183,59.195,6.321,6.208,58.689,6.2645,6.2644346229470935,133.17222243095895,12.743544613631617,16.286277814982693,374.83794319265627
VZ,Corp,BBG013G3YPW0,US92346MJC64,US91282CJZ59,VZ 2.35 11/15/33,VERIZON COMMUNICATIONS,DOMESTIC MTN,2.35,FIXED,30/360,2,2,2021-11-18,2022-05-15,2021-11-18,2033-11-15,CALLABLE,Sr Unsecured,1.099,US,USD,ACTV,11.991786447638603,9.604380561259411,2024-04-08,72.821,73.637,6.139,6.003,73.229,6.071,6.071173220127821,114.03564783263991,7.053638745605879,8.306605048048779,79.59350515462133
VZ,Corp,BBG013G417Q1,US92346MJD48,US912810TV08,VZ 3 11/15/51,VERIZON COMMUNICATIONS,DOMESTIC MTN,3.0,FIXED,30/360,2,2,2021-11-18,2022-05-15,2021-11-18,2051-11-15,CALLABLE,Sr Unsecured,2.591,US,USD,ACTV,29.99041752224504,27.603011635865844,2024-04-08,56.667,57.713,6.347,6.227,57.19,6.287000000000001,6.286523231118918,135.3481239378215,12.579369606762032,16.411230932430637,379.19267740118937
VZ,Corp,BBG013JZ3VM8,US92346MJF95,US912810TV08,VZ 3.05 11/15/51,VERIZON COMMUNICATIONS,DOMESTIC MTN,3.04999999999999,FIXED,30/360,2,2,2021-11-26,2022-05-15,2021-11-26,2051-11-15,CALLABLE,Sr Unsecured,2.17,US,USD,ACTV,29.968514715947983,27.603011635865844,2024-04-08,57.369,58.412,6.34,6.222,57.8905,6.281000000000001,6.280932090431452,134.79743439796175,12.661438387448591,16.34808641029936,376.9920311410341
VZ,Corp,BBG013Q1WB83,US92346MJG78,US912810TV08,VZ 3.05 12/15/51,VERIZON COMMUNICATIONS,DOMESTIC MTN,3.04999999999999,FIXED,30/360,2,2,2021-12-02,2022-06-15,2021-12-02,2051-12-15,CALLABLE,Sr Unsecured,1.0,US,USD,ACTV,30.034223134839152,27.685147159479808,2024-04-08,57.317,58.387,6.341,6.219,57.852000000000004,6.28,6.279660811660076,134.68163842582857,12.680407934577609,16.430523469786337,379.72382146531316
VZ,Corp,BBG013TX5342,US92346MJH51,US91282CJZ59,VZ 2.55 12/15/33,VERIZON COMMUNICATIONS,DOMESTIC MTN,2.54999999999999,FIXED,30/360,2,2,2021-12-09,2022-06-15,2021-12-09,2033-12-15,CALLABLE,Sr Unsecured,2.208,US,USD,ACTV,12.016427104722792,9.686516084873375,2024-04-08,74.055,74.859,6.145,6.013,74.457,6.079,6.078827116638422,114.85336424632627,7.166802936470926,8.312042825743024,80.0060614709981
VZ,Corp,BBG013TYDNR2,US92346MJJ18,US912810TV08,VZ 3.05 12/15/51,VERIZON COMMUNICATIONS,DOMESTIC MTN,3.04999999999999,FIXED,30/360,2,2,2021-12-09,2022-06-15,2021-12-09,2051-12-15,CALLABLE,Sr Unsecured,1.875,US,USD,ACTV,30.015058179329227,27.685147159479808,2024-04-08,57.303,58.351,6.342,6.223,57.827,6.2825,6.282492581754923,134.9606304625821,12.680407934577609,16.430523469786337,379.72382146531316
VZ,Corp,BBG013Y3PTZ9,US92346MJL63,US912810TV08,VZ 2.9 12/15/51,VERIZON COMMUNICATIONS,DOMESTIC MTN,2.89999999999999,FIXED,30/360,2,2,2021-12-16,2022-06-15,2021-12-16,2051-12-15,CALLABLE,Sr Unsecured,0.494,US,USD,ACTV,29.9958932238193,27.685147159479808,2024-04-08,55.374,56.442,6.34,6.217,55.908,6.278499999999999,6.2781530342996135,134.53308497836738,12.433307029595209,16.624129897025618,386.50287529176103
VZ,Corp,BBG0141PMGW8,US92346MJM47,US912810TV08,VZ 3.05 12/15/51,VERIZON COMMUNICATIONS,DOMESTIC MTN,3.04999999999999,FIXED,30/360,2,2,2021-12-23,2022-06-15,2021-12-23,2051-12-15,CALLABLE,Sr Unsecured,1.714,US,USD,ACTV,29.976728268309376,27.685147159479808,2024-04-08,57.306,58.358,6.342,6.223,57.831999999999994,6.2825,6.281926081329583,134.90481810413226,12.680407934577609,16.430523469786337,379.72382146531316
VZ,Corp,BBG016DXKTS2,US92346MJN20,US91282CKG59,VZ 3 1/2 04/15/29,VERIZON COMMUNICATIONS,DOMESTIC MTN,3.5,FIXED,30/360,2,2,2022-04-07,2022-10-15,2022-04-07,2029-04-15,CALLABLE,Sr Unsecured,2.771,US,USD,ACTV,7.02258726899384,5.018480492813142,2024-04-08,89.46,90.013,5.963,5.825,89.7365,5.894,5.893996229201921,96.7722410962844,4.39040049734855,4.491905269914046,23.80279642233712
VZ,Corp,BBG016DXQ0N4,US92346MJP77,US912810TV08,VZ 4 04/15/52,VERIZON COMMUNICATIONS,DOMESTIC MTN,4.0,FIXED,30/360,2,2,2022-04-07,2022-10-15,2022-04-07,2052-04-15,CALLABLE,Sr Unsecured,0.948,US,USD,ACTV,30.023271731690624,28.019164955509925,2024-04-08,69.486,70.696,6.343,6.223,70.09100000000001,6.2829999999999995,6.282439811174616,134.95921686995007,14.3194041649416,15.401559659583492,347.2428978093319
VZ,Corp,BBG0175X1628,US92346MJS17,US912810TV08,VZ 4.55 05/15/52,VERIZON COMMUNICATIONS,DOMESTIC MTN,4.54999999999999,FIXED,30/360,2,2,2022-05-12,2022-11-15,2022-05-12,2052-05-15,CALLABLE,Sr Unsecured,0.243,US,USD,ACTV,30.00958247775496,28.10130047912389,2024-04-08,76.996,78.334,6.308,6.185,77.66499999999999,6.246499999999999,6.24591932669282,131.3690541729683,15.274859242663213,15.049015594903429,334.40459904876695
VZ,Corp,BBG017BR3G75,US92346MJT99,US91282CKG59,VZ 4.15 05/15/29,VERIZON COMMUNICATIONS,DOMESTIC MTN,4.15,FIXED,30/360,2,2,2022-05-19,2022-11-15,2022-05-19,2029-05-15,CALLABLE,Sr Unsecured,2.717,US,USD,ACTV,6.9897330595482545,5.100616016427105,2024-04-08,92.2,92.768,5.945,5.809,92.48400000000001,5.877000000000001,5.876699826866387,95.18759472530316,4.531144276927464,4.504517174078346,24.095868392801535
VZ,Corp,BBG017BRHDL1,US92346MJU62,US91282CJZ59,VZ 4.55 05/15/34,VERIZON COMMUNICATIONS,DOMESTIC MTN,4.54999999999999,FIXED,30/360,2,2,2022-05-19,2022-11-15,2022-05-19,2034-05-15,CALLABLE,Sr Unsecured,0.642,US,USD,ACTV,11.989048596851472,10.099931553730322,2024-04-08,88.028,88.952,6.159,6.026,88.49000000000001,6.092499999999999,6.092279099673033,116.34488343654316,8.132577731797557,7.9096350089378875,76.73163688795292
VZ,Corp,BBG017BRHHJ5,US92346MJV46,US912810TV08,VZ 4.8 05/15/52,VERIZON COMMUNICATIONS,DOMESTIC MTN,4.79999999999999,FIXED,30/360,2,2,2022-05-19,2022-11-15,2022-05-19,2052-05-15,CALLABLE,Sr Unsecured,0.515,US,USD,ACTV,29.99041752224504,28.10130047912389,2024-04-08,80.132,81.48,6.32,6.2,80.80600000000001,6.26,6.259314656597343,132.68884609438592,15.698222135347532,14.87611195755387,328.27652046063724
VZ,Corp,BBG017J00GR7,US92346MJX02,US912810TV08,VZ 4.65 05/15/52,VERIZON COMMUNICATIONS,DOMESTIC MTN,4.65,FIXED,30/360,2,2,2022-05-26,2022-11-15,2022-05-26,2052-05-15,CALLABLE,Sr Unsecured,0.469,US,USD,ACTV,29.971252566735114,28.10130047912389,2024-04-08,78.488,79.827,6.291,6.17,79.1575,6.2305,6.23000741377473,129.8013356834987,15.44415605975335,14.97818713811519,331.8942854652721
VZ,Corp,BBG017QYL3D6,US92346MJY84,US91282CKG59,VZ 3.95 06/15/29,VERIZON COMMUNICATIONS,DOMESTIC MTN,3.95,FIXED,30/360,2,2,2022-06-03,2022-12-15,2022-06-03,2029-06-15,CALLABLE,Sr Unsecured,1.661,US,USD,ACTV,7.0335386721423685,5.1854893908282,2024-04-08,91.35,91.933,5.911,5.772,91.64150000000001,5.8415,5.84165620431304,91.56815505839513,4.574733537950533,4.608935942414821,25.047992947259953
VZ,Corp,BBG017QYK9Z0,US92346MJZ59,US912810TV08,VZ 4.65 06/15/52,VERIZON COMMUNICATIONS,DOMESTIC MTN,4.65,FIXED,30/360,2,2,2022-06-03,2022-12-15,2022-06-03,2052-06-15,CALLABLE,Sr Unsecured,0.746,US,USD,ACTV,30.034223134839152,28.186173853524984,2024-04-08,78.57,79.897,6.281,6.162,79.23349999999999,6.2215,6.220841609686614,128.87632149279662,15.473877674014211,15.060949811102814,334.42786520776406
VZ,Corp,BBG017ZLXKJ7,US92346MKD29,US912810TV08,VZ 4.45 06/15/52,VERIZON COMMUNICATIONS,DOMESTIC MTN,4.45,FIXED,30/360,2,2,2022-06-16,2022-12-15,2022-06-16,2052-06-15,CALLABLE,Sr Unsecured,0.07,US,USD,ACTV,29.998631074606433,28.186173853524984,2024-04-08,76.275,77.639,6.25,6.125,76.957,6.1875,6.1871852699124785,125.56018622308277,15.13400347999471,15.204964821633727,339.5561066217852
VZ,Corp,BBG0184HHJZ1,US92346MKE02,US91282CKG59,VZ 4.3 06/15/29,VERIZON COMMUNICATIONS,DOMESTIC MTN,4.29999999999999,FIXED,30/360,2,2,2022-06-24,2022-12-15,2022-06-24,2029-06-15,CALLABLE,Sr Unsecured,0.427,US,USD,ACTV,6.976043805612594,5.1854893908282,2024-04-08,92.894,93.501,5.911,5.768,93.1975,5.839499999999999,5.838993629068136,91.30564859015092,4.617294237181124,4.572927832381285,24.78871384209295
VZ,Corp,BBG0191HMXJ3,US92346MKG59,US912810TV08,VZ 4.6 08/15/52,VERIZON COMMUNICATIONS,DOMESTIC MTN,4.59999999999999,FIXED,30/360,2,2,2022-08-11,2023-02-15,2022-08-11,2052-08-15,CALLABLE,Sr Unsecured,0.644,US,USD,ACTV,30.012320328542096,28.35318275154004,2024-04-08,79.02,80.373,6.176,6.057,79.6965,6.1165,6.116184317320586,118.50686205737256,15.44745446872965,15.26251546349416,340.8055434179059
VZ,Corp,BBG01946LKK1,US92346MKH33,US91282CKG59,VZ 4 08/15/29,VERIZON COMMUNICATIONS,DOMESTIC MTN,4.0,FIXED,30/360,2,2,2022-08-18,2023-02-15,2022-08-18,2029-08-15,CALLABLE,Sr Unsecured,0.699,US,USD,ACTV,6.992470910335387,5.352498288843258,2024-04-08,91.781,92.394,5.809,5.667,92.0875,5.7379999999999995,5.737986975163222,81.28050974964201,4.71181787751855,4.7692184382955345,26.64127659325297
VZ,Corp,BBG019LXC9P3,US92346MKQ32,US91282CKG59,VZ 4 1/2 09/15/29,VERIZON COMMUNICATIONS,DOMESTIC MTN,4.5,FIXED,30/360,2,2,2022-09-22,2023-03-15,2022-09-22,2029-09-15,CALLABLE,Sr Unsecured,0.0,US,USD,ACTV,6.981519507186858,5.437371663244353,2024-04-08,96.17,96.847,5.321,5.173,96.5085,5.247,5.246466927230359,32.769189317954584,4.8429695277790294,4.801562242270094,27.094028791751093
VZ,Corp,BBG019R2Z7Y4,US92346MKR15,US91282CKG59,VZ 4.8 09/15/29,VERIZON COMMUNICATIONS,DOMESTIC MTN,4.79999999999999,FIXED,30/360,2,2,2022-09-29,2023-03-15,2022-09-29,2029-09-15,CALLABLE,Sr Unsecured,1.159,US,USD,ACTV,6.962354551676934,5.437371663244353,2024-04-08,95.095,95.713,5.867,5.729,95.404,5.798,5.797756028149948,87.07606583353298,4.882662263010488,4.772224876350147,26.868207054629362
VZ,Corp,BBG01B9LS2V9,US92346MKS97,US91282CKG59,VZ 5.55 11/15/29,VERIZON COMMUNICATIONS,DOMESTIC MTN,5.54999999999999,FIXED,30/360,2,2,2022-11-10,2023-05-15,2022-11-10,2029-11-15,CALLABLE,Sr Unsecured,1.191,US,USD,ACTV,7.014373716632443,5.604380561259411,2024-04-08,97.634,98.265,6.053,5.917,97.9495,5.984999999999999,5.985161288073367,105.50768166994861,5.117723712263925,4.740993150741167,27.251434006366495
VZ,Corp,BBG01BFJ97Y4,US92346MKT70,US91282CKG59,VZ 5.6 11/15/29,VERIZON COMMUNICATIONS,DOMESTIC MTN,5.59999999999999,FIXED,30/360,2,2,2022-11-17,2023-05-15,2022-11-17,2029-11-15,CALLABLE,Sr Unsecured,2.682,US,USD,ACTV,6.995208761122519,5.604380561259411,2024-04-08,97.878,98.493,6.051,5.919,98.18549999999999,5.984999999999999,5.98490433320403,105.482677248413,5.12468756961763,4.735812483769468,27.21163216229321
VZ,Corp,BBG01BRFTFK4,US92346MKV27,US91282CKG59,VZ 5 12/15/29,VERIZON COMMUNICATIONS,DOMESTIC MTN,5.0,FIXED,30/360,2,2,2022-12-08,2023-06-15,2022-12-08,2029-12-15,CALLABLE,Sr Unsecured,2.914,US,USD,ACTV,7.019849418206708,5.686516084873374,2024-04-08,96.041,96.664,5.827,5.694,96.35249999999999,5.7605,5.760284415632487,83.45444862897814,5.108306968009348,4.881398414592415,28.5313385797956
VZ,Corp,BBG01BYH8NP3,US92346MKX82,US91282CKG59,VZ 4.7 12/15/29,VERIZON COMMUNICATIONS,DOMESTIC MTN,4.7,FIXED,30/360,2,2,2022-12-22,2023-06-15,2022-12-22,2029-12-15,CALLABLE,Sr Unsecured,1.125,US,USD,ACTV,6.981519507186858,5.686516084873374,2024-04-08,95.921,96.571,5.545,5.408,96.24600000000001,5.4765,5.476379757546028,55.484476985248236,5.065411578666179,4.914849458686389,28.793809572778887
VZ,Corp,BBG01F7SNSR0,US92346MKY65,US91282CKG59,VZ 4.8 02/15/30,VERIZON COMMUNICATIONS,DOMESTIC MTN,4.79999999999999,FIXED,30/360,2,2,2023-02-24,2023-08-15,2023-02-24,2030-02-15,CALLABLE,Sr Unsecured,1.111,US,USD,ACTV,6.976043805612594,5.856262833675565,2024-04-08,95.672,96.331,5.679,5.542,96.0015,5.6105,5.6101465962827195,68.36516160518651,5.215033347392775,5.0711379193705675,30.460172084929475
VZ,Corp,BBG01FGZFZY9,US92346MKZ31,US91282CKG59,VZ 5.05 03/15/30,VERIZON COMMUNICATIONS,DOMESTIC MTN,5.04999999999999,FIXED,30/360,2,2,2023-03-02,2023-09-15,2023-03-02,2030-03-15,CALLABLE,Sr Unsecured,0.948,US,USD,ACTV,7.036276522929501,5.932922655715264,2024-04-08,96.546,97.214,5.745,5.608,96.88,5.6765,5.676110287785149,75.47227961910556,5.313488312461001,5.1205649640006605,31.049483224477317
VZ,Corp,BBG01GHNM134,US92346MLC37,US91282CKG59,VZ 4.65 05/15/30,VERIZON COMMUNICATIONS,DOMESTIC MTN,4.65,FIXED,30/360,2,2,2023-05-11,2023-11-15,2023-05-11,2030-05-15,CALLABLE,Sr Unsecured,0.687,US,USD,ACTV,7.011635865845311,6.099931553730322,2024-04-08,95.27,95.96,5.575,5.436,95.615,5.5055,5.505421290546657,58.60884545721975,5.377362754217131,5.208194381506393,32.46146935698219
VZ,Corp,BBG01GKTPV92,US92346MLD10,US91282CKG59,VZ 4.7 05/15/30,VERIZON COMMUNICATIONS,DOMESTIC MTN,4.7,FIXED,30/360,2,2,2023-05-18,2023-11-15,2023-05-18,2030-05-15,CALLABLE,Sr Unsecured,0.355,US,USD,ACTV,6.992470910335387,6.099931553730322,2024-04-08,95.512,96.212,5.577,5.437,95.862,5.507,5.507215654104948,58.785497538224966,5.385436423829864,5.20168917368736,32.40734398615104
VZ,Corp,BBG01GNB6JT4,US92346MLE92,US91282CKG59,VZ 4.7 05/15/30,VERIZON COMMUNICATIONS,DOMESTIC MTN,4.7,FIXED,30/360,2,2,2023-05-25,2023-11-15,2023-05-25,2030-05-15,CALLABLE,Sr Unsecured,0.597,US,USD,ACTV,6.973305954825462,6.099931553730322,2024-04-08,95.544,96.236,5.571,5.433,95.89,5.502,5.501611011475325,58.23307166014461,5.385436423829864,5.20168917368736,32.40734398615104
VZ,Corp,BBG01GXMBLP2,US92346MLF67,US91282CKG59,VZ 5 06/15/30,VERIZON COMMUNICATIONS,DOMESTIC MTN,5.0,FIXED,30/360,2,2,2023-06-15,2023-12-15,2023-06-15,2030-06-15,CALLABLE,Sr Unsecured,0.814,US,USD,ACTV,7.000684462696783,6.184804928131417,2024-04-08,96.61,97.304,5.656,5.519,96.957,5.5875,5.587486656755209,66.5671147769415,5.501502085453318,5.246996646539308,33.0014068556706
VZ,Corp,BBG01H3WLX83,US92346MLJ89,US912810TV08,VZ 5.45 06/15/53,VERIZON COMMUNICATIONS,DOMESTIC MTN,5.45,FIXED,30/360,2,2,2023-06-29,2023-12-15,2023-06-29,2053-06-15,CALLABLE,Sr Unsecured,1.354,US,USD,ACTV,29.963039014373717,29.1854893908282,2024-04-08,93.207,94.709,5.942,5.829,93.958,5.8855,5.885129068046807,95.80700482144783,17.167003994370436,14.79387895715148,329.6526987943388
VZ,Corp,BBG01H6Z4GR8,US92346MLL36,US912810TV08,VZ 5.4 07/15/53,VERIZON COMMUNICATIONS,DOMESTIC MTN,5.4,FIXED,30/360,2,2,2023-07-07,2024-01-15,2023-07-07,2053-07-15,CALLABLE,Sr Unsecured,1.717,US,USD,ACTV,30.023271731690624,29.267624914442163,2024-04-08,92.845,94.337,5.916,5.804,93.59100000000001,5.86,5.859817420691252,93.31789830468425,17.11124657489863,14.904051756663797,333.15718277861953
VZ,Corp,BBG01HQ6KBQ4,US92346MLN91,US912810TV08,VZ 5 1/2 08/15/53,VERIZON COMMUNICATIONS,DOMESTIC MTN,5.5,FIXED,30/360,2,2,2023-08-10,2024-02-15,2023-08-10,2053-08-15,CALLABLE,Sr Unsecured,0.696,US,USD,ACTV,30.015058179329227,29.352498288843258,2024-04-08,94.166,95.712,5.921,5.805,94.939,5.8629999999999995,5.862771169096232,93.54598607987154,17.324851601878756,14.933082388059757,333.66862671885974
VZ,Corp,BBG01HSZLJK6,US92346MLP40,US91282CKG59,VZ 5 1/4 08/15/30,VERIZON COMMUNICATIONS,DOMESTIC MTN,5.25,FIXED,30/360,2,2,2023-08-17,2024-02-15,2023-08-17,2030-08-15,CALLABLE,Sr Unsecured,0.623,US,USD,ACTV,6.995208761122519,6.351813826146475,2024-04-08,97.611,98.323,5.702,5.566,97.967,5.634,5.6339521779581885,71.06906374658487,5.676795748037035,5.3816675217019405,34.57302454076894
VZ,Corp,BBG01HSZLX52,US92346MLQ23,US912810TV08,VZ 5.8 08/15/53,VERIZON COMMUNICATIONS,DOMESTIC MTN,5.79999999999999,FIXED,30/360,2,2,2023-08-17,2024-02-15,2023-08-17,2053-08-15,CALLABLE,Sr Unsecured,0.753,US,USD,ACTV,29.9958932238193,29.352498288843258,2024-04-08,96.392,97.925,6.064,5.95,97.1585,6.007,6.00648810788989,107.70233979171074,17.862034124419818,14.777329696980516,327.886559746949
VZ,Corp,BBG01HWS4NQ1,US92346MLR06,US91282CKG59,VZ 5.3 08/15/30,VERIZON COMMUNICATIONS,DOMESTIC MTN,5.29999999999999,FIXED,30/360,2,2,2023-08-24,2024-02-15,2023-08-24,2030-08-15,CALLABLE,Sr Unsecured,0.46,US,USD,ACTV,6.976043805612594,6.351813826146475,2024-04-08,98.757,99.477,5.533,5.397,99.117,5.465,5.465083234300326,54.43054915240894,5.685492339311152,5.375579323513546,34.51933445162771
VZ,Corp,BBG01HWS5106,US92346MLS88,US912810TV08,VZ 5.8 08/15/53,VERIZON COMMUNICATIONS,DOMESTIC MTN,5.79999999999999,FIXED,30/360,2,2,2023-08-24,2024-02-15,2023-08-24,2053-08-15,CALLABLE,Sr Unsecured,1.205,US,USD,ACTV,29.976728268309376,29.352498288843258,2024-04-08,99.149,100.693,5.86,3.745,99.92099999999999,4.8025,5.805010267347097,87.85502082371967,17.862034124419818,14.777329696980516,327.886559746949
VZ,Corp,BBG01J99JS97,US92346MLX73,US91282CKG59,VZ 5.45 09/15/30,VERIZON COMMUNICATIONS,DOMESTIC MTN,5.45,FIXED,30/360,2,2,2023-09-21,2024-03-15,2023-09-21,2030-09-15,CALLABLE,Sr Unsecured,0.692,US,USD,ACTV,6.98425735797399,6.436687200547571,2024-04-08,98.278,98.993,5.773,5.638,98.63550000000001,5.7055,5.705612436681987,78.07775298732808,5.778448217142629,5.440321905053714,35.29944712263174
VZ,Corp,BBG01JFNM292,US92346MLZ22,US91282CKG59,VZ 5 1/2 09/15/30,VERIZON COMMUNICATIONS,DOMESTIC MTN,5.5,FIXED,30/360,2,2,2023-09-28,2024-03-15,2023-09-28,2030-09-15,CALLABLE,Sr Unsecured,1.073,US,USD,ACTV,6.965092402464066,6.436687200547571,2024-04-08,98.43,99.136,5.795,5.661,98.783,5.728,5.728039801865817,80.28749099890985,5.787340797357152,5.434356655647495,35.245853297140314
VZ,Corp,BBG01JFNMN14,US92346MMA61,US912810TV08,VZ 5.9 09/15/53,VERIZON COMMUNICATIONS,DOMESTIC MTN,5.9,FIXED,30/360,2,2,2023-09-28,2024-03-15,2023-09-28,2053-09-15,CALLABLE,Sr Unsecured,0.63,US,USD,ACTV,29.965776865160848,29.437371663244353,2024-04-08,97.436,98.977,6.088,5.974,98.2065,6.031000000000001,6.030563694425255,110.13897061061387,18.074871584135618,14.808713072347329,328.4970491454105
VZ,Corp,BBG01JJB3552,US92346MMB45,US91282CKG59,VZ 5.6 10/15/30,VERIZON COMMUNICATIONS,DOMESTIC MTN,5.59999999999999,FIXED,30/360,2,2,2023-10-05,2024-04-15,2023-10-05,2030-10-15,CALLABLE,Sr Unsecured,1.677,US,USD,ACTV,7.028062970568104,6.5188227241615335,2024-04-08,98.728,99.43,5.837,5.706,99.07900000000001,5.7715,5.771434639518159,84.64895476337081,5.8647385741612785,5.357948933014539,35.10950723120385
VZ,Corp,BBG01JJB3Z65,US92346MMC28,US912810TV08,VZ 5.95 10/15/53,VERIZON COMMUNICATIONS,DOMESTIC MTN,5.95,FIXED,30/360,2,2,2023-10-05,2024-04-15,2023-10-05,2053-10-15,CALLABLE,Sr Unsecured,0.38,US,USD,ACTV,30.028747433264886,29.519507186858316,2024-04-08,98.074,99.636,6.091,5.976,98.85499999999999,6.0335,6.0334485031664356,110.42742366583164,18.15906232545952,14.481672015191608,321.51472910316085
VZ,Corp,BBG01JZ9T677,US92346MMD01,US91282CKG59,VZ 5.9 11/15/30,VERIZON COMMUNICATIONS,DOMESTIC MTN,5.9,FIXED,30/360,2,2,2023-11-09,2024-05-15,2023-11-09,2030-11-15,CALLABLE,Sr Unsecured,1.816,US,USD,ACTV,7.017111567419575,6.6036960985626285,2024-04-08,99.521,100.221,5.988,5.508,99.87100000000001,5.748,5.922653251141311,99.4311821652318,5.9898671345120995,5.402365225283849,35.70384342043106
VZ,Corp,BBG01JZB1GR8,US92346MME83,US91282CKH33,VZ 6.4 11/15/53,VERIZON COMMUNICATIONS,DOMESTIC MTN,6.4,FIXED,30/360,2,2,2023-11-09,2024-05-15,2023-11-09,2053-11-15,CALLABLE,Sr Unsecured,2.548,US,USD,ACTV,30.017796030116358,29.60438056125941,2024-04-08,99.897,101.007,6.407,4.661,100.452,5.534,6.365295661054553,143.10623898663238,19.01100991619123,14.361587215186445,316.41685216156185
VZ,Corp,BBG01KBQY603,US92346MML27,US912810TV08,VZ 5 3/4 12/15/53,VERIZON COMMUNICATIONS,DOMESTIC MTN,5.75,FIXED,30/360,2,2,2023-12-07,2024-06-15,2023-12-07,2053-12-15,CALLABLE,Sr Unsecured,0.74,US,USD,ACTV,30.023271731690624,29.686516084873375,2024-04-08,97.4,98.963,5.937,5.823,98.1815,5.880000000000001,5.879554536250383,95.24991994141838,17.87177508158218,14.745165802618764,330.0816414017303
VZ,Corp,BBG01KJH00S5,US92346MMQ14,US912810TV08,VZ 5.4 12/15/53,VERIZON COMMUNICATIONS,DOMESTIC MTN,5.4,FIXED,30/360,2,2,2023-12-21,2024-06-15,2023-12-21,2053-12-15,CALLABLE,Sr Unsecured,0.764,US,USD,ACTV,29.984941820670773,29.686516084873375,2024-04-08,95.774,97.37,5.696,5.582,96.572,5.638999999999999,5.638672810047865,71.51671455153918,17.238514491123254,14.94350941837502,337.3142159755608
VZ,Corp,BBG01LQD83Q2,US92346MMS79,US912810TV08,VZ 5.3 03/15/54,VERIZON COMMUNICATIONS,DOMESTIC MTN,5.29999999999999,FIXED,30/360,2,2,2024-03-07,2024-09-15,2024-03-07,2054-03-15,CALLABLE,Sr Unsecured,0.128,US,USD,ACTV,30.02053388090349,29.932922655715263,2024-04-08,98.671,100.397,5.389,4.851,99.534,5.12,5.331050710147179,41.24792710827222,17.151157252204207,15.234298329604345,346.7051495590453
VZ,Corp,BBG01LTL2DY6,US92346MMT52,US91282CKF76,VZ 4.9 03/15/31,VERIZON COMMUNICATIONS,DOMESTIC MTN,4.9,FIXED,30/360,2,2,2024-03-14,2024-09-15,2024-03-14,2031-03-15,CALLABLE,Sr Unsecured,0.105,US,USD,ACTV,7.000684462696783,6.93223819301848,2024-04-08,98.856,99.654,5.097,4.959,99.255,5.0280000000000005,5.028015919029713,11.594168609974123,6.056297949706942,5.8644070441203615,40.79415784544929
VZ,Corp,BBG01LTL2MD9,US92346MMU26,US912810TV08,VZ 5.4 03/15/54,VERIZON COMMUNICATIONS,DOMESTIC MTN,5.4,FIXED,30/360,2,2,2024-03-14,2024-09-15,2024-03-14,2054-03-15,CALLABLE,Sr Unsecured,5.161,US,USD,ACTV,30.001368925393567,29.932922655715263,2024-04-08,98.208,99.718,5.523,5.419,98.963,5.471,5.47051041573286,54.989403264919204,17.334256300899288,15.177659596603855,344.5600391683816
VZ,Corp,BBG01LXJGQQ1,US92346MMW81,US912810TV08,VZ 5.3 03/15/54,VERIZON COMMUNICATIONS,DOMESTIC MTN,5.29999999999999,FIXED,30/360,2,2,2024-03-21,2024-09-15,2024-03-21,2054-03-15,CALLABLE,Sr Unsecured,0.643,US,USD,ACTV,29.982203969883642,29.932922655715263,2024-04-08,90.646,92.164,5.975,5.858,91.405,5.916499999999999,5.915893388539552,98.87417613715992,17.152047073364013,15.246819450854165,346.9980130283212
VZ,Corp,BBG01M2K6NQ8,US92346MMX64,US91282CJZ59,VZ 5 03/15/34,VERIZON COMMUNICATIONS,DOMESTIC MTN,5.0,FIXED,30/360,2,2,2024-03-28,2024-09-15,2024-03-28,2034-03-15,CALLABLE,Sr Unsecured,1.19,US,USD,ACTV,9.963039014373717,9.932922655715263,2024-04-08,98.844,99.817,5.15,5.024,99.3305,5.087,5.0867250487208375,17.271435519081987,8.20270210936866,7.83070341245736,74.4387888617321
VZ,Corp,BBG01M5LWZK3,US92346MMZ13,US91282CJZ59,VZ 4.95 04/15/34,VERIZON COMMUNICATIONS,DOMESTIC MTN,4.95,FIXED,30/360,2,2,2024-04-04,2024-10-15,2024-04-04,2034-04-15,CALLABLE,Sr Unsecured,0.954,US,USD,ACTV,10.028747433264886,10.017796030116358,2024-04-08,98.627,99.615,5.127,4.999,99.121,5.063,5.063085571253148,14.87686527308472,8.239441771404367,7.9009385417787135,75.71128298028646
DIS,Corp,BBG00N3BD9G0,USU25497AR66,US91282CKG59,DIS 7 1/8 04/08/28,WALT DISNEY COMPANY/THE,EURO-DOLLAR,7.125,FIXED,30/360,2,2,2019-03-20,2019-04-08,2019-03-20,2028-04-08,AT MATURITY,Sr Unsecured,10.285,US,USD,ACTV,9.05407255304586,4.0,2024-04-08,106.909,108.048,5.188,4.883,107.4785,5.0355,5.0346844270825395,12.007621115702598,3.8607012903597098,3.524188946496372,15.02919727961102
DIS,Corp,BBG00N3BZ921,USU25497AW51,US91282CJZ59,DIS 8.45 08/01/34,WALT DISNEY COMPANY/THE,EURO-DOLLAR,8.44999999999999,FIXED,30/360,2,2,2019-03-20,2019-08-01,2019-03-20,2034-08-01,AT MATURITY,Sr Unsecured,1.0,US,USD,ACTV,15.367556468172484,10.313483915126625,2024-04-08,123.831,124.87,5.403,5.288,124.35050000000001,5.3454999999999995,5.34519835561514,42.53134452798465,9.800816459965345,7.296230683858994,68.80599471848889
DIS,Corp,BBG00N55NLL7,USU25497BM60,US912810TV08,DIS 7.9 12/01/2095,WALT DISNEY COMPANY/THE,EURO-DOLLAR,7.9,FIXED,30/360,2,2,2019-03-20,2019-06-01,2019-03-20,2095-12-01,AT MATURITY,Sr Unsecured,0.501999999999985,US,USD,ACTV,76.70088980150582,71.64681724845995,2024-04-08,129.908,131.277,6.061,5.996,130.59249999999997,6.0285,6.028462373465299,109.90513366916697,32.949621195207754,18.304055389099965,626.9138853995815
DIS,Corp,BBG00N55NPV7,USU25497BN44,US912810TV08,DIS 8 1/4 10/17/2096,WALT DISNEY COMPANY/THE,EURO-DOLLAR,8.25,FIXED,30/360,2,2,2019-03-20,2019-04-17,2019-03-20,2096-10-17,AT MATURITY,Sr Unsecured,0.158,US,USD,ACTV,77.57973990417523,72.52566735112936,2024-04-08,133.747,135.288,6.149,6.077,134.5175,6.1129999999999995,6.112754843384027,118.2460730129735,34.395477026607125,18.185707607931644,623.6476785731923
VZ,Corp,BBG012MB8P10,USU9221ABY39,US91282CJZ59,VZ 2.355 03/15/32,VERIZON COMMUNICATIONS,EURO-DOLLAR,2.355,FIXED,30/360,2,2,2021-09-20,2022-03-15,2021-09-20,2032-03-15,CALLABLE,Sr Unsecured,37.83,US,USD,ACTV,10.483230663928817,7.9342915811088295,2024-04-08,81.149,81.219,5.297,5.284,81.184,5.2905,5.290543608367444,37.327073928048804,6.14685768907857,7.101374145725384,57.25797233371466
